book_id,titles,isbn,author,review source,average rating,review author,review content
707,Walk Two Moons,0060739495,Sharon Creech,Barnes and Noble,4.5,Anonymous,"This was a book that I totally judged by the cover at first, thinking it was boring. I was so mistaken. Walk Two Moons is a great book that everybody should take the opportunity to read, no matter your age. It's cute, and funny, and very enjoyable. I read this book in the 5th grade, and today, as I graduate from high school, it is still one of my favorite books."
707,Walk Two Moons,0060739495,Sharon Creech,Barnes and Noble,4.5,Anonymous,"Are you a crazy, spontaneous person?  Do your friends complain about how random you are?  Do you have trouble focusing on one thing for a long time?  If you answered yes to any of these questions, then Walk Two Moons by Sharon Creech is the book for you.  This is a story about a girl named Salamanca Hiddle, or Sal for short.  She is coping with many problems.  She is a farm girl who is moving to the city.  Her mother left the family for Lewiston, Idaho without saying why.  Sal and her father want her to come back very badly.  Sal decides to go on a road trip with her grandparents to Idaho to see her mother.  She tells a story to pass the time.  It's about a girl named Phoebe Winterbottom.  As the story goes on, it sounds very similar to Sal's life.  Meanwhile, Gram and Gramps get into all kinds of silly trouble.  Gramps tries to fix a woman's car and ends up disassembling the engine. The gang goes to a river and Gram is bitten by a snake.  They stop at many historical sights along the way.  This story is very random if you couldn't tell.  I would recomend this book to everyone.  It is different than other books.  It manages to intertwine two stories and show the similarities between them.  The book also throws in some interesting Native American quotes about life.  It manages to put laughter and fun along with sadness and tragedy.  Walk Two Moons is a book that you should check out."
707,Walk Two Moons,0060739495,Sharon Creech,Barnes and Noble,4.5,Guest,An AMAZING BOOK!!!!!!!! You will never want to put this   book down!
708,Eleven Minutes,0060589280,"Paulo Coelho, Margaret Jull Costa",Barnes and Noble,4.2,Guest,"I really enjoyed this book.  It really puts a different outlook on sex and love, and it makes you step back and think about not only the story but also your own life.  A must read!!!"
708,Eleven Minutes,0060589280,"Paulo Coelho, Margaret Jull Costa",Barnes and Noble,4.2,C-Castillo,"This is my first book by Paulo Coelho and I've become in love with his writing after reading ""Eleven Minutes"" Its a great story with a broader meaning , at least thats what I got from it. It has changed my outlook on life and in certain aspects I can relate to Maria. I would definitely reccommend this book to others."
708,Eleven Minutes,0060589280,"Paulo Coelho, Margaret Jull Costa",Barnes and Noble,4.2,valvintage,We always have questions about love and sex and sometimes forget to give ourselves a chance. This novel takes romance out of love and makes it even more meaningful. It is about personal aspirations and finding true love getting there.
709,Nine Stories,0316767727,J.D. Salinger,Barnes and Noble,4.3,Guest,"This book is amazing. Especially how jd salinger incorporates all the buddhist themes in it.  Thats not the only thing that makes this book great though, its the familiarity of it all.  When I read any of J.d Salinger's stories I feel like Im having de ja vu or something.  The name nine stories also relates to the saying that cats have nine lives.  If anyone is familiar with the Glass family, Seymore brings up the fact that he would like to be a dead cat.  (Relates to reincarnation too).  He's a genius and i recommend this book to anyone who's willing to take a closer look."
709,Nine Stories,0316767727,J.D. Salinger,Barnes and Noble,4.3,Guest,"i really like nine stories, but i dont think i understood the deeper meanings. I loved A Perfect Day For Bananafish and Teddy. Everyone should read it, because its good stuff."
709,Nine Stories,0316767727,J.D. Salinger,Barnes and Noble,4.3,Humxm,"This may be the best collection of short stories ever written--and I have read many collections.  While not everyone will understand all the stories on a first reading, each story will become more and more clear upon additional readings.  In fact, that is one mark of good writing: Is it an onion?--i.e., can it be read again (and again) revealing layers of meaning and insight.  Salinger's Nine Stories are full of layers and real people.  Both the stories and the people will become unforgettable.  A masterpiece."
710,"Julie and Julia: 365 Days, 524 Recipes, 1 Tiny Apartment Kitchen: How One Girl Risked Her Marriage, Her Job, and Her Sanity to Master the Art of Living",031610969X,Julie Powell,Barnes and Noble,3.2,ajt4,"I was excited to read this book.  What an amazing thing to take on in one year.  Cooking some of the hardest receipes out there by the great Julia Child.  I was excited to hear about how she figured it out all from a cookbook and no help.  

Instead - this was a self-indulgent look into a womans life that as I read further, I realized I didn't like.  Don't get me wrong - I don't care about the bad language.  I'm not giving this a bad rating over that.  

I found the writing to be disjointed, the story did not flow and I didn't laugh.  There were three major problems I had with the book.  

1.  The gross factor - I'm not talking about cooking livers or kidneys or brains.  I'm refering to the filth she lived in and cooked in.  When your kitchen is so disgusting that your sinks are backing up, your house is full of flies and you have a mass of maggots in your dish tray - the last thing you should be doing is cooking.  

2.  The political bashing.  While I appreciate everyone is entitled to their opinion, I don't think it belongs in a 'non-political' book.  If I want to hear the bashing - I'll turn on the news or read a political book.  In a book about cooking and life - there is no reason to continually go off on your political ramblings.  The criticism and the stereotyping of one group was just not needed in the book.  Each time this happened, I considered throwing the book out.  

3.  Julie as a person.  At the end of the day - I thought I might grow to like her.  She was self-centered, lazy, dirty and contributed nothing.  At the end of the book - she seemed even more self-centered, I didn't get a big message out of all of this so either she can't write or she didn't either and her contribution was a blog and a poorly written book.  Even Julia Child didn't like her.  If I were Julia Child - I wouldn't want this woman anywhere near anything I had done. Much less attach her name to mine.  

Such a shame as this could have been so much better. 

This book reminded me a lot of Eat, Pray, Love. Another book about a self-absorbed woman that was almost impossible to finish."
710,"Julie and Julia: 365 Days, 524 Recipes, 1 Tiny Apartment Kitchen: How One Girl Risked Her Marriage, Her Job, and Her Sanity to Master the Art of Living",031610969X,Julie Powell,Barnes and Noble,3.2,Guest,"From my perspective, Julie Powell's life wasn't worth the reading time it took out of my life.  I found the book title and premise misleading, since the work shared few cooking experiences and any relationship to Julia Child  was tangential, at best. While the author did use Child's recipes, she also had what I consider the audacity to 'make up' other material regarding the lives of Julia and Paul Child, which, even if 'inspired' by original material and acknowledged in the author's note, seems an obvious ploy at aligning her life with theirs. Anyone interested in the interesting and impressive life of the remarkable woman who was Julia Child would be better served by reading her own work,written with her grandnephew, Alex Prud'homme, 'My Life in France'. Quite frankly, Powell could have been using any cookbook for her excuse to write a blog, and then later a book, except it is clear that by associating her self with Child she seeks a status that is undeserved.      I rarely stop reading a book, but in this case I made an exception."
710,"Julie and Julia: 365 Days, 524 Recipes, 1 Tiny Apartment Kitchen: How One Girl Risked Her Marriage, Her Job, and Her Sanity to Master the Art of Living",031610969X,Julie Powell,Barnes and Noble,3.2,Rebecca81,"Julie opens the book with the acknowledgment that the Julia Child stories are fiction, then goes on to throw in a good dose of profanity, sex, masturbation, snide remarks about Republicans, condescension towards the elderly as well as the families of victims of 911--oh, and a little about cooking.  If I met this woman in person, I wouldn't like her!  I'm voting with my pocketbook and returning the book for a refund.  Do yourself a favor, and don't buy it in the first place.  This snarky style of witticism isn't for me."
711,"Unwind (Unwind, #1)",1416912045,Neal Shusterman,Barnes and Noble,4.5,Guest,"Imagine life in the future. The Second Civil War, also known as ¿The Heartland War¿ has been fought and eventually resolved by certain constitutional amendments known as ¿The Bill of Life.¿ So while human life may not be touched from conception until the age of thirteen, a child may be retroactively aborted between the ages of thirteen and eighteen. This process, known as ¿unwinding¿ doesn¿t technically end life, but separates all the body parts to be used for medical transplants. In this futuristic society, unwinding alters the meaning of life.    Unwinding is the fate set for three teens that meet by chance. Connor has always been a troublemaker, and his parents have finally had enough. Risa is a ward of the state, and budget cuts have forced Risa into this situation. Lev is the only one of the three who doesn¿t see unwinding as a terrible thing  rather, as a tithe, he accepts that being unwound is his purpose in life. In a deadly car crash, these teens escape the fate that awaits them at harvest camps and flee for their lives (although Lev is more of a kidnappee). In this incredible and thought-provoking novel, Neal Shusterman questions what it means to be human and the value of life.    Unwind may see like just a unique action novel, but it is so much more. The desperation, danger, and running-for-your-life sequences may thrill the action lover, but the story is more profound than that. It was actually quite difficult for me to read this novel because of the horrible atrocity called unwinding. Half the time, I couldn¿t even believe how inhuman some of the characters were to commit these morally wrong acts. What relieved me, though, was that for every bad thing, there was something good  the random acts of kindness strangers performed for the fugitives sometimes brought tears to my eyes. This novel revolves around the controversial topic of the pro-life/pro-choice debate, because it focuses on the sacredness of life. However, Shusterman does not take the topic from a religious or scientific perspective, but bases this book around moral everyone should have: everyone deserves the right to live and not just in the scientific sense that all your body parts are functioning, but living as a whole. All this was channeled into the lives of runaways who were slated to be unwound in this unforgettable story.    I can¿t really explain how amazing this novel was  you¿ll just have to read it for yourself to understand. Just know that although most of the novel was pretty depressing, the story ends on a hopeful note. Fans of The Host by Stephenie Meyer, the Uglies series by Scott Westerfeld, and Life as We Knew It by Susan Beth Pfeffer will also enjoy this novel."
711,"Unwind (Unwind, #1)",1416912045,Neal Shusterman,Barnes and Noble,4.5,Guest,"some people might find the plot to be a bit disturbing but i really liked how neal shusterman weaved the story together and made it all flow, unlike most nowaday authors who seem to drag forever!! and kind of lose the flow of the story, but in Unwind every single information has a significance and the book is very fast paced, everything happens so much in just 300+ pages...  READ IT!"
711,"Unwind (Unwind, #1)",1416912045,Neal Shusterman,Barnes and Noble,4.5,mnblack,"I dont think I expected much out of this book when I bought it. Buy it. Right now. This is a book for all ages, and I highly encourage everyone to read it. It's a tale of dispair, anger, and unlikely friends as well as enemies entertwining. It metamorphasizes into an epic journey of strength, courage, and hope. I don't believe I will find a more wonderful and truly touching book in the span of my lifetime."
712,"Drums of Autumn (Outlander, #4)",0385335989,Diana Gabaldon,Barnes and Noble,4.6,Anonymous,"Since I started reading this series, I have been compelled to continue even if I wasn't in the mood for Gabaldon's books. This book was definitely different than the first three. I enjoyed ""The Outlander"" but the next two books were quite a struggle for me to get through. I consciously decided to take my time on Drums of Autumn to ensure that I didn't confuse characters and muddle up story lines. In fact, it took me 6 months to read this book, and I really, really enjoyed it. The smaller stories within the book were so riveting this time. For the first time since starting this series, I am chomping at the bit to start the next book.

The only reason I gave this one four stars instead of five was the length of this book. I would have felt satisfied finishing about 3/4 of the way through. But otherwise, it was a great read."
712,"Drums of Autumn (Outlander, #4)",0385335989,Diana Gabaldon,Barnes and Noble,4.6,Anonymous,"I have just completed Drums of Autumn. Although it is long the only thing that was annoying for me was the overly long drawn out descriptions of some of the events especially when it came to Roger. It was too drawn out. I have started on the next book and that one repeats quite a few pages from this book before finally starting out. I hope its worth it, I would like to continue enjoying these books."
712,"Drums of Autumn (Outlander, #4)",0385335989,Diana Gabaldon,Barnes and Noble,4.6,madison-dixon,"Loved the first one could not put it down, I have read most of her books and I must say each new book seems to go on and on and on more and more! cut to the chase! it would make for better reading...."
713,"Prodigy (Legend, #2)",0399256768,Marie Lu,Barnes and Noble,4.5,majibookshelf,"Prodigy exceeded my expectations by a mile. We all know the middle book syndrome but Marie Lu managed to avoid that pit. Prodigy wasn't just good, it was spectacularly written, the plot was crafty, and so much better than Legend. Prodigy had its own main plot and it didn't aimlessly go on like some middle books. The stakes are so much higher here; we have an assassination plot, finding people, trying to start a revolution against the Republics, and a lot of backstabbing. What is surprising was alliances were formed that we wouldn't have expected, not in a million years.Prodigy is also told from both Day and June's POV. Don't go thinking there is much romance and a love triangle or square, because throughout the book, the romance was insignificant to me in comparison to the big plans going on. Yes, there is progression in the romance, some heartbreaks and a horrible cliffhanger, but for the most part Marie Lu stuck to the true meaning of the dystopian genre. I loved that Day and June spent a big portion of the novel apart because this way Lu was able to cover a big portion of the plot and more action.The direction of the plot that Lu took hooked me. The assassination plot allowed the whole book to progress in a way that kept the readers excited as well as allowed her to give us hints and here and there and create a few subplots, such as the relationship between Day and Tess. I also loved how Day and June have become &quot;celebrities&quot; in the eyes of the population and how Marie Lu used the whole revolutionary theme to free America in Prodigy.In terms of the characters, I found Day to be a tiny bit to be easily mistrustful of June and easily persuaded by the people around him. As for June, I think she out shined everyone in Prodigy. I have to admit that I wasn't the biggest fan of her in Legend but she stole my heart in Prodigy. She was kick butt, rational, logical, never lost sight of the plan and faithful. Tess, for me, was very annoying and a jealous kid throughout the whole novel and I just couldn't stand her. We also have the new Elector who I surprisingly warmed up to.All in all, I would highly recommend fans of Legend to pick up Prodigy as soon as possible, and for fans of dystopian novels who haven't picked up Legend, to do so as soon as possible! This series is one of the best dystopian novels I have read!"
713,"Prodigy (Legend, #2)",0399256768,Marie Lu,Barnes and Noble,4.5,Anonymous,Love love love it!!!!! When is the next book coming out? Lu has the right balance between romance and adventure. You learn a lot about June and Day. There're some very intersting twists and turns to the plot.
713,"Prodigy (Legend, #2)",0399256768,Marie Lu,Barnes and Noble,4.5,Anonymous,"That ending.
No
Just no.
My feels!
Asdfghjkl
I can't stop crying. 
AUTHORS, WHY YOU DO THIS TO US? Asdfghjkl"
714,King Lear,074348276X,William Shakespeare,Barnes and Noble,4.3,JohnLemon,"This review is not of King Lear itself (one of my two favorite Shakespeare plays, with the other being Othello), but rather on this edition of Lear (ISBN: 9781411400795), which was edited by Andrew Hadfield and David Scott Kastan. 

I read a lot of heavily annotated books, and I have to say that the Barnes & Noble Shakespeare editions have one of the best book designs I've ever encountered. The various references materials (footnotes and definitions for archaic words) appear in a manner that makes the text very easy to follow.

The scholarship is also top-notch. The annotations give you enough to make things clear without insulting your intelligence, or without overburdening you with unnecessary detail. The essays are also interesting and informative.

I've been avoiding Shakespeare ever since high school, which was many years ago. Now that I'm reading him again, I'm glad I'm in such good hands. It is making the experience a joy, rather than a chore.

My compliments to the editors and the book designer. They have done a superior job of making this difficult text accessible to the modern reader. Highly recommended."
714,King Lear,074348276X,William Shakespeare,Barnes and Noble,4.3,typoo,The Barnes and Noble edition of the plays are my favorites to read.  The format of the books is great.  No jumping around to read the footnotes and text explanatory notes unless I want to. The play speaks for itself and has for hundreds of years.  I highly recommend all the B&N editions of his plays.
714,King Lear,074348276X,William Shakespeare,Barnes and Noble,4.3,Anonymous,The Barnes & Noble Shakespeare editions are my favorites. The font and clean layout make them very readable and the notes are helpful without being distracting to the eye or burdensome to read. They are also very reasonably priced!
715,Death of a Salesman,0435233076,Arthur Miller,Barnes and Noble,3.6,Guest,"I have seen some really bad reviews here. Some said that Death of a Salesman was the worst book ever. Now I can imagine that some may not think as highly as I do of the book, but it can never be considered the worst ever. Those people obviously do not understand the true meaning and messages of the book, the things that maake Death of a Salesman a timeless masterpiece.     For you dumb shmucks out there, some thing the book was really about: communism; capitalism- in the cold and callous business world, personal connections and compassion and comprimised for profit and performace; trying to fulfill one's dreams with his children; escape from an undesirable life; sacrifice; -- just to name a few.     So, before you rip on a book, or anything, make sure you fully understand it."
715,Death of a Salesman,0435233076,Arthur Miller,Barnes and Noble,3.6,Guest,I read this book for an AP English Summer Reading assignment and quite enjoyed it.  It was a bit hard to follow at first but once you get started you start to understand more.  It's a sad but interesting story.  Warning: It's not for light readers there is depth to it so it requires a bit of thinking on the readers part.
715,Death of a Salesman,0435233076,Arthur Miller,Barnes and Noble,3.6,Guest,"Miller's play is an intimate study of the tragedy one family faces and their singular reaction to it.  The characters are so rich in their depiction of disillusionment, and they vividly exemplify the intense desire for an easier life.  I thoroughly enjoyed this play."
716,The Choice,0446579920,Nicholas Sparks,Barnes and Noble,4.3,Anonymous,"I picked up this book as something to read in my spare time, but it ended up gripping me for the two days it took to finish. It is the story of Gabby Holland and Travis Parker, two people destined to be together but are separated by heart-breaking choices. Sparks takes the reader through their meeting and falling in love, but Gabby has to choose between the boyfriend she's had for years and Travis, the man she's only known for three days. The story then leads to an even more unexpected choice that will bring you to tears. I recommend this to anyone who wants a quick and satisfying read."
716,The Choice,0446579920,Nicholas Sparks,Barnes and Noble,4.3,Lo-Garza,"I fell in love with this book. Nicholas Sparks is such an amazing author that I feel the need too read every single one of his books. He captures the center on the book and makes it seem a hundred times better than what it really it. I cried towards the end of the book, I'd read it again if I wanted too. This books taught me many lessons, and the lesson is: Never give up, life is full of amazing wonders but the most important wonder is LOVE."
716,The Choice,0446579920,Nicholas Sparks,Barnes and Noble,4.3,PrincessLulu,"I absolutely love this author. I was complety captivated in this book,
BUT, it also frustated the heck out of me. ""The Choice"" is not the choice we think it is. Part one felt like it was a whole different book from part 2, but it works. Sad, happy, relieved are just a few of the emotions that you will feel. 
It is a beautiful love story. I literally gave my husband a big kiss when he got home because it reminds you that love is so beautiful and so fragile. Such a great read."
717,The Hunger Games: Official Illustrated Movie Companion,0545422906,Kate Egan,Barnes and Noble,4.6,Anonymous,"This book gives you updates on the Capital fashions, the characters, and scenes. That isn't even the best part because the book has quotes and opinions from the cast."
717,The Hunger Games: Official Illustrated Movie Companion,0545422906,Kate Egan,Barnes and Noble,4.6,Anonymous,"This is a really good magazine it even tells you what Suzanne Collins thought of the actors. I think this is worth buying if your a big fan, I have been reading alot of reviews and some fans have been doing the team thing and some don't like that. So I say I'm sideing with Katniss SHE pick the best guy Peeta so really I'm not really on any team I'm just happy with who she married. Gale maybe a hottie but what he did in the last book was cold and for me I don't care how hot you are you can't change your heartless actions."
717,The Hunger Games: Official Illustrated Movie Companion,0545422906,Kate Egan,Barnes and Noble,4.6,Anonymous,This is the best book ever. You should buy it. I am totally going on opening night. So excited! Team Finnick! March 23. May the odds be ever in your favor! I would give it 100 stars... or more!
718,The Sound and the Fury,0000000000,William Faulkner,Barnes and Noble,4,McCarthy92,"William Fauklner's forth novel and considered by many to be his masterpeice, The Sound and the fury is an absolute great read.  A Challenging yet rewarding book, the novel contains 4 chapters, each narrarated by 4 different speakers, the three Compson brothers and the fourth is told in third-person.  The First chapter is told by the mentally retarded benjy.  The Second is told by the sad elder-child Quentin, and the third told by the mean and selfish Jason.  many consider benjy's chapter to be the most difficult, however, I found the chapter a lot easier than Quentin to be much more difficult.  The last 2 chapters were very simple.  One of the best books I have ever read I would recommend reading SparkNotes for a litle aid if you are new to these harder and more rewarding works of fiction."
718,The Sound and the Fury,0000000000,William Faulkner,Barnes and Noble,4,Guest,"William Faulkner brilliantly tells the inherent evil in the ignorance that humans establish in life through the Compson family.  The setting takes place in the South where one family will not change from their slave driven ways causing the downfall and torture of every member.  You will see the consequences of evil ways through:   Caddy, the beautiful yet tragically promiscuous daughter.  Benjy, the mentally retarded manchild who can't grow up  Quentin, the suicidal son who is tortured with the realization of the evil that exists within his family  Jason, the posessor of this inherent evil that has been passed down through his family    This book is one that captures the truth of what ignorance can truly cause.  It is dark novel that gives but a glimpse to what the humans can possess.  This novel is one that I only hope everyone takes the time to read."
