book_id,titles,isbn,author,review source,average rating,review author,review content
730,The Pearl,0142000698,John Steinbeck,Barnes and Noble,3.5,Jay_Battle,"In the book The Pearl by John Steinbeck, the main character Kino faces a dilemma after finding a pearl in the ocean. Kino and his wife live in a little village and, one day while diving, Kino spots something shiny stuck on a rock. Kino realizes it is a pearl and he chips it off of the rock. At first Kino didnt believe that there would really be a pearl in such a shell, but sure enough he opens it up and sees the pearl inside. The news spreads around the village and every one wants to see it. Village members, including friends of the family, are willing to do anything to get their hands on this pearl because of the wealth and power it would potentially bring them. Soon after the discovery Kino's son, Coyotito, is stung by a scorpion and soon becomes ill and Kino and his wife take him to the doctor in the city. When the guard at the gate sees the family approaching, he tells them the doctor is not there. The guard says this beacuse he sees that Kino will have no way of paying the doctor, until Kino tells him about the pearl. The doctor goes to Kino's house and ""cures"" Coyotito. After everyone has heard about the pearl Kino begins hearing things stirring in the night next to his hut and goes out to see what is causing the noise. This occurs twice in the story, and both times, Kino comes back covered in blood. Juanita, Kino's wife, knows that the pearl is no good and may even be evil. One night Juanita becomes so fed up with the pearl that she takes it and tries to throw it back into the ocean but Kino was driven by anger and beats her when he sees this happeneing. Overall, there are lots of tragic incidents in this story and the pearl brings nothing but problems, pain, death and the loss of family itself. The theme I see fit for this story is that basically, money and power can drive you to go to impossible measures, and that in the end, it isnt worth all of the strain it causes a person."
730,The Pearl,0142000698,John Steinbeck,Barnes and Noble,3.5,VanillaBean,"The Pearl is a classic by the excellent writer, John Steinbeck.  A simple story, yet filled with dramatic characters and events that kept me flipping the pages.  One of the best aspects of The Pearl is the writing.  John Steinbeck's writing is untouchable and classic.  I loved the Pearl and would recommend it to anyone who is looking for a classic book that shows culture and the value of materials and wealth over love."
730,The Pearl,0142000698,John Steinbeck,Barnes and Noble,3.5,WTVCrimeDawg,"The Pearl is an excellent tale--one of my favorites.  It's a simple classic that explores the depths of man's darkest nature.  The protagonist, Kino, is a young, poor pearler in tune with family and nature, but a tragic event exemplifies his discontent with life's meager offering for his oppressed little village.  Kino's luck dramatically improves when he finds the Pearl of the World.  Yet the Pearl summons the evil spirit of mankind, instead of bringing the fortune Kino desires.  Kino subsequently becomes suspicious of almost everyone, including his loving wife, for those who covet the Pearl will do anything to steal it.  Will Kino successfully protect his family and sell the Pearl before those who covet it catch him?  Is he willing to risk everything to improve his stake in life?"
731,The Exorcist,0061007226,William Peter Blatty,Barnes and Noble,4.5,Guest,"This book was exactly what I was looking for.  It fed me.  Page after page it delivered line after line of great storytelling, great characters and great setting.  It was eerie without being over the top.  It was informative without being boring.  It was powerful without being pretentious.  This is the ultimate horror novel.  It is the standard."
731,The Exorcist,0061007226,William Peter Blatty,Barnes and Noble,4.5,Anonymous,"Although Blatty has always described the Exorcist as more of a detective story, The Exorcist comes across as one of the scariest books, and films of all time.  It will tap into your deepest fears, and remains one of the few novels that has and will stand the test of time.  An instant classic !!!"
731,The Exorcist,0061007226,William Peter Blatty,Barnes and Noble,4.5,Guest,"This is a very well-written, suspenseful, disturbing, one-of-a-kind, horror novel. This is not for sissies! It is better than the well-known film. I recommend this for all fans of sheer ultimate horror   it is cleverly and expertly written. I dare you to read this and not get chills crawling up your spine..."
732,"The Short Second Life of Bree Tanner: An Eclipse Novella (Twilight, #3.5)",031612558X,Stephenie Meyer,Barnes and Noble,3.9,rach35marie,don't buy this book if you have a nook -- Myer is putting a pdf version up for free on her website just save the pdf to your docs and you can read it on your nook
732,"The Short Second Life of Bree Tanner: An Eclipse Novella (Twilight, #3.5)",031612558X,Stephenie Meyer,Barnes and Noble,3.9,TJ-Light,"Honestly I'm excited for this book, I loved the Twilight Series & this just adds to the story. FYI, for those of you that don't know this book will be available to read online for free as stated by Stephenie Meyer from June 5, 2010 (realease date) to July 5, 2010, but if you do buy the book $1.00 will be donated to the American Red Cross! The book will be available to read online for free at www.breetanner.com and you may read Stephenie Meyer's excerpt about the book at www.stepheniemeyer.com."
732,"The Short Second Life of Bree Tanner: An Eclipse Novella (Twilight, #3.5)",031612558X,Stephenie Meyer,Barnes and Noble,3.9,Anonymous,"I'm sorry to have to agree with the masses (not my thing), but Ms. Meyer should really, really finish Midnight Sun. I'm currently re-reading Twilight (for the millionth time) and subsequently re-reading Midnight Sun for about the same number of times because they are so inseperable and intertwined. I'm on page 234 of Midnight Sun and the dread of knowing it will soon end before we get to the meadow saddens me, AGAIN. We know how Bella feels and what she thinks in each scene and Midnight Sun tells us how Edward feels and what he thinks up to that meadow scene. I enjoy the little things...like the knowing smiles and odd looks each has when in the others' company. This is just wrong on so many levels to cheat us out of that and give us...Bree? Why? I'll agree with someone else here who posted that this was a slap in the face. It really feels like that. As if Ms. Meyer said to herself 'they'll take any crap I dish out, so here take this and leave me alone'. Wow."
733,Snow Falling on Cedars,067976402X,David Guterson,Barnes and Noble,4.1,songcatchers,"Snow Falling on Cedars is a beautifully atmospheric love story/murder mystery. It takes place on San Piedro Island off the Pacific Coast. The story alternates from the trial of a Japanese American on trial for murder in 1954 to the background stories of the relevant characters leading up to WWII and after. Snow Falling on Cedars brings up questions of loyalty, racism and forgiveness. The mood of the novel matches it's scenery, dark and stormy. The love stories are passionate and emotional. The writing is beautifully descriptive. David Guterson brings the island of San Piedro and it's inhabitants vividly to life in a novel I'll not soon forget."
733,Snow Falling on Cedars,067976402X,David Guterson,Barnes and Noble,4.1,Anonymous,For those born after WWII this book explores the Japanese experience of the camps. I would recommend this book to young adults and high school students. It is well written and a pleasure to read.
733,Snow Falling on Cedars,067976402X,David Guterson,Barnes and Noble,4.1,Anonymous,"A good book that starts slow but has deliberate plot and character development. Great care is taken to give extensive background and setting to a decent story.  Issues of lost love, racism, fear and intolerance are at the forefront with an ending that is satisfying, if not surprising.  A good read."
734,Roots: The Saga of an American Family,0440174643,Alex Haley,Barnes and Noble,4.8,Guest,"Whatever parts are fact or fiction, it's obvious the world needed this book -- but especially black and white Americans.    It lays to bare the horrific exploitation of slavery whose effects continue to this day.  Race was used an excuse to dehumanize an entire continent of people for greed.  Haley successfully re-humanized the enslaved to provide an accurate portrayal of slavery's victims.    Similar books are still needed for a variety of aggrieved people who have suffered the worst effects of colonialism.  But Haley probably accomplished his goals better than anyone else could have dreamed."
734,Roots: The Saga of an American Family,0440174643,Alex Haley,Barnes and Noble,4.8,Guest,"Even if the dear professor above says this book is fiction, one can not dismiss the fact Alex Haley was an exceptional writer.  This is the only book I've ever read that I've literally screamed aloud and thrown across the room.  While I didn't think it was purely autobiographical, I got the feeling that it wasn't so far from the mark with the history of African Americans in the USA.    It's erroneous to dismiss Haley as one of the greatest writers of our times simply because some of the story ideas where slightly amelgamated into Roots.  You can say the same thing about John Jakes 'Love and War' and Tolstoy's 'War and Peace'.  Being inspired by a story is not the same as plagarizing and as it says in one of the oldest books on the planet, 'There's nothing new under the sun.'    They said the same about MLK with plagarism and I question the motives.    If you liked this book, also read his biography of 'Malcolm X'.  Spike Lee did a major disservice to Haley's writing in the movie version as it didn't capture the sheer magnitude of the man like Haley did."
734,Roots: The Saga of an American Family,0440174643,Alex Haley,Barnes and Noble,4.8,krystalsbooks on LibraryThing,each i time i reread this i am awe struck by its power.
735,Batman: The Killing Joke,0930289455,"Alan Moore, Brian Bolland, Tim Sale",Barnes and Noble,4.3,Guest,"It stands out as one of the most amazing Joker stories in the DC Universe. Alan Moore has created one of the most phenomenal and chilling contributions to the legacy of Batman's archnemesis, creating what may be the most subscribable backstories for the villain. The horrific, mesmerizing sequence in the fun house, as Gordon's sanity is put to the excruciating test, is arguably one of The Clown Prince of Crime's greatest transgressions against humanity. Buy it."
735,Batman: The Killing Joke,0930289455,"Alan Moore, Brian Bolland, Tim Sale",Barnes and Noble,4.3,Jayden-Raynor,"Creepy and thrilling, this is the ultimate in comic book stories. It explores the Joker's psyche in a truly fascinating way and, in his attempt to turn Commissioner Gordon as crazy as himself,  unravels the timeless villain in a way never done before."
735,Batman: The Killing Joke,0930289455,"Alan Moore, Brian Bolland, Tim Sale",Barnes and Noble,4.3,regan-jokeria,"probably one of the best graphic novels i've ever read. the ending had me guessing and this is now in my permanent library. i recomend it for any Batman fan, or anyone looking for a good read."
736,Invisible Man,0679732764,Ralph Ellison,Barnes and Noble,4.1,Guest,"When I first began reading this book, I admit that it was almost overwhelming...so many pages. But as I continued I realized that the journey was necessary. It was a time that needed to be fully understood in all it's primal glory. Racism truly has permeated society. A great book and great read!"
736,Invisible Man,0679732764,Ralph Ellison,Barnes and Noble,4.1,clearwatersflowafter,"I read it over 10 years ago.  But it is one of only a handful of books that has stayed with me for years. It significantly changed my understanding and compassion for the black experience in America.   It is the descent of an man into obscurity...hidng in plain sight.  The haunting images from the book of eyes passing over yours in a crowd, no hint of a recognition of shared humanity, of not being noticed, of being ignored due to preconceived stereotypes were very powerful.   Mr. Ellison put into words some thoughts that hover in the background, but rarely reach consciousness."
736,Invisible Man,0679732764,Ralph Ellison,Barnes and Noble,4.1,Anonymous,"This was a good read.  What a tremendous journey.  This was read for a class.  i have to be real honest in that I have really never read anything in this style.  It was stimulating, and I found myself reading every chance I had.  The invisibility that was portrayed and discovered had an impact on me as a person."
737,A Long Way Gone: Memoirs of a Boy Soldier,0374105235,Ishmael Beah,Barnes and Noble,4.3,iluvvideo,"This book chronicles the childhood of young Ishmael in Sierra Leone. A fairly normal childhood until he is forced to run into the jungle as soldiers attack his village killing everyone they can catch and looting and burning the rest.

For a short while flanked by others his age in similar situations he survives life constantly on the run. Then he is captured by a group of soldiers and retrained to think right and to be a soldier in the conflict. Some of the 'retrainee' soldiers are only 8 or 9 years old! Are these rebels trying to overthrow the government? Or the army protecting the citizens? Turns out not to matter. Each side is equally brutal and vicious. There is no good guys, only bad. He learns to fight, shoot and kill as well as the real soldiers. And to help avoid any feelings or reflection on his activities he is given access to various drugs to 'amp' him up further. 

By the grace of whatever higher power you choose to believe in, he gets selected for deprogramming and entry back into society. Not an easy task, but due to the incredible efforts of UNICEF and others it is finally done. Find out what has become of this young man and his new life. It is an unbelievable story.

If it all wasn't the truth. No punches spared. No letting himself off easy after his actions. Most poignantly the story is clearly written by a child.No ghostwriters to neaten it up. You get the whole horrible story from the raw emotional perspective of a 12 year old! I know I would not have survived as well as he has did. You can't help but cry as you turn the pages and confront one terror after another. Everyone should read this book!"
737,A Long Way Gone: Memoirs of a Boy Soldier,0374105235,Ishmael Beah,Barnes and Noble,4.3,drummerboy,"In Ishmael Beah&rsquo;s A Long Way Gone, he presents the ideas of living in poverty in Sierra Leone, Africa, as well as finding a method to survive in times of hardship. Beah has an approach to the writing that leans toward expository, though he still crafts a well-written memoir. Beah&rsquo;s purpose of writing this novel is to let us feel his emotion through the perilous events rather than having the emotion given to us.
A Long Way Gone is a memoir (pointed out in the novel&rsquo;s subtitle Memoirs of a Boy Soldier), though the writing does not express a full rendition of a memoir. Beah often lingers off into expository writing, where he informs us of impactful situations instead of showing us true feelings about them. Even though Beah feels strong opposition towards the war, he approaches it in the calmest of ways when he writes. Of course, A Long Way Gone is not for the sensitive reader; it should appeal more to readers who have read a similar book about poverty or hardship in the past. For me personally, A Long Way Gone sends some mixed messages when it comes to reading a piece of writing revolving around war and the extreme efforts to survive through it. However, this novel has a powerful impact on the way I think of discrimination and the terrible lives of the crippled and poor.
As the author, Ishmael Beah&rsquo;s premises for A Long Way Gone are wrapped around his amazement at how he managed to survive or transport to the United States alive. It was his willingness and urge to write about his experiences that gave us A Long Way Gone. 
To sum it up, the story raises issues such as constant depression in the war, where people are forced to survive in harsh conditions while being savagely treated by their enemies. This is a common theme in the book. Quite accordingly, the author emphasizes this theme through the description of hard-to-bear situations such as not being fed, not being protected, and not being the hunter of the game, but the hunted.
The clearness of A Long Way Gone is good enough so that you can recognize characters and their personalities, as well as events, themes, patterns, and significant information. It is also clear enough to see that the book&rsquo;s life-threatening situations are having an impact on Beah. If Beah&rsquo;s ultimate goal in writing this book was to expose the injustice of the war and leave it exposed, then I&rsquo;d say he achieved that goal."
737,A Long Way Gone: Memoirs of a Boy Soldier,0374105235,Ishmael Beah,Barnes and Noble,4.3,jlasagna,"A long way gone is an amazing story about a 12 year old boy named Ishmael Beah, who wants to be a rapper, living in a war torn country. He experience many hard ships through his life including graphic killings, horrific scenery, drug use, and lose of his family members. He is being chased by the ruthless rebels who want to take over the country and is backed into a corner. With hard times and with little combat training by the government he takes his gun and decides to fight back. His only options are kill or be killed.

	This book was an amazing book. It opened my eyes to how real and horrible some countries are. Young kids not even teenagers being forced to fight, snort cocaine mixed with gun powder, and watch people they love die gruesome deaths on a regular basis is just mind blowing to me. This book is not your average fairy tale. It is a very graphic and real book but if you are looking for something to open your eyes to what is really going on out there, this is the book for you"
738,"Mrs. Frisby and the Rats of NIMH (Rats of NIMH, #1)",0689862202,Robert C. O'Brien,Barnes and Noble,4.5,barena19,I grew up with Mrs. Frisby and think children of all ages will love her as well. I think all children boy and girl alike can relate to her and enjoy the story.  Definitely a must have for all children.
738,"Mrs. Frisby and the Rats of NIMH (Rats of NIMH, #1)",0689862202,Robert C. O'Brien,Barnes and Noble,4.5,Sentimentalist,"My sister has a pet rat that she adores, and to surprise her, I wanted to find a book that portrayed rats as the inteligent creatures that they are. A friend recommended this book to me, and I found the book on tape at the library. It was so fascinating! My entire family loved it! I was impressed at how the author was able to answer every single question that I had (such as how could the rats find tools small enough to use, small technical stuff that most authors fail to explain) The story was incredibly intricate, but never failed to be interesting and slightly humorous. I recommend this book to anyone."
738,"Mrs. Frisby and the Rats of NIMH (Rats of NIMH, #1)",0689862202,Robert C. O'Brien,Barnes and Noble,4.5,Guest,This book is wonderful. I love it. It is very entertaining and shows a clear point of view from a mouse. My favorite part was when one of the rats tell Mrs. Frisby about how Johnathan Frisby helped the rats. It answers my questions about Johnathan Frisby. It is very sad that he died. This book was so good I could not put it down.
739,Different Seasons,0751514624,Stephen King,Barnes and Noble,4.4,jseger9000,"Different Seasons is a showcase for Stephen King. Four diverse novellas, only one of them the kind of horror tale he is synonymous with (and it may be the weakest of the bunch).

The book is divided into four 'seasons': Hope Springs Eternal (Rita Hayworth and the Shawshank Redemption), Summer of Corruption (Apt Pupil), Fall From Innocence (The Body) and A Winter's Tale (The Breathing Method). The tones of the stories alternate between light and dark, with Apt Pupil perhaps being the darkest thing he has ever written.

Rita Hayworth and the Shawshank Redemption is a mini-masterpiece of a tale. A tale of hope set in a prison, dealing with a man whose spirit remains free despite all obstacles. I'd originally read it years before the legendary movie, and was worried that it wouldn't be quite the same reading it now. Luckily King's narrative holds up. Even knowing what was coming, the story telling was as gripping as ever.

Apt Pupil. I was almost dreading rereading Apt Pupil. A well written but morally disturbing tale of the mutually parasitic relationship between a young California golden boy and the Nazi war criminal he has blackmailed. It is an excellent dark thriller, but it is so powerfully written and so pitch black, you are kept in suspense while feeling the need to cleanse yourself of the story being told. I remember the 'Bachman book' Rage felt a little like this, but Apt Pupil provokes a much stronger reaction and is a better book overall.

Third up is The Body which was famously (and very faithfully) adapted into the movie Stand By Me. This is Stephen King's coming of age tale of four boys in 1960 who head out through the woods to find the body of a boy that was struck by a train.

Though all four of the stories are top-notch Stephen King, I believe I enjoyed The Body the most. King so expertly captures the bittersweet feeling of the boys, two of which at least understand that they are going through a life changing experience; that things will not be the same from here on.

The Breathing Method is the closest to Stephen King's 'typical' supernatural spook story. This one (appropriately dedicated to Peter Straub) seems to be King's answer to Straub's Chowder Society (see Straub's Ghost Story), as it deals with a group of old men that belong to a mysterious 'gentleman's club' where they tell each other stories.

Earlier I called The Breathing Method the weakest story here. It is, but please don't take that to mean that the story isn't worth reading. It is a good read that only pales because the other three stories shine so brightly.

This is the book I would loan to someone who looked down on King without reading any of his work. He shows that while he can write some very scary spook stories, that isn't why he sells so many books. Each of the four stories is King writing at the top of the game. There's a reason three of the four stories have been turned into movies and they are three of the best screen adaptations he's had."
739,Different Seasons,0751514624,Stephen King,Barnes and Noble,4.4,Anonymous,"The book contains four of Stephan King's short stories, plus an afterward by the author himself. One of the stories, ""The Body,"" was the basis of the beloved 1980's film ""Stand By Me,"" starring River Phoenix, amoung others. The movie was definetly the reason I purchased this book. The short story is just as good, if not better than the movie. It really lived up to my expectations. If you haven't read the story of seen the movie yet, I'd reccomend both!"
739,Different Seasons,0751514624,Stephen King,Barnes and Noble,4.4,B_Brennan,"Stephen King keeps me waiting for more. I love stort stories and King is a master. I keep this book bedside and read until all hours! I tend to read his short stories and novellas in Esquire and elsewhere, plus one of these stories turned into the movie: Shawshank Redemption. I like Kings more recent books: less gory and more psychological and science fiction-ish!!"
741,The Girls' Guide to Hunting and Fishing,0143035479,Melissa Bank,Barnes and Noble,3.7,Anonymous,"This book started out ok but just got more disconnected and uninteresting as it went. it jumps from different stages in the character's life. i did not like how it was not in chronological order. overall, i would not recommend this book."
741,The Girls' Guide to Hunting and Fishing,0143035479,Melissa Bank,Barnes and Noble,3.7,Guest,I loved the main character and found the   humor fresh and interesting.  The short story   format did enhance the originality of the   piece and I look forward to Ms. Bank's   next novel with glee.  I hear they are making   a film out of the final short story.  It will   doubtless be interesting to see how they   handle the inner dialogue..
741,The Girls' Guide to Hunting and Fishing,0143035479,Melissa Bank,Barnes and Noble,3.7,seane on LibraryThing,"I really enjoyed the beginning and middle, but not so much the end."
742,"Wool Omnibus (Silo, #1)",0000000000,Hugh Howey,Barnes and Noble,1,Anonymous,Bought on accident. Not actually Wool but some rip off clif notes thing...
742,"Wool Omnibus (Silo, #1)",0000000000,Hugh Howey,Barnes and Noble,1,Anonymous,"I wish I had read the reviews prior to buying.  Like others, I purchased this thinking it was the actual book not a 42 page summary.  This is a scam."
742,"Wool Omnibus (Silo, #1)",0000000000,Hugh Howey,Barnes and Noble,1,Anonymous,$10 for 42 pages. Ever think you've been cheated? I do.
743,"Lamb: The Gospel According to Biff, Christ's Childhood Pal",0380813815,Christopher Moore,Barnes and Noble,4.5,James Rogers,"Having read ""Fluke"" and ""Lust Lizard,"" I was already a big Chris Moore fan. But as a Christian, I fully expected to be offended by this book. Didn't happen. Sure, there's some strange stuff here -- wouldn't be Moore if it wasn't . But in the end, he pretty much gets it right! I found myself at times wiping away the tears of laughter and thinking, ""Ya know, it coulda happened just like that."" Maybe.  I teach Sunday School and Bible studies, and I believe every Christian with a sense of humor should read this book! Those of you who don't have a sense of humor should probably skip it."
