book_id,titles,isbn,author,review source,average rating,review author,review content
679,Madeline,0590133373,Ludwig Bemelmans,Barnes and Noble,4.7,Anonymous,I+am+grateful+to+have+read+this+book.+Many+words+of+the+different+characters%2C+especially+Circe%27s%2C+have+touched+my+life+and+makes+me+curious+about+my+own+future.+It+is+important+though+to+focus+on+the+here+and+now+for+then+we+are+truly+living.
679,Madeline,0590133373,Ludwig Bemelmans,Barnes and Noble,4.7,Anonymous,Surprisingly thorough and melodic with the stir.
680,Think and Grow Rich: The Landmark Bestseller - Now Revised and Updated for the 21st Century,1585424331,Napoleon Hill,Barnes and Noble,4.4,Anonymous,"In 1968, I was in the Seattle Airport waiting to go to Alaska to work in the oil field.  I was 21 year old, had two children in Texas.  I had a high school education, which is still the only formal education me or my wife have every received.  I was broke and my only prospects were working in the oil field the rest of my life.  I bought two books that day that changed my life.  Think and Grow Rich; and How to Win Friends and Influence People.  Over the next year working in weather down to 70 below zero my life changed from the information I received from these two books.  I was no longer on a road to nowhere.  I had a goal.  We goal now was to have a well round life and become a millionaire.  
I am 62 years old now.    My Net Worth is around 10 million dollars. I am currently an investor.  I owe three companies that others run for me.  I own the real estate that these companies sat on.  My office is in my home.  I average working about one hour a day before I go to the golf course.   
My wife works about an hour per day at her office in our house.  We choose to spend that time checking on our businesses.  My wife plays tennis most every day.  We vacation 6 or 8 times a year.    We have been married 43 years.  Our family life is great.   Last week we took our children and grand children to Disney World for a week.  Life for us is very very good.  
If I had stayed on the path I was headed in, I would be lucky to be alive.  Working in the oil field in Alaska's North Slope was very dangerous.  My family life was not all that good when I read these two books.
I encourage you to read these two books at least three times each and apply the principles they give you.  These books changed my life to one of great happiness and prosperity.  I hope they do the same for you."
680,Think and Grow Rich: The Landmark Bestseller - Now Revised and Updated for the 21st Century,1585424331,Napoleon Hill,Barnes and Noble,4.4,EJAT,"Think and Grow Rich:  The Complete Classic Text [the original version of the book copyrighted 1937] is a gift from the publisher to fans of Napoleon Hill's teachings and writings.  I had read the 1960 Copyright version literally 12 times cover to cover, and I also have read Think and Grow Rich:  The 21st-Century Edition.  It was a treat to read the original version, written back in the midst of the Great Depression, and with hints/signs of a recovery in the air [applicable to our own times in 2008-2009].  To Napoleon Hill, a Positive Mental Attitude and thought control of one's own mind by will-power are all-important to personal success.  The six-step dynamic plan to convert desire for riches into their financial equivalent on pages 26-27 is alone worth the price of this landmark book, and can be used for any goal, financial or otherwise."
680,Think and Grow Rich: The Landmark Bestseller - Now Revised and Updated for the 21st Century,1585424331,Napoleon Hill,Barnes and Noble,4.4,White-Orchid,"This book should be on every bookshelf in every home.   The principles that are taught in this book ""Think and grow Rich"" are more about the directions of life than just the collection of riches.

This is a book that needs to be digested and not simply read casually.

Eternalize this book and you will give your life new direction and meaning."
681,"Little House in the Big Woods (Little House, #1)",0060885378,"Laura Ingalls Wilder, Garth Williams",Barnes and Noble,4.6,Anonymous,In 3rd grade I had this complete series read to me.  Now I am sharing it with my girls during Lit. lessons as we homeschool.  I am so glad they are loving the story.  My 7 year old has been reading it on her own and I read it to them for about 15 minutes so that my 6 year old gets the story also.
681,"Little House in the Big Woods (Little House, #1)",0060885378,"Laura Ingalls Wilder, Garth Williams",Barnes and Noble,4.6,Guest,"This novel is a sure joy to any child that loves to read and brings a warmth that is very hard to capture in many other stories. As i read, the book seemed as if it was glue in my hands. To stop reading was extremly difficult.  The detail in the story makes you feel as If your there with the Ingalls Family. Word by word, step by step, if you were to travel back this book would be able to tell you how to preform everyday tasks as if someone was there with you. The story line alone was very entertaining and original.   I highly recommand this book to young girls because the story will certianly amaze them."
681,"Little House in the Big Woods (Little House, #1)",0060885378,"Laura Ingalls Wilder, Garth Williams",Barnes and Noble,4.6,Guest,"Get this - I read this book after my mom read it after her mom told her of her grandma's life on the fronteer in the west.  This is a book that all children should read of the way America once was when there was something new to discover over every hill and mountain, as well as in every forest and in every field."
682,Jonathan Strange & Mr Norrell,0765356155,Susanna Clarke,Barnes and Noble,4,Guest,"Jonathan Strange and Mr. Norrell is not just a book about magic  it's much more than that. As the story progresses we're compelled strangely by the slow but smoothly progressing story of this interesting novel in three parts. It is fueled namely by the tensions that build between Strange and Norrell, whose personalities are essentially polar opposites. In an only too human way Strange, we find, becomes so intent on eclipsing Norrell's magical talents that he even neglects his own wife. Rather than throw it in the reader's face, it views the history of the time: how women were treated (namely Strange's wife) comes into play here. Susanna Clark has handled her story with a finesse I don't see much in the literary world anymore, because she has this rare talent of hiding her themes underneath the story without entirely rushing the reader with them. It's the patience with which she builds her story that interested me so. This is what we need more of: a love for story telling, because when a work of fiction is approached in earnest with this type of enthusiasm the work transcends--like it should--mere escapism."
682,Jonathan Strange & Mr Norrell,0765356155,Susanna Clarke,Barnes and Noble,4,Guest,"I both enjoyed and was thoroughly frustrated by this book.  Each chapter taken individually is an entertaining and well written piece, and so I can't say I was ever bored while reading it.  The characters are quirky and interesting, the concepts at play are fun and inventive, and the narrative style contains a dry tongue-in-cheek humor that I loved.      However, this book is over 800 pages long, which is fine, but long books need a sense of an overarching plot unfolding as you go, and sadly that is missing from this book.  While I was generally entertained as I read, I was frustrated as I got to pages 300, 400, etc that the book just seemed to be rambling without going anywhere.  When the book did begin to pull all the loose ends together, it happened abruptly and ended fairly quickly, relative to the hundreds of pages of loose set-up that preceded it.    In the end, I'm glad I finished reading it, and the ending was satisfactory.  But it took me about 5 months to read, mostly because the lack of plot made it easy to put down and didn't offer a strong incentive to pick it back up again.  Memorable story and characters, but it drags.  Recommended only to those with great patience and a love of mild British humor and social comedy."
682,Jonathan Strange & Mr Norrell,0765356155,Susanna Clarke,Barnes and Noble,4,Joel_M,"This definitely isn't your typical fantasy novel. Readers who only like the ""swords and sorcery"" fantasy sub-genre will hate it. This book feels like Charles Dickens and Jane Austen decided to collaborate on a fantasy novel after reading ""On Fairy Stories"" by Tolkien, ""That Hideous Strength"" by Lewis, and the ""Discworld"" novel ""Sourcery"" by Terry Pratchett. 

Most of it is set in England during the Napoleonic wars. There are some elements of alternate history as characters include real people like King George III, Napoleon Bonaparte, and the Duke of Wellington. However, in Clarke's world, England has a grand history of magic and dealings with fairies. At the point where the book picks up, no one has actually practiced magic or had dealings with fairies for at least a couple hundred years . . . until Mr. Norrell shows up and, later, Jonathan Strange.

Like the works of Austen or Dickens, the story is more character-focused than plot-driven. It kind of meanders its way (with occasional flurries of action or sudden surprises) through about 10 years as the two magicians seek to recover and restore English magic. The language is a bit old-fashioned, but with a very light tone and some dry/deadpan humor. There are lots of little ""scholarly"" footnotes citing (invented) sources and giving little snippets of ""historical"" occurences (usually involving fairies) that help give the book a feeling of depth.

Despite the light tone, much of the book is dark and gothic. The fairies in the book are not the cutesy-Tinkerbell-Disney fairies who are tiny, mischievous-but-generally-good people with pretty little wings. They are the older version of fairies from English/Norse folklore . . . not necessarily small, nice, or sane (by human standards) and fond of abducting any human who strikes their fancy or strays into places they should not. Add to all this a prophecy of the ""Raven King"" (the founder of English magic who once ruled Northern England and will someday return) and you've got yourself an amazing fairy tale!"
683,A Bend in the Road,0446696137,Nicholas Sparks,Barnes and Noble,4.4,Rhiannon Grubbs,"I love Nicholas Sparks' books and out of all of them this is my absolute favorite, by far! They should make a movie based on this book, like if u agree :))"
683,A Bend in the Road,0446696137,Nicholas Sparks,Barnes and Noble,4.4,Anonymous,So many twists and turns! I love the small town life. This is a touching love story with alot of emotion and unexpected moments. You can not go wrong with Nicholas Sparks! Loved this book!!
683,A Bend in the Road,0446696137,Nicholas Sparks,Barnes and Noble,4.4,Ahn,"Nicholas Sparks' interpretation of romance and misery gives the reader a chance to indulge in the story of a middle-aged mans pain, love, and his glimpse of happiness before another turning point. The author draws in the reader, giving the audience a chance to become a part of the story line. As well as feeling the pains of the characters, the hopes and happiness, and the will to live on. This book would be recommended mainly for young teenage girls because the storyline is based along the lines of romance and mystery that will most definitely catch young girls' attention in this heart-wrenching story."
684,"The House of Hades (The Heroes of Olympus, #4)",1423146727,Rick Riordan,Barnes and Noble,4.6,Anonymous,The book makes you feel like everything you read should be real! Say yes if you Rick Riordan is the brst Auther!
684,"The House of Hades (The Heroes of Olympus, #4)",1423146727,Rick Riordan,Barnes and Noble,4.6,Anonymous,"A real book series. Most of what I read, turns out to suck. I declare Rick my favorite author. He knows how to captivate his readers, put them into his world. He really can cause a uproar too, but that's behind me. I would highly recommend this book for fast, engaged readers. Slower readers might have trouble with this series, mainly the use of latin and long chapters. Good plot lines, so far. Great cliff hangers, and wonderful tie of mythology. Can not wait to see what Rick pulls off next. Overall, wonderful! Again, highly recommend it. Ready to be thrilled and consumed? I'm sooooooo ready."
684,"The House of Hades (The Heroes of Olympus, #4)",1423146727,Rick Riordan,Barnes and Noble,4.6,Anonymous,A really good book series and can't wait for the new book!
685,"Gone (Gone, #1)",0061448761,Michael  Grant,Barnes and Noble,4.5,Hallxyz,"If you ever wanted a book to replace your current favoite, this is it. I was given this book by accident and it was the greatest accident of my life. Imagine if every single person over the age of fourteen just disappeared. That's what happnes in the smal coastal town of Pedro Beach. And Sam Temple somehow is running it all. But he doesn't realize that people (besides him) have powers, super speed, telekinessis, teleportation, and super strength, just to name a few. And when an evil kid named Caine comes into the town (which is covered in a giant dome) Sam has to dicide whether to buy into Caine's to good to be true story,or keep guard and protect the kids of Pedro Beach. This book has too many good elements to even type, so all I can say is read GONE!!!"
685,"Gone (Gone, #1)",0061448761,Michael  Grant,Barnes and Noble,4.5,Ozzy12,Great read that kept me up at night. Would make a great movie
685,"Gone (Gone, #1)",0061448761,Michael  Grant,Barnes and Noble,4.5,Guest,"PROS!!!!  (1)Typically, I try to avoid books that have multiple characters¿ perspectives, but Michael Grant interweaved the stories of the characters in an easy to follow fashion.  (2)I was also impressed by Grant¿s ability to perfectly imitate the mind of a teen: usually, author¿s make their teen characters come to conclusions that an average teen wouldn¿t have thought to keep the story line going but Grant¿s characters¿ realistic choices made this book believable.  (3)Branching off of my previous statement, in this book the mutations and super powers were left unexplained which adds to realness of the story.   (4)Another significant aspect of the book was its detail in comparison with its length. As you probably are aware of, this book is 558 pages.  Most books that I have read that are that long usually cover months, some years, but  Gone only covers a span of 12 days. The detail spent on each day creates such a vivid picture that I can completely picture Perdido beach  as if been there several times before.  (5)The most powerful and mighty of all characters in this book is a severely autistic four year old. Not only is it an unusually and unexpected twist to the plot line, it provides several challenges: the challenge of teaching him how to use his power, figuring out how to make him aware of his environment, and allowing him to save the world without putting him at danger.     CONS!!!!!  (1) I didn¿t like how the wolves were able to speak. I understand that the idea isn¿t any more far fetched then the teen¿s having superpowers but  its just hard to accept and is the only thing keeping me from fully accepting the possibility of this actually occurring.   (2) The book would have been a better read if it had at least one segment in Little Pete¿s perspective. It would have provided an interesting viewpoint and a better understanding.  (3) I thought that overcoming the blink was a little bit to easy and if was really just a matter of saying no to a temptation, a couple of adults would have been able to survive.     Overall:  The book was an exciting and quick read and I¿m looking forward to its sequel."
686,"The Wedding (The Notebook, #2)",0446615862,Nicholas Sparks,Barnes and Noble,4.4,Anonymous,"""The Wedding"" is a sequel to Nicholas Sparks' well known novel, ""The Notebook"". However, calling it a sequel is techincally incorrect because it doesn't continue the story of Noah and Allie, but instead, it is a story of their daughter and her marriage. Like many couples would experience, Wilson and Jane found something missing in their marriage. Wilson realized that he spent too much time working, and too little time at home. The distance between him and his wife had grown over the year, and he was afriad that it would be too late for him to fix the marriage. Wilson was still deeply in love with his wife, therefore he turned to Noah for advice. Noah is known as ""the hopeless romance"", but will he be able to help Wilson? What will Wilson do to rekindle the love between him and Jane? As in many Sparks' novel, a surprising twist is waiting in the end, and it is not an ordinary Sparks' twist (don't want to spoil too much). I highly recommend ""The Wedding"", and if you haven't read ""The Notebook"" yet, you should (but it's not required because this could be a stand-alone novel). Also, ""Message In A Bottle"", ""A Walk To Remember"", and ""Dear John"" by Nicholas Sparks are also highly recommended!"
686,"The Wedding (The Notebook, #2)",0446615862,Nicholas Sparks,Barnes and Noble,4.4,BASE,"THIS BOOK WAS ABOUSLTY BEAUTIFUL!!! I COULDN'T PUT IT DOWN..I LOVED HOW ROMANTIC THIS BOOK WAS. THE ENDING OF THIS BOOK SURPRISED ME, DIDN'T KNOW IT WAS COMING...
I LOVE NICHOLAS SPARKS....HE KNOWS EXACTLY HOW TO EMBRASS YOU INTO HIS BOOKS AND TO KEEP YOU WANTING MORE..I WOULD RECOMMEND THIS BOOK TO ANYONE THAT LOVES TO READ...KEEP THE BOOKS COMING!!!!!"
686,"The Wedding (The Notebook, #2)",0446615862,Nicholas Sparks,Barnes and Noble,4.4,Anonymous,This was a well written story from the husband's point of view that I greatly appreciated. I saw my husband of 35 yrs in this and it has made me fall in love with him again.
687,1776,0743226720,David McCullough,Barnes and Noble,4.3,Guest,"In my opinion, this is a must read for every American and especially those who enjoy American history. It is amazing to see how common, ordinary men and women, who believed in the right of liberty and freedom from tyranny, overcame tremendous obstacles against a major world power to achieve their goals.  David McCullough brings it all to life as he painstakingly describes the people, the battles, and the consequences of their actions. It is extremely heartwarming to see and feel the perseverance of these early settlers in overcoming extreme odds and suffering when they could have easily given up and succumbed to British rule.  They even had to fight within their own ranks against the Tories and Loyalists who put personal gain above independence.  I completed the book this week just as the John Adams miniseries is airing on HBO, which is superb as well.  Thank you David for a wonderful work that serves to remind all Americans and others as well of the price we paid for freedom and   of the inalienable rights of all men everywhere."
687,1776,0743226720,David McCullough,Barnes and Noble,4.3,Victor24,"I don't usually give out perfect scores for movies or books because let's face it, even a great one probably won't be perfect.But 1776 is absolutely perfect.  From page one it pulls you in and takes you along for the ride.  This is not a history book, this is an event.  It reads like a movie and tells the dramatic story of the American Revolution. Perfect marks, across the board. I'd recommend this for anyone who likes a good adventure/war story, regardless of whether or not they're a history buff.  It's that good."
687,1776,0743226720,David McCullough,Barnes and Noble,4.3,Pattifiddles,1776 was recommended to me by a friend that received her Phd in history.&#160; I explained I needed a history book for a non historian - yet something that would help me grasp early American History - this is it!!!
688,Under the Banner of Heaven: A Story of Violent Faith,0330419129,Jon Krakauer,Barnes and Noble,3.9,Guest,"As a native Utahn I am very familiar with the teachings of the LDS faith, have lived among Mormons'with little confrontation' most of my life, and do understand how members of the Mormon faith can easily take this book out of context and be offended by its theory. But one has to understand that the author clearly explains that the FLDS and the LDS are in fact very different, and he simply gives a general 'and well researched' history of how the FLDS church evolved from the mainline Mormon church, to supplement the story of the Lafferty Murders. If one'particularly LDS members' dive into this book with an agenda already in mind, I guarantee you will not like it one bit. But if one is purely interested in history and fact with an OBJECTIVE point of view, this will be an exceptional read."
688,Under the Banner of Heaven: A Story of Violent Faith,0330419129,Jon Krakauer,Barnes and Noble,3.9,PatsyAnn,"A thought provoking look into the world of the lives of those living within the extreme Mormon sects.  The book includes interviews with those who have lived in these sects, some as victims and some who were convicted of crimes.  The book goes back and forth from the founding of the Mormon Church and it's history and that of the fanatical sects that left the official church.  A powerfully moving book with a wealth of information pertaining to the Mormon Church and of the leaders and lives of those living within the fringe sects.  This book will astonish you on many levels.  It will be disturbing at times.  I feel this book was well written and extremely informative.  A book to read if you are interested in a part of our society that most people might not even know of."
688,Under the Banner of Heaven: A Story of Violent Faith,0330419129,Jon Krakauer,Barnes and Noble,3.9,CoppellBookLady,"Great book.  I have read every Krakauer book to date and am a real fan.  I am still not sure why he. an admitted agnostic, wrote a book critical of the Mormom faith rather than his normal on-the-edge adventures.  Even though, the book is atypical for Krakauer, it was a great read interweaving the history of the Morman religion with the recent fundamentalist break-off sects.  Krakauer's research is impeccable and he presents his information in a very interesting, easily understood and enjoyable fashion.  We read the book for our Book Club and had a great discussion of all of the issues.  I look forward to reading Krakauer's next book with ledgendary Pat Tillman as the primary subject."
689,Beautiful Ruins,0061928127,Jess Walter,Barnes and Noble,3.8,JanTX,"I work in a bookstore, go through books like water, and share all kinds of recommendations with customers.   I read British and Scandinavian mysteries, heavier novels like &quot;Freedom,&quot; literate non-fiction---generally, everything from best-sellers to classics.  So I'm not a book snob, but don't tend to read  the lightest of light, either.  I loved the Dragon Tattoo series, and all of Elizabeth Strout's books.  
Sometimes I plow through rewarding, beautifully written books.  But I do tend to whine a bit about this question--why can't authors write books that are entertaining, with mesmerizing characters, interesting settings, relationships between people that are real, flawed, but occasionally deep, and compassionate?.A story that makes me laugh, blink with recognition, and want to cheer out loud for the characters?  But where the story doesn't pretend life is not what it really is, either, so that I can't believe it.  Then I picked up Beautiful Ruins.  And there it was.  Buy this book, savor it, and encourage Jess Walters to keep writing."
689,Beautiful Ruins,0061928127,Jess Walter,Barnes and Noble,3.8,lindianajones,"This is a novel of utmost grace and beauty. It spans the decades from World War 2 to present day. It leads you lyrically through Italy and the United States. It trips through the automobile industry, the film industry and the writing industry. It drives you through learning Italian, teaching Drama and living your life. It takes you from the bottom of the worst bits of life to the peak of the ultimate best parts. A wonderfully delicious novel for all five senses. I read this book in two days, unable to put it down. Well worth the buzz it is getting."
689,Beautiful Ruins,0061928127,Jess Walter,Barnes and Noble,3.8,Anonymous,I am a voracious reader-at least two books a week.  I loved this book-it is the best work of fiction I've read all year.  It was beautifully written with wonderfully developed characters.  It was one of those novels that you're sad to see end.  I will be looking for other works by Jess Walter.
690,The Audacity of Hope: Thoughts on Reclaiming the American Dream,0307237699,Barack Obama,Barnes and Noble,3.8,Guest,"Absolutely amazing. Although I disagree with some of   Obama's views, he presents them in a way that requires   one to reexamine their ideas and beliefs. For every   argument he makes, he shows a real-world example and   provides a practically flawless arguement. I am a high   school senior and he writes in such a way that I   understand the issues he's discussing, even if I hadn't   previously deeply thought about them. This should be   required reading for AP Government classes."
