book_id,titles,isbn,author,review source,average rating,review author,review content
1237,The Shell Seekers,051722285X,Rosamunde Pilcher,Barnes and Noble,4.3,Anonymous,"Working in Africa for years, I am exposed to many heartening stories.  Yet this one is done so smoothly and thoroughly to allow us to feel connected and learn more about the realities of refugee existence, war, transitioning to a new country like America, and then ultimately giving back to the Sudanese village that truly has needs.  

I appreciate the story told to the various persons Achak meets in his daily encounters in life in America. As so many immigrants and refugees do, especially a dark tall Sudanese man, they get asked so many questions about their lives.  It was easy to picture him at the health centre chatting about his incredible history in the most simple of terms to a woman on her way to her seemingly meaningless challenges in comparison - to lose weight, get one more mile in, lift an extra five pounds, etc. She could never understand in a two-minute chat, unless she reads the book!"
1238,What Is the What,1932416641,Dave Eggers,Barnes and Noble,3.9,Anonymous,"Disappointed. 

Perhaps because it was translated, I found the language to be somewhat disjointed - much like the plot. The story is quite brief and not much is actually divulged within it. The plot is scattered and somewhat difficult to follow, while the story itself has many elements that are not cohesive. Having read all of the wonderful reviews, I was expecting quite a bit more from this book.  Honestly,  I found it to be rather vulgar at times and not because of the gore. Certainly not a masterpiece in my mind."
1238,What Is the What,1932416641,Dave Eggers,Barnes and Noble,3.9,ekorrhjulet on LibraryThing,"Remarkable! Very short, and so well written  that not a word is superfluous. The very first sentence foretells the death of the protagonist, and the rest of the novella is the story leading up to its inevitable end. It is an exasperating tale, where every glimmer of hope is extinguished as soon as it's lit. The fate is already sealed."
1238,What Is the What,1932416641,Dave Eggers,Barnes and Noble,3.9,ex_ottoyuhr on LibraryThing,"Unlike _One Hundred Years of Solitude_, this book is actually comprehensible. But if its quality's any indication, _One Hundred Years_ must not be worth bothering with either..."
1239,Chronicle of a Death Foretold,140003471X,"Gabriel Garc??a M??rquez, Gregory Rabassa",Barnes and Noble,4,Zhumei on LibraryThing,"This book has 6 short stories.In A Scandal in Bohemia, Holmes tried to take back a picture from Irene Adler.I thought she was very clever and interesting.And I was surprised at holmes doing anything for his work."
1239,Chronicle of a Death Foretold,140003471X,"Gabriel Garc??a M??rquez, Gregory Rabassa",Barnes and Noble,4,nanoc on LibraryThing,"In this book, a woman who Holmes seemed to love only in his life is appeared.Her name is Irene Adler.One day a mask man visit Holmes.He was a king of Bohemia.His request is finding diamond.On the way to investigation,Holmes met her.She is very beautiful and clever.The brain tactics of Holmes and Adler are highlights in this story.Two people are very very clever!!You may not see next scene.You should read it once!!"
1239,Chronicle of a Death Foretold,140003471X,"Gabriel Garc??a M??rquez, Gregory Rabassa",Barnes and Noble,4,arisak on LibraryThing,"I could enjoyed this book very much. Holmes' speculations were interesting. When he solved a problem and explained the trick, I really felt good. I'll read other books about Homes."
1240,"A Scandal in Bohemia (The Adventures of Sherlock Holmes, #1)",0582416396,"Ronald Holt, Arthur Conan Doyle",Barnes and Noble,3.9,SBrizek,"I like Bill O'Reilly very much. He has done the people a great service by having many who know little or nothing at all about the subject of this book induced to learn about it and perhaps to become interested in that subject in a way that never would have been possible had not HE been its author. But those folks deserved better.

I am someone who knows a great deal about this subject and, as such, when reading this book, contrary to never feeling as though I could not put it down, I found myself instead periodically feeling like throwing it across the room. Why? Because of the agonizingly regular appearance of errors. Errors matter because when one comes across information which, despite years of study of a subject, appears to be new, instead of celebrating the discovery of that new information or the appreciation of having understood an old story from a new perspective because of that new information, one is left with the overriding suspicion that the new information is not new at all, but only appears to be so because it is not true.

Some examples: Booth did not bore a peep hole in the wall of the hallway leading to the Presidential Box at Ford's Theater, he bore that hole in a door, a door which is there at Ford's Theater to this very day for anyone who visits the site to see for himself. Did Mr. O'Reilly visit Ford's Theater?

Mr. O'Reilly concludes his account of the surrender at Appomattox by observing that Grant and Lee would never meet again, when, in fact, they met the next day and conducted follow-up surrender negotiations on horseback, and met again in 1869 when Lee visited the White House to confer with Grant after he became President.

Mr. O'Reilly tells of Grant, upon returning to Washington from City Point, going over to the White House to see Lincoln and meeting with him in the Oval Office. There was no Oval Office in 1865, and there would not be one until the 20th Century. Grant met with Lincoln in Lincoln's office on the second floor of the White House where today is located the room called the ""Lincoln Bedroom"".

Details like these are important: Why else include them in the book in the first place? When details worthy for inclusion in the book are inaccurate the inaccuracies matter when they accumulate to the point where the credibility of the entire enterprise is put at risk and the book's reliability becomes suspect.That point is reached in this book.

The book needed vetting it never received, and suffers as a result. The folks who read this book and put it down having learned a story they never before knew or fully appreciated might now be inspired to learn more about that story. The regret is that Mr. O'Reilly did not do a better job of giving them the head start he probably intended for them to have in order to succeed in that worthy effort."
1240,"A Scandal in Bohemia (The Adventures of Sherlock Holmes, #1)",0582416396,"Ronald Holt, Arthur Conan Doyle",Barnes and Noble,3.9,JohnCharlesBerry,"This review is written by John Berry, author of ""A Night of Horrors,"" a historical thriller on the 24 hours of Lincoln's assassination.

O'Reilly and Dugard have written a book on the assassination that is part thriller and part history book.  Their stated intent was to write ""a thriller"" but one that remains ""unsanitized and uncompromising"" in its veracity.  Though the title indicates that the book will focus on the assassination itself, it actually covers a span of several months, including the weeks leading up to the day of the shooting and the months following when the conspirators were rounded up and tried.  While the facts and sequences discussed in Killing Lincoln are mostly accurate, the narrative moves along quickly and breezily, which makes for a quick read.  The problem for me is that the subject of the book is weighty and meaningful, but the narrative skims along the surface.  While O'Reilly and Dugard touch on many themes and issues that America faced as it struggled to end the bloodiest war in our history and reinstate the rebel states, they treat none of them in depth.  They touch on a few of the many conspiracies that Americans love to debate when it comes to the Lincoln (and Kennedy, for that matter) assassinations.  They raise many questions or potential themes, but delve into none in great detail or with any satisfaction.

Also, the authors continually narrate from the viewpoint of how events unfolded.  So every action of Lincoln, in particular, are interpreted and painted with a fatalistic brush.  For instance, we have this on the morning of the shooting.  ""Every aspect of Lincoln's early morning has the feel of a man putting his affairs in order:  reading the Bible, jotting a few notes, arranging for a last carefree whirl around Washington with his loyal wife, and setting his son on a path that will ensure him a successful future.  All of this is done unconsciously, of course, but it is notable.""  In reality, Lincoln did many of these things every morning of the war.  His habit, as the authors themselves point out, is to read from the Bible daily.  He often went first to his office to tend to paperwork and then downstairs for breakfast.  His carriage ride with his wife and his advice to his son occur because the war was coming to an end and not because he knew it was the last day of his life.  But the authors can't seem to help themselves in over-writing and over-noting how coincidental things look in the light of the assassination.

The narrative is often painted with purple prose.  My favorite is the opening to Chapter 32: ""Two thousand years after the execution of Jesus, there are still many unanswered questions about who was directly responsible for his death and what happened in the aftermath.  And so it is, on Good Friday 1865, that a series of bizarre occurrences will take place.""

All in all, the book proves a frustrating read for a serious historian as it never dives too deeply into issues, characters, or themes.  In their attempt to write both a history book and a thriller, they don't quite achieve either.  ""Killing Lincoln"" does have a strong narrative drive and raises conspiracy questions that will prove of interest to some readers.  But I came away feeling that O'Reilly and Dugard had missed the mark and never really provided any new insight or emotion into one of the most important 24 hour periods of our country."
1240,"A Scandal in Bohemia (The Adventures of Sherlock Holmes, #1)",0582416396,"Ronald Holt, Arthur Conan Doyle",Barnes and Noble,3.9,Anonymous,"I don't have all night to list the errors in this book. Save your money and just purchase ""They Have Killed Papa Dead"" or ""Manhunt"" for accurate portrayals of the events surrounding Lincoln's assasination. I can't believe O'Reilly is touting this book on talk shows as ""ALL TRUE."" Just a few examples of errors....1) He states Grant and Lee never meet again after Lee surrenders at Appomatox. False - they meet the next day to go over details and also again after Grant is president. 2) Chapter 40 states that Phillip Barton Key is married to a woman and is killed by her LOVER, with whom she is having an affair. This is backwards....Phillip Barton Key is the LOVER, not the husband, although he is killed by the husband. As a side note, the husband/killer is Dan Sickles, a former Union General who is the first to use the defense of ""Not Guilty by Reason of Temporary Insanity"" for his murder of Key. 3) The book states Booth blocked the door with a music stand. If O'Reilly simply went to Ford's Theater, he could see the wooden stick on display RIGHT NOW that Booth used to block the door. 4) The book states that Booth drilled a hole in the door the same afternoon that he killed Lincoln, so he could view Lincoln that night before assasinating him. This is a myth that is disputed also by visiting Ford's theater. The manager had drilled the hole long before that night to be able to view all of his VIP guests to ensure they were happy. 5) The book claims the actress who cradled Lincoln's head in her lap, and thus had his blood all over her dress, was haunted by this the rest of her life. In fact, she later held parties and modeled the dress to party attendees to show it off. Even later still, she cut up parts of the dress to give away as souvenirs to her favorite relatives and friends. 6) O'Reilly describes Mrs. Lincoln wore a gray dress to the play, when in fact she wore a black taffeta dress. 

As stated previously, there were too many errors to detail every one in this review. It was sloppy research, if there was research at all. Well-respected non-fiction writers use footnotes, but there are none in this book. Even in history class, I had to use footnotes on papers I submitted. I was looking forward to reading this book, but was seriously disappointed!"
1241,Killing Lincoln: The Shocking Assassination that Changed America Forever,0805093079,"Bill O'Reilly, Martin Dugard",Barnes and Noble,3.6,Anonymous,"It shocks me that anyone could find this book anything less than breathtaking. Admittedly, the first third or so of the book takes some getting used too;  Lahiri is leaping into territory that will be simply unfamiliar with many readers, and the time she takes to  lay her foundeation will likely strike some as tedious.
That being said, once you are through the first 4 chapters or so, the book simply takes flight. The winding journey of each of her characters is so painful, so human, I could not pit the book down, and at times, I openly want to weep. I honestly think this book is as stunning as Lahiri's other work, perhaps her greatest, most significant work yet. If you have not read this cover to cover, I would do so as soon as you can."
1241,Killing Lincoln: The Shocking Assassination that Changed America Forever,0805093079,"Bill O'Reilly, Martin Dugard",Barnes and Noble,3.6,Anonymous,"How could people not finish reading this book?  It's a intriguing story that is character driven within some interesting settings.  All in all, a good read!"
1241,Killing Lincoln: The Shocking Assassination that Changed America Forever,0805093079,"Bill O'Reilly, Martin Dugard",Barnes and Noble,3.6,Anonymous,"Each sentence is carefully measured, resulting in a haunting beauty. I found myself yearning to fill the void and find resolution for several characters. This book is a gem."
1242,The Lowland,0307265749,Jhumpa Lahiri,Barnes and Noble,4.6,Lesara,"I picked up this book after extreme hesitation. The cover art just seemed wrong to me and the title wasn't to promising. But when I finally bit the bullet I was not disappointed. The book is one of the few books where I have laughed out loud. It is also very suspenseful and has plenty of action scenes. The plot is great and the characters such as Will and Halt are great. You wish you could just live in their world for a day and meet them. 
Flanagan does a great job and this book is one of my favorites in my library."
1242,The Lowland,0307265749,Jhumpa Lahiri,Barnes and Noble,4.6,Guest,"I picked this book up by chance because the cover intrigued me - boy am I glad!  I love serial books where I can follow characters throughout their adventures and this one is great.  Wonderful character development, interesting plot, and great dialogue."
1242,The Lowland,0307265749,Jhumpa Lahiri,Barnes and Noble,4.6,MrX,"I dont expect anybody to give this review a good rating, but i really liked the series"
1243,"The Ruins of Gorlan (Ranger's Apprentice, #1)",0142406635,John Flanagan,Barnes and Noble,4.4,TeensReadToo,"Chilling. Even many days after reading WINTERGIRLS, I still shiver when I think about this book. Lia has struggled with an eating disorder before. Her parents think that she is getting better, but she is just fooling everyone. When Cassie, who used to be her best friend, dies, Lia spirals out of control again. She eats less and less and begins seeing Cassie's ghost everywhere. WINTERGIRLS explores the world of eating disorders with vivid, horrifying detail. Even though this book was really creepy, it was also spectacular. I had never understood how or why some people began to have eating disorders, and this book gave a spectacular insight into their state of mind."
1243,"The Ruins of Gorlan (Ranger's Apprentice, #1)",0142406635,John Flanagan,Barnes and Noble,4.4,Anonymous,"Not only was this book an excellent portrayal of a teenager with anorexia but it also was a an extensive view into the mind of a cutter and someone who deals with hallucinations. This book may be hard to read for some people. If you are thinking about reading it, make sure that you are...i guess mentally prepared for it. It can be extremely heart wrenching. But if you do decide to read it...you won't be disappointed. I loved reading every minute of it. Lia's character is sarcastic and can be quite funny at times. I would recommend this book to anyone."
1243,"The Ruins of Gorlan (Ranger's Apprentice, #1)",0142406635,John Flanagan,Barnes and Noble,4.4,SeeMichelleRead,"Laurie Halse Anderson is not one to shy away from difficult topics. Her debut novel Speak deals with the issue of teen rape was lets just say it was incredible. In her latest, Wintergirls, Anderson deftly addresses the devastating effects of eating disorders.

Wintergirls is the story of Lia who daily fights a battle between herself and food. She's already been hospitalized twice for her eating disorder where she played the 'recovery game' until doctors and parents were satisfied and gave her enough breathing room to go back to her old habits. It's the one thing Lia constantly concentrates on in the midst of divorced parents who are too busy to notice her and school that doesn't really matter. How many calories (or lack there of) each day. How much she exercises. But then Lia begins to face the realities of her choices when she finds out that her (ex)best friend, Cassie, who also had an eating disorder, has died. As she stumbles deeper into grief, Lia tries to determine not the reason why Cassie killed herself, but why not?

What amazes me is how accurately Anderson is able to portray a teenager who feels constantly at odds with her family, herself and especially food. She is so isolated, so alone with the pain and destructive feelings in her head it seems to the reader she'll never be able to pull herself out. Lia's isolation is underscored by her nightly visits to supersecret and honestly so competely depressing online chat groups for anorexic/bulimic girls who discuss their struggle to lose that last 10, 15, even 25 pounds. Nameless girls who like Lia try to control the chaos of their lives by controlling their body.

Wintergirls was not an easy read nor was it easy to put down. I alternated between pity, depression and down right horror at the things Lia put herself and consequently, her family through. Though this is a teen novel, I would hesitate to give it to just any teen girl - it's something that needs to be digested with a little bit of maturity and sensitivity. But was it a heartbreaking beautiful novel that will stick with me a long time? Absolutely.

seemichelleread.blogspot.com"
1244,Wintergirls,067001110X,Laurie Halse Anderson,Barnes and Noble,3.7,Anonymous,"My first Grisham read was the Brethren. I have read many of his since, and while all are good this one sticks in my mind the most. you could'nt ask for a more brilliant plot to a story.If you are a Grisham fan, a mystery fan, and love conspiracy, you will love this book."
1244,Wintergirls,067001110X,Laurie Halse Anderson,Barnes and Noble,3.7,TheShort1,"An interesting twist on a crime story: the men involved in a scam to make money are already in prison and were judges and lawyers, meanwhile a major power play is being hatched out by the head of the CIA to elect the next President of the U.S.."
1244,Wintergirls,067001110X,Laurie Halse Anderson,Barnes and Noble,3.7,Guest,I take my time with good novels and never speed read an author such as Grisham.  His wording and vocabulary are superb  to the point that you can feel the character's heartbeat.  This really is a great book.  I am surprised by the negetive reviews.  I've had it for two years now and it is always one I re-read while waiting on the next thriller.  The story line is the same but I never tire of it.  And so it goes I remain a fan forever.
1245,The Brethren,0385339674,John Grisham,Barnes and Noble,4.2,Guest,"I will agree with some of the other reviewers that the 3rd book in the series came across....lacking compared to the first 2 books. I found Fitz actions over the top sometimes, ridiculous others and downright ignorant most of the time. The new characters were a bit of dissapointment also. As for the ending, I would definitely agree that it dragged on to the point of forcing myself to finish the book. I feel odd giving this review because the past 2 books were sensational but I felt this book was tired and weak compared to the first 2. Still great to some levels but overall not as sharp as the others."
1245,The Brethren,0385339674,John Grisham,Barnes and Noble,4.2,Guest,"I must say that I am surprised by the reviews for this one. I think Robin Hobb is a sensational writer. The characters were likable and complimented each other in the first two books of this series. And then came this book. Ugh...very, very, very disappointed. Kettle and Starling fit into this story like the Pope at a porn star convention. Fitz' stay with the other Witted was lacking and, I felt, was incomplete. The search for the Elderlings dragged on terribly. The ending, while uncoventional, left me disappointed because of the dragged out search and creation of the Elderlings that preceded it.     Great first 2 books + bad last book = good series."
1245,The Brethren,0385339674,John Grisham,Barnes and Noble,4.2,deesy58,"This is the third, and last, book of the ""Farseer"" trilogy.  It is written in the style of Stephen R. Donaldson, with the main character possessing the attributes of an anti-hero.  FitzChivalry is blissfully unaware of the events swirling around him.  He ignores the advice of his mentors, stumbling perpetually into one ambush or unfortunate incident after another.  He seems totally unable to plan, to assess his environment, to perceive danger, or to make reasoned decisions.  He fails to exercise due caution, even though he is aware that enemies are seeking to kill him.  This calamitous book is almost painful to read.  The only anticipation available to a reader is the wonder as to what kind of mess our hero will find himself in next.  The ending is a bit anticlimactic.  The book is, however, well-written with very few editing errors.  The story is well-told and entertaining.  The main character's denseness and lack of awareness make him unsympathetic in my opinion."
1246,"Assassin's Quest (Farseer Trilogy, #3)",0553565699,Robin Hobb,Barnes and Noble,4,Guest,Levin weaves a tale of mystery and suspense in this deeply disturbing novel that I highly reccomend. Levin's to-the-point and matter-of-fact way of writing creates a unique contrast to the deeply unsettling content of 'Rosemary's Baby.'
1246,"Assassin's Quest (Farseer Trilogy, #3)",0553565699,Robin Hobb,Barnes and Noble,4,Guest,It was so good! it usally takes me forever to read a book but I read this one really fast i could Not put it down.Its not really scary it more suspensful!
1246,"Assassin's Quest (Farseer Trilogy, #3)",0553565699,Robin Hobb,Barnes and Noble,4,Anonymous,"Reads like some of the most eccentric entries from The New Yorker. Much like Talk of the Town, the story slowly unravels from the pictaresque beginnings of a couple apartment hunting in NYC, to Rosemary's feminine hysteria manifested throughout her pregnancy. 

Ira Levin just knows how to craft the proper thriller, ending every chapter with reader left with the want of knowing what will happen next. Classic gothic horror that doesn't rely on cheap tricks to further the plot or tension. The occult topics are never overkilled."
1247,Rosemary's Baby,0451194004,Ira Levin,Barnes and Noble,4.4,Themetra,"I read this book a few years ago and I couldn't put it down.  I swear I read for two days straight.  I was never a big Stephen King fan, because I find his work to be a little creepy for me, then my friend lent me this book and was amazed when I handed it back to him three days later and said it was the best book I had ever read!"
1247,Rosemary's Baby,0451194004,Ira Levin,Barnes and Noble,4.4,pmejia,I am a huge Stephen King fan and this is an oldy but a goody to me! Just reread this on my Nook and was really happy to revisit this story!
1247,Rosemary's Baby,0451194004,Ira Levin,Barnes and Noble,4.4,diettx,"The Talisman is a top favorite of all the books I've read and not just my favorite Stephen King book.  If you like to be transported by fiction - this is the book for you!  I have read this book three times over several years and I just bought it for my Nook so I can read it again and keep it pristine. It has everything; good versus evil, wide-eyed wonder and wide-eyed terror and the characters are amazing and truely unforgetable.  I am envious of the people who have just started reading it.  You will be amazed!"
1248,"The Talisman (The Talisman, #1)",0375507779,"Stephen King, Peter Straub",Barnes and Noble,4.2,Guest,"Having read many of the other reviews on this, the eighth book in the Wheel of Time Series, I fearfully began this book expecting disappointment. I was happily dissuaded!    The Path of Daggers is every bit as entertaining and captivating as any of the previous seven volumes. There is NO falloff in style, action or any other quality that marked the previous seven installments.    Buy this book!"
1248,"The Talisman (The Talisman, #1)",0375507779,"Stephen King, Peter Straub",Barnes and Noble,4.2,Guest,awsome book!!  Jordan's entire series is one of the best fantasy reads  Rivals even Tolkien
