book_id,titles,isbn,author,review source,average rating,review author,review content
581,"Scarlet (The Lunar Chronicles, #2)",0312642962,Marissa Meyer,Barnes and Noble,,none,none
581,"Scarlet (The Lunar Chronicles, #2)",0312642962,Marissa Meyer,Barnes and Noble,,none,none
582,"Rich Dad, Poor Dad",0751532711,Robert T. Kiyosaki,Barnes and Noble,4.6,BookBreather,"I wanted SO badly to love this book. Crescendo, the second book in the series, ended on a note that left me and everybody else hanging on the edge of our seats. There was so much potential for this book, but I had a very difficult time really getting into it. It took me a few hours each to read the first two books in the series, but it took me almost three days to read Silence. For a while, I wasn't sure why. Then I figured it out. 


First of all, all we do throughout this book is basically re-learn all the information we were given in the first book, Hush, Hush. Some of the character's in Nora's life were obviously keeping things from her, but she didn't know what exactly they were hiding. The problem: The readers DO know. Nora spends almost the entire books trying to unravel information and events that we already know. 


Second of all, I was more than halfway through the book and Patch had only come into the picture TWICE. I'm not sure if Becca Fitzpatrick was trying to prove that the books would be good even without Patch, but I found myself looking ahead to figure out when was the next time Patch would come in. Because while he is not the biggest part of this story, he is HOT and us fangirls want to see A LOT of him. 


Now, in the two books preceding this, I never really had that much of a problem with Nora. A lot of people did, but I didn't mind her that much. But in Silence I swear she got even more stupid, self-centered, and whiny. Seriously, most of her thoughts throughout the novel consisted of, ""Omg. My life sucks. I can't remember anything. Wah wah wah."" I mean, I can understand that you'd obviously be upset about losing your memory, but we didn't need to be reminded every thirty seconds. To make matters worse, Nora didn't really think of anyone other than herself. Sure, she helped Scott a few times and worried about her mother. But she snuck out anyway, knowing that if her mother found out she would probably have a heart attack. She was so wrapped up in her own self-pity that she forgot to warn Scott about a few VERY important things. And when she figured out that Vee and her mother were hiding things from her it was all, ""How could they do this to me? Blah blah blah."" Like maybe they didn't care about her or have a very good reason for omitting information. 


Nora reminded me of the girl that when you're watching a scary movie, you're thinking, ""Yeah, that's smart. Go upstairs and hide in a closet where there is absolutely no room for escape."" Despite everything, she continuously made stupid decisions. She claims to love Patch, but she can't obey ANYTHING he freaking tells her to do. He asks her to stay in a house for a little while, and she goes out to assist a guy with a major target over his head. There were several times throughout this novel when I actually said out loud, ""Oh my god. Why are you so dumb!?"" 


Having said all that, Becca Fitzpatrick is very good with a story arc. Her rising and falling of action was very good. 


This book could have been condensed into a few chapters. There was only about one important event that really furthered this story, and I am extremely disappointed. I am really glad that this is not the final book in the series."
582,"Rich Dad, Poor Dad",0751532711,Robert T. Kiyosaki,Barnes and Noble,4.6,Abby97,"When I first read Hush,Hush I fell head over heels in love with Patch from the begining. When I finlly got my hands on Silenece I couldn't put it down. In silence you'll see a much sweeter side of our favorite bad boy. Over all an excellent book. I can't wait for the next book!Patch and Nora Forever!"
582,"Rich Dad, Poor Dad",0751532711,Robert T. Kiyosaki,Barnes and Noble,4.6,Tribute_Books_Reviews,"An angel gets his wings torn off. By choice. And that's only the first couple of pages of Silence, the third book in Becca Fitzpatrick's best selling Hush, Hush series. And we're not just talking about any angel. It's Patch. The ripped abs, tousled hair celestial being beloved by fan girls (and women) everywhere. He sacrifices himself in order to rescue his human girlfriend, Nora, from the diabolical clutches of her Nephilim father, Hank. One problem. While granting her release, Hank erases five months of his daughter's memory - essentially every moment that she ever spent with Patch. That's some serious parental interference when it comes to teenage romance.

As Nora struggles to find her way through the haze of amnesia, she begins seeing flashes of black while experiencing a rush of intense longing. She's also transported into visions of a female archangel caged in a warehouse suffering torture at the hands of Hank. Yet she only knows Hank as the father of her lifelong nemesis, Marcie and now the unexpected new boyfriend of her widowed mother. She doesn't want him in her life, and now she has a reason to suspect he is capable of even greater treachery. If she only knew.

Her best friend, Vee, along with her mother, conspire to keep any reference of Patch out of Nora's life. Yet her innate yearning to connect with her soul mate allows her to find him in her dreams, and in a twist of fate, at the scene of a 7-11 robbery. As they unexpectedly come face-to-face, Nora senses he is someone who means a great deal to her. Patch provides her with the alias, Jev, and tries to fly under her radar until she is launched into a flashback by accidentally touching the wing scars on his back. Patch can't keep his true identity secret for long, no matter how much he longs to protect Nora from the corrupt bargain he made with her father. However, when Hank breaks his word by infiltrating Nora's life, all bets are off.

Key characters make noteworthy appearances. Scott Parnell is on the run from Hank and his Nephilim army. He seeks Nora's help by climbing through her bedroom window in the middle of the night angling an invitation as her date to the upcoming homecoming dance. Detective Basso is the first to discover Nora wandering in a cemetery months after her abduction, although she faints when he approaches her. Marcie Millar is no stranger to making Nora's life a living hell, but while acting as Hank's puppet she attempts to form an alliance with Nora even taking her dress shopping.

But in Silence, the spotlight remains on the deepening relationship of Patch and Nora. For the first time, Patch is solidly committed to making it work with Nora despite the odds. He has made the decision that she is his destiny and he will let nothing stand in the way of their love for each other. He has gone from a boy's passing interest to a man's fully developed attachment to the woman he loves. For Nora's sake, it's about time. Patch has finally realized the full breadth of his feelings for her. Her patience has paid off. While they still don't consummate their relationship by book's end, they come awfully close. While Patch is more than willing, he respects Nora's decision not to complicate her life any further after she undergoes a life-altering transformation propagated by Hank. She's not the same girl she was in Hush, Hush or Crescendo. In Silence, Nora becomes a new being altogether.

Overall, an angel loses his wings finally proving the devotion of h"
583,"Silence (Hush, Hush, #3)",1442426640,Becca Fitzpatrick,Barnes and Noble,3.5,sap8b,"This review contains SPOILERS. 
 
I came away from 'The Magicians' with very mixed feelings.  I'm leery of books that have reviews on the back flap that mention comparisons ro other books as part of their summaries - because this book - its plot, characters, and setting - should stand on its own.  Unfortunately, 'The Magicians' does not.  It is highly derivative of both the Harry Potter books and the Chronicles of Narnia.  To give one example: a fictional  'welters' game is introduced as something that the magicians play at the Brakebills College.  The rules of welters are never clearly illustrated and the magical game appears to have been introduced simply to mock the Quidditch game that was invented in the Harry Potter books.  (When he first learns about welters, the lead character, Quentin, remarks, ""What, no broomsticks?"")  Indeed, I can't think of any part of the book's plot that was advanced because the characters play welters. 

There is one very chilling scene in which Quentin disturbs a spell that one of his teachers is doing as a demonstration and an extra-dimensional creature appears - freezing everyone in the classroom - with a lethal outcome for one of the students.  However, the creature is later explained away in connection with the ordinary world - and its actions in the classroom don't make very much sense in retrospect.

Lastly, despite the fact that uncovering the mystery of Fillory is the principal quest of the book, Quentin doesn't actually arrive in Fillory until page 286 and the conflict is resolved by page 365 - leaving the remaining 40-odd pages to cover 2 years and a throw-away quest to get out of Fillory.  

To be honest, the book reads like it was the first draft of a novel that somehow made it through the publishing process without ever passing an editor's desk.  It breaks - annoyingly so - one of the basic rules of story-telling: show the reader, don't tell the reader.  And the book spends pages telling the reader what Quentin is feeling, e.g. ""Quentin didn't bother with the DVDs, just flipped channels on the huge TV and slugged stright from the bottle until sunlight came bleeding up over the horizon, like more acid blood oozing out of his sick ruptured heart, which felt - not that anyone cared - like a rotten drum of biohazardous waste at the very bottom of a landfill, leaching poison into the groundwater, enough poison to kill an entire suburb full of innocent and unsuspecting children.""

This book is not a fantasy novel - nor does it ""enlarge the boundaries of conventional fantasy writing"" as the dust jacket would breathlessly have you believe.  It is, at best, an incomplete post-modern novel with inexplicably wealthy, navel-gazing characters who can occasionally perform magic and, at worse, it can be construed as a cynical mash-up of others' truly revolutionary fantasy stories."
583,"Silence (Hush, Hush, #3)",1442426640,Becca Fitzpatrick,Barnes and Noble,3.5,Sandra027,It was like Holden Caulfield goes to Hogwarts than falls into Narnia... and managed to suck all the fun out of it.
583,"Silence (Hush, Hush, #3)",1442426640,Becca Fitzpatrick,Barnes and Noble,3.5,alissa_v,"After seeing this book description and the BN review, I was really looking forward to reading this book.  Unfortunately, in my opinion, it didn't deliver.  I felt it borrowed too much from other fantasy series - especially Harry Potter and Narnia.  Yes, there were some variations, but essentially the same concepts, so if felt very unoriginal to me.  I also was disappointed in the characters - it's hard to get through a book when you dislike the majority of the characters."
584,The Magicians (The Magicians #1),0670020559,Lev Grossman,Barnes and Noble,4.8,Fraxer,"Another popular Manga that nobody should pass up the chance to read. The story in incredible! The amount of twists and turns this manga takes keeps you reading until the end.  You can not keep yourself from getting the next one once you put down the first volume, your hooked! The writing is superb and the artwork is beautiful. This Manga is zero action but a thrilling plot and great characters makes up for that. Right when you start to get comfortable with the story and understand what is going on... it always takes a sudden unexpected turn! Death note is the best manga out there when it comes to plot. Shounen manga is sometimes very generic (crammed with action, good guy bad guy situations, and girls with large breasts.) But Death Note has the most intricate story I think I have ever had the pleasure to read in a manga. Bravo! Shounen Jump! For picking such a cutting-edge manga as one of your titles. Do not pass up the chance to read this manga!- Fraxer"
584,The Magicians (The Magicians #1),0670020559,Lev Grossman,Barnes and Noble,4.8,Guest,"This goes for the whole series: Death Note is one of the best Mangas ever written. It has a good storyline and the characters are great. It will make you want more, even when it's over."
584,The Magicians (The Magicians #1),0670020559,Lev Grossman,Barnes and Noble,4.8,Anonymous,"My friends are all about Death Note so I started to read it, only because I have the same name as Light Yagami. It DIDNT disappoint me. Its amazing! 

--
Light Laviana (Same name as Light :D)"
585,"Death Note, Vol. 1: Boredom (Death Note, #1)",1421501686,"Tsugumi Ohba, Takeshi Obata",Barnes and Noble,4.5,C4M30.l0k1,"Really, I don't say this very often (actually, like once in a blue moon), but this book s truly a masterpiece. Completely original, and haunts you long after the last pages. Excellent for avid readers beyond their age, and even more so for those hopeless romantics and fantasy-meets-reality lovers."
585,"Death Note, Vol. 1: Boredom (Death Note, #1)",1421501686,"Tsugumi Ohba, Takeshi Obata",Barnes and Noble,4.5,Anonymous,"This book was very remarkable from beginning to end. It is good for ages 12-college age. It is about a girl with interesting visions. She is haunted by them and in the beginning, and her mother is killed, her death somehow related to them. This leaves the girl, Gemma, with many questions. Gemma is sent to a finishing school where she meets new friends. Her and her friends recreate a secret order... This book will keep your heart pumping and you won't be able to put it down (I know because I stayed in my bedroom all day finishing it. I loved this book and really hope you read it. I know you will enjoy it!
-Female, age 13"
585,"Death Note, Vol. 1: Boredom (Death Note, #1)",1421501686,"Tsugumi Ohba, Takeshi Obata",Barnes and Noble,4.5,Cerulean_Notion,"I've seen this series on several friends' bookshelves and finally got around to reading it myself. I wasn't disappointed; in fact, I was pleasantly surprised with this series. It has believable plot lines and ties throughout the trilogy. The characters and their developments are well-paced, believable, and appropriate for the series. The friendships are inspiring (and show the failings real life relationships can have.) Suggested for older teenagers. Honestly, a great read."
586,"A Great and Terrible Beauty (Gemma Doyle, #1)",0689875347,Libba Bray,Barnes and Noble,3.9,Guest,"Once in a great while, a book comes along that changes the way you look at everything: the world, love, hate, relationships, politics. Such is the case with EVERYTHING IS ILLUMINATED. Now, not everyone is going to warm to this novel, but keep reading: 'Everything is Illuminated' is the story of a young American (also with the name Jonathan Safran Foer, but this is a work of fiction) who travels to Ukraine to find the woman who saved his grandfather from the holocaust. In the process the book tells several stories: the American's trip to the Ukraine, the story of his grandfather and the town history, his Ukrainian translator's personal struggles with family and identity, and his Ukrainian translator's grandfathers experience during the war. These stories are told in different voices, in different chapters interspersed throughout the book. Some of these work better than others, as Foer seems to have a desire to stretch into literary gimmicks that are not always neccesary. But when he gets it right the passages are as moving as anything I have ever read. His variety of voices allows a reflection on certain elements of the story that reinforces their meaning. Writing about love, personal history, death, and living on allows ample opportunity to take on issues that go to the heart of what it means to be human. It also creates the possibility of falling into a bottomless pit of reflection, over-analysis, and huge failure. This book flirts with those pitfalls at times, but never falls in. It creates scenes of incredible trauma, and manages to tell the story in a way that seems real (a significant achievement for a writer born in 1977). I am struggling to even describe the book, which speaks the complexity of the story and the skill in telling it. I am sure that my enjoyment of the book was enhanced by witnessing first hand some of the absurdity of life in Ukraine, but that is only part of the story. This is a riveting book, often spoken of in the same breath as 'Bark of the Dogwood' with its odd cast of characters. A perfect companion to this book, BARK OF THE DOGWOOD, while completely different subject material, is nevertheless as entertaining. Both are great reads all 'round, but EVERYTHING IS ILLUMINATED is like nothing else on the planet."
586,"A Great and Terrible Beauty (Gemma Doyle, #1)",0689875347,Libba Bray,Barnes and Noble,3.9,57pop,"This is the best book that I have ever read. No one can pull of the beauty of the context. It's deeply felt and imagined. Whoever says they didn't like the ending, they didn't understand. I recommend this to anyone and everyone willing to see things in a new light."
586,"A Great and Terrible Beauty (Gemma Doyle, #1)",0689875347,Libba Bray,Barnes and Noble,3.9,De_Malkuth,"Everything Is Illuminated gives a deep and intimate glimpse into the tragedy and triumph of the human spirit, well infused with humor.  Each character is so richly developed and unveiled in complex layers that you feel like you know them, and laugh at their personality quirks and shed tears when they hurt.  As someone who's family is from the Ukraine, and who's grandparents were of an age of some of the characters, it really hit home for me, and gave me profound insight into the strength it must have taken to love and leave behind friends and family to come to the United States."
587,Everything Is Illuminated,0060529709,Jonathan Safran Foer,Barnes and Noble,4,Anonymous,"I understand that a movie rarely follows its book, but this site turned the movies I love into something I enjoy. 

The differences between the books and movies are so numerous, I wonder who the hell oversaw the movie scripting. These books would have made incredible movies,  but someone erroneously believed the could make Ludlum classics better. 

If you enjoy the overall concept of Bourne,  read the books. You won't be disappointed in anything but the time spent watching the movies which had nothing more in common with the books than titles."
587,Everything Is Illuminated,0060529709,Jonathan Safran Foer,Barnes and Noble,4,Anonymous,
587,Everything Is Illuminated,0060529709,Jonathan Safran Foer,Barnes and Noble,4,Anonymous,
588,"The Bourne Supremacy (Jason Bourne, #2)",0752863886,Robert Ludlum,Barnes and Noble,4.7,witzSF,"I LOVE THIS BOOK!
So worth the entire day I spent reading it while getting nothing else accomplished."
588,"The Bourne Supremacy (Jason Bourne, #2)",0752863886,Robert Ludlum,Barnes and Noble,4.7,Anonymous,"Well, well Tammara Webber does it again. With a bang this time!

This book is definitely a new favorite of mine. Actually I think they may be a top favorite ever for me now. As embarrassing as it is to say, I had no idea that this was coming out. I happened across it on Barnes & Noble Saturday night and having loved Tammara&rsquo;s Between the Line&rsquo;s series, I purchased it right away. I was in the process of finishing Grounded by Constance Sharper, so I didn&rsquo;t start until later that night, but once I did, I didn&rsquo;t sleep. Like literally, didn&rsquo;t sleep at all, I stayed up until 7am because I couldn&rsquo;t put it down. Every page turn for me was and opening to another moment in the book that if I had gone to sleep I felt I would have missed out on.

I will note that I have found a lot of site with categorization of Young Adult for this book. While a good chunk of the book is suitable for YA, there are scenes in this book that I would consider needing to be &ldquo;pre-screened&rdquo; by parents prior to letting your child read. First, while the synopsis states &ldquo;After two weeks in shock, she wakes up to her new reality: she&rsquo;s single, attending a state university instead of a music conservatory, ignored by her former circle of friends, stalked by her ex&rsquo;s frat brother, and failing a class for the first time in her life.&rdquo;, I really think this needs to pre-face the fact that it&rsquo;s not just stalking, SPOILER it is attempted rape, that is detailed. Now, I wanted to state that as there are a group of my followers that have relayed to me as parents, they would like to see more of a &ldquo;recommendation of content&rdquo;, so yes, there is a graphically detailed attempted rape scene, BUT, please read it if you, as a parent a concerned and keep it to your more mature teens, because the content of the book I think far outweighs the scenes and there is a recovery/closure to it.

With all of that aside, let&rsquo;s get to the goods. HOLY I LOVED THIS BOOK. While I gush in other reviews and use words like ""swoon"" or phrases like ""fell in love with"", those are usually in terms of an extremely fictional character. So, I will say this, Lucas sparked feelings inside me that could be described with the previously mentioned terms but, it was more of a warm flame inside that built to a blaze by the end of the book. Part of why I love Tammara Webber&rsquo;s writing so much is her characters. Most of her books are for the &ldquo;new-adult/college adult/mature-ya&rdquo; segment and she writes the perfect characters for relation to that age group.

Webber brought some gripping subjects to the forefront with this book. While some may say that there was &ldquo;a little too much&rdquo; going on, I think it was freaking beautiful. The book covers friendship, relationships, getting past your first love, rape, societies feelings of rape victims, and so much more. It was an amazing grouping of romance, suspense and mind-blowing writing that I will forever be a fan of Easy and Tammara Webber.

Overall, this book is solid through and through. The combination of romance and real life problems is on point, creating a must read, FOR SURE!"
588,"The Bourne Supremacy (Jason Bourne, #2)",0752863886,Robert Ludlum,Barnes and Noble,4.7,Anonymous,I loved this book! Its about 548 pages long i didnt want it to end. A must read!
589,"Easy (Contours of the Heart, #1)",0425266745,Tammara Webber,Barnes and Noble,4.2,Guest,"So often people express reluctance to take on the great literature of the past because of the feeling that it's a little too much like taking medicine. 'I know that reading this 'classic' is good for me because it's a classic, or so I'm told.' This seems to dissuade many readers from approaching works such as David Copperfield. This summer I have read four Dicken's classics, Bleak House, A Tale of Two Cities, Great Expectations and Copperfield. Copperfield will reward any modern reader with its kaleidoscope of Victorian England, rich with humor and memorable characters. Allow yourself to become lost in the memories of this most famous of fictional autobiographers. The language of Dickens is always a pleasure as he wraps his florobundant prose around a cast of character's and scenes that are never boring and often are filled with humor and pathos, and sometimes both at the same time. It's hard to imagine the inward looking authors of the 20th Century Existing without the foundation of the inward novel from characters such as David Copperfield, Pip of Great Expectations and Esther of Bleak House. David's memories are filtered through his own perception and foreknowledge of what occurs in his life after. Dickens use of the first person narrative in telling David's story anchors you to David's reactions to the events of his life and connects you as a reader to similar events or relationships in your own life. Finally, people are always calling Dickens characters caricatures, but as you read about the Micawbers or Uriah Heep, or Dora and think they seem like immutable beings think about the characters in your own life and see how mutable they are, and Dickens caricatures, even 165 years later seem accurate and rooted in reality. Lastly, don't be fightened by the weight of this tome. Once Dickens envelops you in his world and his language, be it in this work or any of his others, you will glide through his works and reach for the next."
