book_id,titles,isbn,author,review source,average rating,review author,review content
650,Uncle Tom's Cabin,1840224029,Harriet Beecher Stowe,Barnes and Noble,3.9,courtney_weaver,"Uncle Tom's cabin is a very touching story telling the life of a family of slaves. Uncle Tom is the heart of the story working on Mr. Shelbys farm. He has a wife and a son and he even has is own little cabin that Mr. Shelby has supplied him. Tom was happy there and the tought of escaping never crossed his mind. He believed that God put him there for a reason. 
Writen by Harriet Beecher Stowe, this touching story is unforgettable. The story sets in the south on a slave plantation were the slaves work for their owners and the thought of being sold to a different owner stays with them everyday.
Not only does this story talk about the story of time but it is filled with charecters from all walks of life ranging from the runnaway slaves tht tells the struggles they go through and all of the heartache they experiance when the two get seperated.
Not only do the slaves suffer but their family does as well. Tom has a son and for the most of his little life he won't understand why his dad has left.
For most of Tom's journey through this book he gets traded from owner to owner and finaly gets settled in with an abusive, angered and strict man. Tom still finds away to keep faith and believes that God will light the way. Plus he meets some odd charectors throughout the story like Topsy a daranged and clumsy little slave girl that finds fun in entertaining anyone who will watch.
I would recomend this book to everyone and anyone because it teaches you the morals of life and that no matter what always keep faith because Tom never lost hope and he found the light in the most dimmest moments because he knew that God was always on his side protecting him
This book is a must read because it has a lot of historical facts and it gives you a glimpse into the eyes of a different race and what they had to experience."
650,Uncle Tom's Cabin,1840224029,Harriet Beecher Stowe,Barnes and Noble,3.9,yearningtoread,"Uncle Tom lives in Kentucky under the kind Shelby family, where he has had the life of ease, even as a slave in America. He's treated with respect, both him and his family. He has helped work the Shelby's land for years. Tom loves the Lord, and serves Him all the days of his life. His heart is set on winning others to Jesus and serving the saved and unsaved. He is joyful. He has everything a slave could ask for. 

But Shelby has some debts to settle. Tom, the most valuable slave on the plantation, is sold, and sent with a trader named Haley to be sold. It is the beginning of one of the greatest adventures ever put to paper. It is an adventure of sorrow, broken hearts, and a love that is more redeeming than any human love. 


I was greatly impressed by this book. Before I was finished with it, I read in a curriculum that many writers and publishers were very critical of Stowe's work, that many did (and do) not like it. Even then I wasn't quite sure why, but at the end I was confused. How could anyone dislike this book? Even if the story is too sad for you - how can you not at least see the beauty of the characters and how Stowe formed each sentence? It was all careful, taking one step, one breath at a time. The book was like that. Breathe in, breathe out, breathe in, breathe out. Methodical, like breathing. And what's the beauty of breathing? It keeps you alive without you even knowing it. In a sense, Uncle Tom's Cabin was like that. Every breath was perfect, I didn't even realize it, but it kept the story going in a way that I will never, ever forget. 

There isn't much else to say about this story...other than please, I beg you to read this book. I laughed, I cried my eyes out, I went numb with fear and hatred, I was captivated by the love of God. And Tom, the slave who is now free, will always be a hero."
651,The Phantom of the Opera,0060809248,"Gaston Leroux, Alexander Teixeira de Mattos",Barnes and Noble,4.7,Anonymous,"I thought Gaston Leroux proved himself an amazing author in this suspenseful novel. I enjoyed this book and could not put it down once i got into it. In fact, it only took me about two days. He did a great job combining suspense, mystery, and romance all into one book so both guys and girls can enjoy. There was never a slow moving part; it was always action pact in an edge of your seat type of anticipation. He did a good job using the literary element of symbolism as a base of the story. He did a good job portraying each character and giving them the perfect personalities for their roles. I was also impressed with how well thought through the story line was and how detailed he was of the characters and the opera house itself. Like i said i really enjoyed this book and would recommend it to any one who loves suspenseful and or romantic novels that are action packed and full of unexspected turns."
651,The Phantom of the Opera,0060809248,"Gaston Leroux, Alexander Teixeira de Mattos",Barnes and Noble,4.7,Anonymous,"The novel &ldquo;The Phantom of the Opera&rsquo; written by Gaston Leroux is one of the most unique books I have ever read. It tells the story of the infamous Opera Ghost who lives beneath the Parisian Opera House. To most, he is just a legend but to others- unfortunate and doomed others-he is a real human being named Erik. However, he soon falls in love with the beautiful Christine Daae and seeks to aid her in her pursuit of glory and perfection. However, Christine&rsquo;s lover Raoul soon catches on to what is happening and, because of his love for Christine, aims to do something about this meddlesome and dangerous Phantom. 
	One of the biggest themes of &lsquo;The Phantom of the Opera&rsquo; is that of appearances and how they deceive. The Phantom is hideous and his entire reputation is based on the fact that he is hideous. No one truly knows who he is and judges him on his disfigured face. However, when wearing his mask or when he is not even seen, he is not judged. Christine, in fact believes that he is someone that she can relate to and, quite possibly, love. Likewise, the rich and attractive benefactors of the Opera House are respected by everyone and loved by many. However, on the inside, these people are just as hideous as the Phantom.  They judge the Phantom and are ultimately the reason for his demise. Throughout the entire story, we, the audience, transform from judging based on the myths and descriptions of the Phantom to knowing who he is and why he is that way. Thus, in addition to receiving a gripping yarn, we also learn a valuable lesson.
	Like I have said, this is a curious and unique book. It most certainly deserves a place in history with a truly fascinating story and main character. However, in my opinion, the book is not very well written. It seems to stumble along and relies and how intriguing the story. In the end, the writing style was not enough to greatly hinder my enjoyment of the book but it kept from being the truly great book that it could have been.  Apart from the writing style, the book is really terrific. The story is fascinating and engaging from start to finish. The characters of the Phantom, Raoul and Christine Daae and their respective relationships are just so fascinating that they makes the entire book worth reading. One character, especially, stands out among the others. In my opinion, the mysterious &ldquo;Persian&rdquo; is even more interesting than Erik the Phantom. He is a mysterious man from Erik&rsquo;s past who is quite sympathetic against Erik but has to work with Raoul against him. To reveal any more would be a crime.
	While &lsquo;The Phantom of the Opera&rsquo; may be a &lsquo;great&rsquo; book, it is actually not all that good. It will never be used as a literary example of how books should be written. Gaston Leroux&rsquo;s novel is just good, pulpy fun and sometimes that&rsquo;s all you want in a book. For me, it was just enough."
651,The Phantom of the Opera,0060809248,"Gaston Leroux, Alexander Teixeira de Mattos",Barnes and Noble,4.7,songcatchers,"This gothic novel does a wonderful job with crossing genre lines. It mixes elements of romance, horror and mystery into a fantastic piece of fiction. We, the reader, travel from the very roof of the Paris Opera House down to the lair of the ""Angel of Music"" beneath that same house of music. The Phantom of the Opera contains an underground lake, a torture chamber and a graveyard. And yet this novel is fundamentally a love story. A heartbreaking one at that!This novel by Gaston Leroux has been adapted to the stage and film many times. It is considered to be a French classic of literature. It is very deserving."
652,"Definitely Dead (Sookie Stackhouse, #6)",0441014917,Charlaine Harris,Barnes and Noble,4.4,Guest,"I must say that I became addicted to this series after the first book  however, my love is waning. The books and relationships are predictable. Every book there is a new guy that falls head over heels in love with Sookie, and it's becoming tiresome. Charlaine never gives us closure on any of her relationships or flings. This means that Sookie is loved, wanted, and lusted after by all who have had her. So...what's the count now? There's Sam, Alceade, Bill, Eric, Quinn, and the newcomer that's bound to love her too in the next book. Enough already! I started reading this series because I liked Sookie's character, but I've come to dislike Sookie and her continuing need to have her ego stroked. I now read the books for Eric alone. I hope that Charlaine goes back and reads her own series so that she may be reminded of how independent and humble Sookie was in the beginning. If the series continues on its current path I'm afraid it will lose one of its followers."
652,"Definitely Dead (Sookie Stackhouse, #6)",0441014917,Charlaine Harris,Barnes and Noble,4.4,maila89,"i was sooo confused on what was going on right from the beginning. when the book started mentioning sookie's cousin hadley having died i thought i had the wrong book, and had to go back and check to see if i had missed something. and when i found out i hadnt and the book started getting more indepth about hadleys story i kept getting more confused and more frustrated!! this was the worst book so far in the series in my opinon, the other books flowed and didnt confuse the heck out of me like this one did. i was very dissapointed."
652,"Definitely Dead (Sookie Stackhouse, #6)",0441014917,Charlaine Harris,Barnes and Noble,4.4,Alison12,"Come on Charline Harris!!!! Another man that falls in ""love"" with Sookie?? So now Sookie has feelings for...Eric,Bill,Sam,Alcide,uhh Quinn, am I missing someone? See! There are so many guys now I can't even keep track! This book was pretty confusing but I still liked it just because it's part of the series. The ONLY guy I want Sookie to get together with is Eric and Eric only. He's been by her side all along but Charline keeps bringing in new guys. I hope the next book is better and Sookie starts to settle down with a man."
653,Blindness,0156007754,"Jos?? Saramago, Giovanni Pontiero",Barnes and Noble,3.9,Jessi-21,"I loved the premise of Blindness. It had a great flow to it, excellent character development (though highly unconventional), and a story that kept one guessing most of the way through.
Though the ending was somewhat predictable, some of the scenes completely off base on human reactions, and the action often simplistic, the story itself had a cohesiveness that keep me locked in the whole time. Some have described the story as if it were an interpretation of a painting, attributing many facets to it that were not obvious. Maybe I am just shallow, but though it was a great read, I would not rank it up there with ""War and Peace""!
I read the book in two sittings, and will do it again. That said, the style of writing best associated with an internet chat room, missing all writing conventions except periods for the end of a sentence, makes the book difficult to read. Though, as you become accustomed to the style it gets easier, it creates confusion as you often find yourself rereading parts to figure out who was speaking, and trying to decide if it was a thought or a spoken word. The minimum amount of paragraphs, even though action, conversations and thoughts among many people take place in one paragraph, make following the threads of the story difficult. Many have said that this was intentional, and maybe it was, but I fail to see how it would have hurt the story to follow normal writing rules. Unfortunately, the sequel ""Seeing"" is done the same way, and makes even less sense!
All that said, if you like apocalyptic science fiction with an intellectual bent, this is a great book to work your way through. It even has a slight feel of Asimov to it."
653,Blindness,0156007754,"Jos?? Saramago, Giovanni Pontiero",Barnes and Noble,3.9,Anonymous,"I'm actually surprised that everyone gave it such good reviews. The translation was awkward, which made it very hard to read. 


I also kept waiting for someone to be a little more self sufficient! They all walked around like sheep and did nothing to help themselves. They relied on the only sighted person in the story. It was frustrating!
They couldn't cook because there weren't any microwaves? Ahhhh...what did we do before microwaves? The whole book was like that! Sorry, I just was surprised at how weak it was. Good idea that fell flat.

But, what do I know, he won a nobel prize for it!"
653,Blindness,0156007754,"Jos?? Saramago, Giovanni Pontiero",Barnes and Noble,3.9,gettin_picky,This book is well written and does generate thoughts about what could happen.  It's not what I usually have in my pile of books to read but I heard a lady on NPR rave about how this was the only book she had read or would read more than one time and I thought that was a good recommendation.  It did make me think about a lot of things I would never have thought about which I suppose a good book will but it was pretty dark (no pun intended) and had a little to much of the gritty details for me.
654,Freedom,0374158460,Jonathan Franzen,Barnes and Noble,3.2,Bookbabe53,"Not as great as The Corrections, but...there is something about Franzen's writing that makes it difficult for me to put it down. This story was so realistic in many ways to my experiences and those of my friends (predominately boomers), as well as our adolescent and young adult kids. He really gets family ties and the effects of depression on relationships. I felt like I knew Patty. You feel like you are right there... watching or experiencing everything, especially the effects of 9/11 on everything (I live near DC and he gets everything right about it). I would read him again and again. Recommend for book clubs."
654,Freedom,0374158460,Jonathan Franzen,Barnes and Noble,3.2,Tammy01,"Not  sure why Oprah picked this book, it was hard to read, I put it down and re-started it five times, I finally finished it, but kind of wished I would not have.  Very boring, self serving story about a not so normal family.  I would not reccomend this to anyone, sorry Oprah.  If you are looking for a good read, try Unconditional.  It is well written story, with well developed characters.  The plot twist and ending will certainly surprise you, and I guarantee that you wont put it down until you reach the end."
654,Freedom,0374158460,Jonathan Franzen,Barnes and Noble,3.2,SHARON39,"FREEDOM is the story of our time, our concerns. Beautifully written, this amazing novel has a lot of entertaining satire, witty metaphors, deep insights, and a smattering of politics, (all sides). He works in what makes people tick, self-awareness and growth.human nature. The baby boomer generation, in search of the almighty self-gratification, apparently, have destroyed a great deal of the world's natural resources with no thought at all of the consequences. Strong ideas and obsessions shape people so much so that they can ruin their lives and others. Political prejudices prevent people from making friends and being genuine. Perception blinds the world's people to the world as it really is. This is a very human, realistic, painfully so, story of a couple and their friends that is totally believable, as if a true life biography. There is no Fairy Tale here. Interestingly thought-provoking! Isn't it a shame that we all can't just BE NICE? Why does that have to be so hard? Respect? Why does that have to be so hard? I recommend this to the reader who has an open mind and is capable of understanding the author's intention."
655,"Crossed (Matched, #2)",0142421715,Ally Condie,Barnes and Noble,4.1,B-Sandra,When I read Matched it kind of reminded me of a mix between The Giver and the Hunger Games but it still had its own identity. Can't wait for this book!!!
655,"Crossed (Matched, #2)",0142421715,Ally Condie,Barnes and Noble,4.1,booksonmynook,"I enjoyed reading this novel. I loved the characters, the plot. it was hard to put down."
655,"Crossed (Matched, #2)",0142421715,Ally Condie,Barnes and Noble,4.1,Anonymous,"Matched was very epic. It reminded me of Lois Lowry's The Giver, they both had a dictatorship like ""Society"". When I finished Matched , I was heartbroken and then started searching for a sequel. Now that there is for sure going to be one, I am soooo happy. CANT WAIT FOR IT!!!!"
656,"I'd Tell You I Love You, But Then I'd Have to Kill You (Gallagher Girls, #1)",1423100034,Ally Carter,Barnes and Noble,4.4,Helloo,"I remember when I'd Tell You I Love You But Then I'd Have to Kill you first came out. Picked it up, sounded interesting, but I hate first character narrators who sound too...teenagery. I've had my experiences with them and I wasn't willing to risk my cash on another one. So now, four years later I picked up Heist Society--by Ally Carter, same author of Gallegher Girls series and madly fell in love with her story telling skills. Gallagher Girls series is quite the ride and I'm glad I--twenty years old--picked it up and finally read it. I won't give away anything but each book is full of humor and action. But you can tell that through out the years she started to grasp the whole feel for great story telling--not that the first two books where horrible. Far from it, but the last two books--especially the last one (Only the Good Spy Young) certainly were a crazy ride full of emotion and character development.

 The first two books had fun humor and introductions to the spy world and what it had to offer and the troubles and duties that came along with it. But they lacked the action, intensity and climatic story that the last two books where equipped with. Either way, I didn't feel like sticking fork in my eye while reading Cam's narrative. Very fluid and fun and simple. As the story progresses and she faces more danger--without her teachers plannings--she grows more mature and aware of what's out there. What she'll have to face one day. 

If you're looking for a series or just a good fun book, then these books are the right choice. Don't let the long--maybe a tad cheesy (I kinda like it :] ) title fool you. Cam and her gang will steal your friendship and Zach (sigh) will steal your heart. Because they're spies. And thats what they do."
656,"I'd Tell You I Love You, But Then I'd Have to Kill You (Gallagher Girls, #1)",1423100034,Ally Carter,Barnes and Noble,4.4,Guest,This book is wonderful!It has alot of suspense and it will catch you off guard sometimes.This is a 'Must Read' book!YOU HAVE TO READ THIS BOOK!!!
656,"I'd Tell You I Love You, But Then I'd Have to Kill You (Gallagher Girls, #1)",1423100034,Ally Carter,Barnes and Noble,4.4,Anonymous,Sequal great too!
657,The White Tiger,1416562591,Aravind Adiga,Barnes and Noble,3.8,Guest,"Aravind Basu's brilliant debut is a tale of suspense and questionable morality which takes you on an unexpected journey into the heart of India through Balram Halwal aka 'The White Tiger'.Born in the fictional village of Laxmangarh, near the famous village of Bodh Gaya, where Buddha attained enlightenment, Halwal is the son of a rickshaw puller. After seeing his father die a painful death, neglected by the hospital authorities, he is forced to drop out of school and ends up working in a tea shop wiping tables. All he dreams of is escape. He manages to find his way out of the dreaded tea shop when a rich village landlord hires him as a chauffeur for his son who has returned from the United States. Things change rapidly for Halwal when he has to move to the Indian capital New Delhi with his new master. Here he comes face to face with the two Indias: As Adiga aptly puts it: 'The dreams of the rich, and the dreams of the poor - they never overlap, do they? See, the poor dream all their lives of getting enough to eat and looking like the rich. And what do the rich dream of? Losing weight and looking like the poor.' Living in a big city with bright lights on the one hand and teeming poverty on the other, Halwal starts questioning many things he has taken for granted while growing up in his small village. Things get murky when his master attempts to frame him for an accidental murder committed by his wife. Halwal is forced to question his undying loyalty. His awakening eventually turns him into a successful entrepreneur. But does the road to success justify spilling blood? Read this riveting page-turned, written in epistolary form, to find out."
657,The White Tiger,1416562591,Aravind Adiga,Barnes and Noble,3.8,TrainTravelReader,"This was a book that was selected by my book club, not one that I would have chosen to read on my own. The author's intent was to bring to light some of the atrocities that seems to still exist today about life in India. The storytelling is a bit slow for my taste, so I found myself easily distracted as I tried to read this book on my train commute. The main character is not very likable, and the overall story does not leave you feeling satisfied. This is not a book I enjoyed reading, and I would not recommend it to others."
657,The White Tiger,1416562591,Aravind Adiga,Barnes and Noble,3.8,Guest,"Ripped from the dark heart of modern-day India, comes debut novelist Aravind Adiga, a hip Gunga Din for the millennium, blowing a hot, Ornette Coleman riff of a novel, from the top of a dirty golden dome, that is at once visceral, witty, irreverent, bloody, and untimately satisfying.    By the first few pages of his book, 'The White Tiger,' the reader quickly forgets about finding a lyrical, fragrant India, similar to the novels of M.M. Kaye, and Vikram Seth. This is a down and dirty India, much like it's mother of a river, the Ganges. The story as put down by it's narrator, the complex, Balram Halwai, who has risen from desperate poverty, to become a chauffer for two rich Poleranians, rails against India's class system and corruption, with a searing and damning sarcasm.    Halwai's haunting trumpet blast of a literary voice lingers with the reader long after the final page, but will India be ready for his next book?    I know I will. This is one hell-of-a read."
658,The Corrections,1841156736,Jonathan Franzen,Barnes and Noble,3.3,Lisa_RR_H,"I suppose it's a reflection of my bourgeois middlebrow tastes that I didn't just hate this book but thought it badly written--Pulitzer Prize Finalist or not. It's one of those novels with an omniscient narrative with lots of Post-Modernist Stylistic Touches that Examines The Human Condition(tm)--in other words a pretentious, depressing work with unlikeable characters and turgid prose. The kind of book where paragraphs can go on for more than a page and single sentences, kept aloft with slashes, parenthesis, colons and semi-colons almost as long. (See, page 11, 17.) One with irritating affectations like referring to a fictitious school as ""D-- College."" (God, just make up a name already.)

Every once in a while I did think there were flashes of brilliance (which is why it gets more than one star). Such as how in Part One, Enid and Alfred, an elderly Midwestern couple, are characterized through their possessions. Or in Part Two how their son Chip translates the subtext of his mother's quizzing of his girlfriend.

However, not even the satiric tones could make Chip's self-absorbed academic musings bearable--maybe Franzen did that too well--I had flashbacks to the worst of my politically correct college professors. Franzen's depiction of Yuppiehood in New York City wasn't any more appealing. (And I say that as a proud native New Yorker who usually loves to see my city depicted.) I lasted till the end of the second part at page 134 because I wanted to give such a raved-about book a fair shot. By then I knew there was no way I was going to last all the way to the end at page 566 without taking it out on some innocent bystander."
