book_id,titles,isbn,author,review source,average rating,review author,review content
1287,"Miss Nelson Is Missing! (Miss Nelson, #1)",0395401461,"Harry Allard, James  Marshall",Barnes and Noble,4.1,Guest,"The Long walk by Stephen King, is a disturbing report of a contest, in which the losers pay with their lives.  The Long Walk consists of one hundred walkers. Only the elite of those who registered, were entered into the contest.  The prize being literally anything that the winner would ever desire, plus a monetary prize of millions of dollars.   	Throughout the story the reader watches the main character develop mentally, while he watches those around him die.  Unlike most authors, King develops his characters through their experiences, as opposed to just describing them. This gives the reader a better feel of the personality of the individuals in the novel.  This kind of understanding of characters makes the story much more enjoyable.  The morbidity of this story evolves even the reader.  A new understanding of the brutality transpiring within the military is reached through the novel.    	King¿s depiction of this military sponsored escapade, showed his respect for military obedience, and lack of respect for their morals.  He shows them to be robots to the commands of the `beloved general.¿ Of course the soldiers were respected, until peers started dying.  Most people respect the authority of the military.  The military has an excess of power, and lacks the ethics to back the authority, implies King through this book.  	The only alternate novel by King that is as thought provoking as this is The Rage. It is another shorter novel, This novel is remarkably illuminating.  Never had I imagined that my life could be changed by a book. This book convinced me that my previous beliefs were wrong.  This fiction forced me to revise all of my moral beliefs, for it makes one realize all of the death and destruction going on in the world.  I would instantly reccomend this book to anyone wishing for something different, and eye opening."
1287,"Miss Nelson Is Missing! (Miss Nelson, #1)",0395401461,"Harry Allard, James  Marshall",Barnes and Noble,4.1,Gabriel Montelongo,"The psychological roller-coaster not withsranding nor the character development and twisted plot. I think most of the responses on here are absurd.  This book is fantastic. No action? It's a book. If there is not enough action for you, you either- have no imagination or, need to stick to your xbox and, leave the reading to someone else."
1288,The Long Walk,0451196716,"Richard Bachman, Stephen King",Barnes and Noble,4.2,Anonymous,
1288,The Long Walk,0451196716,"Richard Bachman, Stephen King",Barnes and Noble,4.2,Anonymous,
1288,The Long Walk,0451196716,"Richard Bachman, Stephen King",Barnes and Noble,4.2,Anonymous,
1289,"The Ersatz Elevator (A Series of Unfortunate Events, #6)",0060566213,"Lemony Snicket, Brett Helquist",Barnes and Noble,4.2,Guest,"While reading 'Messenger' by Lois Lowry, I was interested   in the book after the first chapter with its connections to   its previous books, new plot line & setting, and its exciting   start. All of the characters come together into one book,   but this is not noticable right away.  From both 'The Giver'   and 'Gathering Blue', things start to fall into place. While   reading both 'The Giver' and 'Gathering Blue', it was hard   to understand some consepts and some things didn't   make sense. This occured at the beginning of 'Messenger'   as well, but it incorperated all 3 books into one enjoyable   read of adventure and romance. The writing style of this   book has made me even more interested to read it   because it makes you feel like you are there, experiencing   everything on the sidelines, like a director behind the   scenes of a movie. While reading 'Messenger', it was hard   to put the book down. Before I knew it, i could have been   reading for 3 hours straight and be almost finished with   the book. This book is a great read if you like action and   adventure with new twists every few chapters. I really   enjoyed this book because it kept me thinking, and never   really being sure of what would happen next."
1289,"The Ersatz Elevator (A Series of Unfortunate Events, #6)",0060566213,"Lemony Snicket, Brett Helquist",Barnes and Noble,4.2,Guest,"I liked this book better than Gathering Blue, but less than The Giver. It was an interesting read and VERY intense!!! Only read this book if your up for a REALLY intense book."
1289,"The Ersatz Elevator (A Series of Unfortunate Events, #6)",0060566213,"Lemony Snicket, Brett Helquist",Barnes and Noble,4.2,Anonymous,This book is amazing!!!!!!!!! The plot is never ending. It is also a page turner and will make you think. If you like books that are never ending action then you will love this book.
1290,"Messenger (The Giver, #3)",0385732538,Lois Lowry,Barnes and Noble,4.5,eReaderSS,"I was frustrated with the constant ups and downs in Butch's and Marissa's relationship.  But I was satisfied the way it turned out for them.  Butch so belongs in the Brotherhood!!!

I also recommend reading ""The Mating"" and ""The Keeping"" (in that order) by a wonderful author named Nicky Charles.  I discovered her by accident and LOVED LOVED LOVED her books.  They are similar to JR Ward's Brotherhood series.  And guess what?  They are both FREE ebooks through the B&N library."
1290,"Messenger (The Giver, #3)",0385732538,Lois Lowry,Barnes and Noble,4.5,TheLBD,"i found this to be a REAL SNOOZER!  But i'm optimistic that book #5 will be better because i know how sizzling the author can get, but this one, just didnt do it for me.... i really wouldnt even recommend it to anyone who is reading the series.  I'd just tell them what happens and save them the trouble and time of reading this one."
1290,"Messenger (The Giver, #3)",0385732538,Lois Lowry,Barnes and Noble,4.5,BBandReveries,"Lover Revealed is Butch and Marissa's story.  Butch is taken by the lessers very early on in the book after saving a civilian vampire.  He is tortured for information about the brotherhood, but never gives in (Go Butch!).  However, something truly evil is done to Butch before he is left for dead in the middle of nowhere.  After the brotherhood rescues him, they question his fate and allegiance.  Butch is no longer the same ""cop."" After healing from his stay with the lessers, he starts to notice some changes: his body is letting off an odd spice scent around Marissa, he is much more aggressive, he can suck lessers into himself, and his blood turns black whenever he destroys the lessers his way.  
	Marissa and Butch's relationship had so many ""aw"" moments but there was one thing that seriously annoyed me; when Butch called Marissa ""baby,"" I cringed.  I really don't know why that bothered me so much.  Other than that, everything was fine.  Butch wasn't my favorite character, even in the beginning, and this book didn't really change that for me.  Although, there were some aspects that really stood out and made me love Ms. Ward's writing even more.  
	The Black Dagger Brotherhood series is a romance book series (just look at the titles).  The characters in the series have so much depth, not often seen in adult romance novels.  With each book, Ms. Ward astounds me with the way she skillfully balances the passionate love scenes with actual plot.  In Butch's story, just like Zsadist's, the central characters grow and change through the story.  Butch starts out insecure in his place in life.  Later in the book, when Butch is telling Marissa about his past he comments, ""I've always been different from other people, not just in my family but when I was working here on the CPD force, too.  I never fit in.until I met the Brotherhood.I've been living on the fringes all my life.(325).""  As the story progresses, the Butch becomes a part of a family, a part of something he never had.  Marissa also finds herself.  Even though Butch and Marissa fought a lot in this book, I think it was appropriate.  Neither were secure with themselves.  After Havers forced independence on Marissa, she started to follow her ""Rule Number One: Right or wrong, she made the choices in her life.  No one else did (402).""  Of course, Marissa doesn't become independent overnight.  In fact, she moves in with the brotherhood.  Slowly, she begins to become her own person.  Her transition from flowing gowns and corsets to pants and turtle necks was very symbolic of her transformation from a push over, aristocrat to a fully independent woman, free of the cage her brother and the glymera had forced her in all her life.  
	Lover Revealed was definitely a huge step forward in the war between the vampires and the lessers.  What happens to Butch changes everything.  The Black Dagger Brotherhood have a whole new deadly weapon in the war.  As the Scribe Virgin said, ""Now the new era in the war begins (399).""   
While this wasn't the greatest of the Black Dagger Brotherhood books, it definitely is worth the read.  Fair Warning:  like all the BDB books, there are quite a few graphic sex scenes, violence, profanity, and of course blood and gore.  If you haven't picked these books up yet, then I suggest you buy them.yes, buy them.  They are too amazing not to purchase because you will want to reread them over and over again."
1291,"Lover Revealed (Black Dagger Brotherhood, #4)",0451412354,J.R. Ward,Barnes and Noble,4.7,StevenLCampbell on LibraryThing,"This is a reprint of the second book I ever read by King (Carrie was first) way back in 1976. This is classic vampires, better than Stoker's Dracula. And I enjoy the extras in this version of SL, much like the extras we get nowadays on our DVDs."
1291,"Lover Revealed (Black Dagger Brotherhood, #4)",0451412354,J.R. Ward,Barnes and Noble,4.7,PMcGovern on LibraryThing,"My favourite modern novel, Stephen King at his best."
1291,"Lover Revealed (Black Dagger Brotherhood, #4)",0451412354,J.R. Ward,Barnes and Noble,4.7,pamkaye,"First, I am always a King fan, and therefore; always thrilled by his books.

A quiet little town called Jerusalem's Lot. A writer named Ben Mears. A scary old mansion, And a vampire.
Ben returns to his hometown after 30 odd years. He remembers the mansion on the hill that overlooks the town, and thinks that it will inspire a
great story. The townspeople are quiet and keep to themselves. So when things start to go bad, no one really notices. Except for Father Callahan. He knows somethings not right and that people seem to be disappearing.
When it becomes common knowledge that someone has moved into the mansion, Ben and Father Callahan become suspicious.

This is a sit on the edge of your seat story."
1292,Salem's Lot,0385516487,"Stephen King, Jerry N. Uelsmann",Barnes and Noble,4.6,FHResident,I am an 11 year old girl and I found this book was so engaging! I couldn't stop reading it! All the characters were so intersting and the story is very captivating. I loved the puzzles and the mysteries that the characters had to solve. I also loved that all the names of characters and places had secret meanings hidden in them. This was definitely one of the best book I've ever read.
1292,Salem's Lot,0385516487,"Stephen King, Jerry N. Uelsmann",Barnes and Noble,4.6,Dr.Dad,"My son and I really enjoyed reading this book together. It had many great lessons and principles about friendship, teamwork, persistence and loyalty. It really lent itself to deeper discussions about life and values. The plot was captivating and it was easy to see yourself in the action. Consequently it was fun to ask my son what he would have done or done differently than the characters in the story. Even though the children in the book were uniquely gifted, they retained some of the common,ordinariness of all kids and so were easy to identify with. It reminded me of the Harry Potter and Series of Unfortunate Events series without the supernatural or bizarre. Despite the realism, the storyline was exciting as the kids defeat the mad genius villian bent on world domination. It's a great read and you and your kids will love it!"
1292,Salem's Lot,0385516487,"Stephen King, Jerry N. Uelsmann",Barnes and Noble,4.6,TheCritic,"This is a great book about some extraordinary kids. A great book, a classic. I love it. I highly recommend it. They get into some ""STICKY"" situations, and just barely get out of them. A MUST READ!"
1293,"The Mysterious Benedict Society (The Mysterious Benedict Society, #1)",0316057770,"Trenton Lee Stewart, Carson Ellis",Barnes and Noble,3.8,Wanderluster,"As someone who was raised in a pentecostal Christian household and yet miraculously turned out completely and utterly open-minded and inquisitive, I found this book truly compelling. My current view on religion could best be described as ""agnostic,"" and this book helped to reinforce my beliefs (and non-beliefs). Hitchens presents point after well-crafted point that the thinking individual simply cannot ignore. He tackles the ""big three"" monotheistic religions (and touches on Eastern philosophies as well) with the apt authority of one who really knows his enemy, so to speak. He understands the teachings and stories of the Bible and the Qur'an very well, and deftly and unapologetically points out the many contradictions and sensationalisms therein. If Hitchens' goal was to leave me both enlightened (by his thought-provoking insights) and infuriated (by the dumbfounding machinations of religion), then I can happily say he has achieved a roaring success."
1293,"The Mysterious Benedict Society (The Mysterious Benedict Society, #1)",0316057770,"Trenton Lee Stewart, Carson Ellis",Barnes and Noble,3.8,Guest,"Although a Christian, i found this book pretty engaging.  Hitchen makes some valid and interesting points that i've never even bothered to consider.  Overall, while this is a controversial book, i would recommend it to others, as I believe everyone should be open to new ideas and gather insight to the other side of the argument."
1293,"The Mysterious Benedict Society (The Mysterious Benedict Society, #1)",0316057770,"Trenton Lee Stewart, Carson Ellis",Barnes and Noble,3.8,john_gault,"If you're a religious person, it gives one pause. If anything it will provide you a different point of view about the basis of your thinking. It's a calm, rational, and well thought out argument for a point of view supporting agnosticism, and atheism. He doesn't push, but the points made need to be considered which challenge your point of view. If you subscribe to a faith, it will give you pause to reflect on how you rationalize your point of view with his. You need to approach the book for what it is; a well presented, rational but different point of view of religion(s), and belief in a ""supreme being"" regardless of which religion you subscribe (actively or not).

Trying to tackle his rational approach with platitudes, and edicts from your religion, is a waste of your money and time. He's not trying to get you to ""convert"" to anything; just a scholarly presentation of a point of view that isn't mainstream, but does reflect faith based actions of individuals, groups, and current religions.
If you're not, it is a different way of thinking, with many rational points of view presented, that are difficult to refute.
Personally, I share his point of view, but was never able to crystalize it as succinctly and with the background research he provides to move this point of view forward.
Religion has always been a practice of mysticism.
It was an enjoyable read."
1294,god is Not Great: How Religion Poisons Everything,0446579807,Christopher Hitchens,Barnes and Noble,4.4,Anonymous,Typos galore! RUSH'ed ending with no closure. Not even close to the first book. :(
1294,god is Not Great: How Religion Poisons Everything,0446579807,Christopher Hitchens,Barnes and Noble,4.4,Anonymous,"For someone who LOVED, LOVED, LOVED Fallen too Far, I was SO sad to read the sequel! I waited for months for the release of this book and I was left so disappointed! I agree with the reviews below. I felt like Rush's actions DID NOT support the things he told Blaire. I found it odd that his pregnant fiance had no car, little money and was working at the country club considering his financial status. I was waiting for him to pull a Christian Grey and try to take care of her but aside from buying her a bed, complaining about her bra being too small and cutting a check to Woods for her her rent, he never did. I was rooting for her to give Woods a shot in this book. Of the two of them, he was the one offering support. I also felt like there were no real twists or surprises. We spent the entire length of the book going back and forth between Blaire and Rush on whether they could make their relationship work and nothing really happened. And the ending.... wow! I was waiting for the book to kick into gear and it just ended!"
1294,god is Not Great: How Religion Poisons Everything,0446579807,Christopher Hitchens,Barnes and Noble,4.4,Anonymous,"Actions speak louderthan  words. Rush is constantly giving overblown speeches about how much he loves Blaire but fails to show this in his behavior...other than sex.  Now I am HUGE fan of sex but real love doesn't manifest itself in the physical only.  In real life, kiddos, it really is the little stuff that counts.  Like remembering the dr. appt to see your baby for the first time.  Like NOT screaming at the mother of your child to get out of your car and leaving her alone. Nan is his sister not is child.  I tried to like Rush but I just couldn't.  Blaire pays a lot lip service to being strong and independent but fails miserably to demonstrate either quality."
1295,"Never Too Far (Rosemary Beach, #2; Too Far, #2)",1301627445,Abbi Glines,Barnes and Noble,3.6,DLBaird,"Due to the extensive biblio and fast-paced story by MC, I found this book myth-busting and thought provoking. A solidly contrasting view to the pulp-fiction, believe-what-you-are-told global warming hysteria.  Don't get me wrong.  I believe that we have a grave responsibility to be good stewards for the planet.  It is, after all, the only one in our solar system that *we* can live on.  But I appreciated the reminder to do my own thinking and ask a question or two or ten."
1295,"Never Too Far (Rosemary Beach, #2; Too Far, #2)",1301627445,Abbi Glines,Barnes and Noble,3.6,StarryTwang,"Michael Crichton set out to write this book to confirm the popular notions about global warming.  However, when he started doing the research, he was amazed to find that the data convinced him the global warming theory is a hoax.  He then changed the direction of his book."
1295,"Never Too Far (Rosemary Beach, #2; Too Far, #2)",1301627445,Abbi Glines,Barnes and Noble,3.6,Guest,Do your homework!  Once again Michael Crichton studies an issue and the science behind it and gives an explanation of his research in relatable terms and packs it into an exciting page turner.  A very fair argument to the very controversial issue of global warming. As always with a Crichton novel-a great read!
1296,State of Fear,0061015733,Michael Crichton,Barnes and Noble,4.4,precious_seraph,"I¿ll start by saying this quote from Sea by Heidi Kling: I wanted to tell him that you can meet someone and they can change your life forever, even if you have only known him for a short while¿

That quote was exactly what was manifested in The Statistical Probability of Love at First Sight. But when Hadley met Oliver, she wasn¿t really thinking about that. She was thinking that it was all because of the flight. Midair, people meet people, share stories with them and maybe even share a few secrets with them. But upon landing, they just wave goodbye and walk away forever. Somehow, that was what happened to Hadley and Oliver. They met at the airport, left the airport and went their separate ways. It should¿ve stayed that way for them, like for most people, but in 24 hours time, they managed to develop a connection that was sudden, startling and life-changing.

Hadley went to the airport with annoyance, dread and unwillingness building up inside of her. Her father was going to get married to a British woman she¿s never even met, the same British woman that caused her parents¿ divorce. She was one of the bridesmaids. I love Hadley¿s character. She was honest but considerate and unsure in so many ways but determined. She seemed so real. This girl could be me if I were in that position. For this, it was very easy to like her and to feel for her.

Oliver was an English gentleman. Tall, lanky, handsome with good humor, he was absolutely adorable. Throughout the time he spent with Hadley while waiting for their flight and during the flight, he was pleasing, entertaining and amusing. He was the kind of guy that makes a good impression and that is hard to forget. But I could sense that there was something dark about him, like something was weighing down on his shoulders, occasionally making him hunched, distant and silent.

In London, Hadley went through the motions of preparing for the wedding. She met Charlotte, the British woman who captured her Dad¿s heart. There, she realized the truth about her Dad¿s new phase, the changes in her own life and Oliver. The novel was a grand mixture of musings and flashbacks that brought me closer and closer to Hadley. The flashbacks were vivid and painted with emotion. They were honest and real from the memory of a child. It helped me in connecting the dots and seeing the bigger picture.

The writing was breathtaking. I loved it! I loved how the author transformed that most mundane thing into something beautiful and how she injected little bits of realizations about daily life into the novel. It was like looking at life through a different pair of eyes.

The Statistical Probability of Love at First Sight is an extraordinary contemporary romance born from an extraordinary circumstance. The Statistical Probability of Love at First Sight is brimming with humor, curiosity, love, changes and regrets that will fly readers to the world of possibility, fresh starts and second chances. I highly recommend this to readers of contemporary romance!"
1296,State of Fear,0061015733,Michael Crichton,Barnes and Noble,4.4,Nikkayme,"There are some books that are so perfectly perfect that they make the reader swoon along with them. The Statistical Probability of Love at First Sight is one of those books. It&rsquo;s romantic and heartfelt and so much more than just that &ndash; focusing on more than just the romance and allowing the reader to see true love in more ways than one.

There&rsquo;s still plenty of romance. And it&rsquo;s magnificently done, invoking butterflies and blushes and longing. Brit boy Oliver is sexy (he&rsquo;s British, so obviously he&rsquo;s sexy) and intelligent and quirky and funny and absolutely adorable in his randomness. He makes Hadley&rsquo;s heart race and will do the same to the reader. Considering that a third of the book takes place in an airport/airplane, these two need to have some serious chemistry to keep the reader hooked.

On top of a romance that feels epic, there&rsquo;s the backstory to both Hadley and Oliver. Hadley&rsquo;s family dynamic is so well-crafted that I was there with her, the entire way, partially hating her father, while hoping the two of them could work everything out. The father/daughter relationship has just the right amount of angst and bitterness, then Smith throws in flashbacks of tenderness and undeniable love.

Hadley is everything readers could want her to be. She&rsquo;s young and angry at her father, angry at her mother, but vulnerable and not jaded enough to have a complete disbelief in love. This book had me smiling from that very first page. Jennifer E. Smith knows how to write characters that the reader will feel an instant attachment to, and give us a story that is impossible to put down.

The Statistical Probability of Love at First Sight will sway even the most reluctant romantics with its delightful humor, heartfelt characters, and the idea that maybe love at first sight is possible. Smith&rsquo;s collection of fate, coincidence, and love made me smile, it made me laugh, and it even made me tear up &ndash; it&rsquo;s that good. As far as contemporary YA goes, The Statistical Probability of Love at First Sight is one of the best and a definite must read."
1296,State of Fear,0061015733,Michael Crichton,Barnes and Noble,4.4,Anonymous,OMG!!!!!!!!!!!!!!!!!!!!!!!!!!!!:)best book ever there are soooooo many emotions it makes u want to go to the airport to fall in love
1297,The Statistical Probability of Love at First Sight,0316122386,Jennifer E. Smith,Barnes and Noble,4.4,Guest,"This is the second in the series and I must say that I loved it even more than the original. I like how you got to know more about Kitty and Nathaniel. No wonder Jonathan Stroud said I think in an interview or something that he had fun writing it. It was fun to read and I couldn't help but read the next chapter not realizing what the time was afterwards. That's how good it is. It has action, adventure, suspense, and little romance. Nat sort of still gets on my nerves at times but still love Bartimaeus. Read it after you've read the first of course. There are three stories concerning Kitty (I liked hers better than Nat's to be honest), Nat and Bartimaeus (anything with him in it is awesome either way). Check this series out when you get a chance. Jonathan Stroud is now one of my fave writers."
