book_id,titles,isbn,author,review source,average rating,review author,review content
551,Life After Life,0316176486,Kate Atkinson,Barnes and Noble,3.6,lovelybookshelf,"When I first read the synopsis of Kate Atkinson's Life After Life, I immediately wondered how Ursula Todd would come back to life. Would it be like Captain Jack Harkness in the television series Torchwood, where moments after death she'd revive with a huge gasp for air? Would it be more like the movie Groundhog Day, with all the frustration that came with not being able to escape the loop? Would she be aware of what was happening? Would other people be aware of it happening to her? No matter how many possibilities I envisioned, I was still surprised by the way Kate Atkinson crafted this plot point. It is handled with ingenuity and originality; never cheesy, never trite. I'm purposely being vague here, because I don't want to spoil it for anyone. But I think every time I feel d&eacute;j&agrave; vu in the future, I'll be reminded of this novel...

Much of the story took place in London during the bombings (the &quot;Blitz&quot;) of WWII. These pages were terrifying and heart-wrenching. I would start to feel overwhelmed and think, &quot;Is this ever going to stop?&quot; I'd want to put the book down for a while, and then feel guilty. I'd been reading over the course of only two days, and could take a break whenever I wanted. London had 57 nights in a row of bombings. Atkinson gives readers an incredibly vivid portrayal of war, a poignant and multifaceted look at its enormity and how distressing - and wearying - it is for all involved.

Life After Life is beautifully written and reads like a classic. Wonderfully complex, it's a story you could read over and over and always make new connections.

I received a copy of this book from the publisher via NetGalley in exchange for an honest review. I did not receive any other compensation for this review."
551,Life After Life,0316176486,Kate Atkinson,Barnes and Noble,3.6,Shudro,"I received an ARC of Kate Atkinson's latest book and was not disappointed! Kate wields Ursula's life and her various possibilities like a kaleidoscope; with one simple twist the results are so beautifully different and complex.

From the publisher, &quot;On a cold and snowy night in 1910, Ursula Todd is born, the third child of a wealthy English banker and his wife. Sadly, she dies before she can draw her first breath. On that same cold and snowy night, Ursula Todd is born, lets out a lusty wail, and embarks upon a life that will be, to say the least, unusual. For as she grows, she also dies, repeatedly, in any number of ways. Clearly history (and Kate Atkinson) have plans for her: In Ursula rests nothing less than the fate of civilization.&quot;

Facing the unknown, reincarnation and ownership for our actions or passivity is a fascinating backdrop to this wildly powerful tale that courses through different time periods in England and Europe's 20th century. It was so easy to be caught up in Ursula's many lives; I got the same rush of excitement and anticipation as I did when reading the &quot;Choose Your Own Adventure&rdquo; book series in the 80&rsquo;s as a young girl! I highly recommend &ldquo;Life After Life&rdquo;, as it was thoroughly engaging and engrossing &ndash; which is the marking of a phenomenal book!"
551,Life After Life,0316176486,Kate Atkinson,Barnes and Noble,3.6,Anonymous,"This was a selection for our book club, and I have to say it isn't one I would have picked myself, nor would I read it again.  The premise is very intriguing and the history and writing are well done.  The explanation of the ""deja vu"" and how Ursula moves past a previous obstacle each time she starts over were very well done. However, about halfway through, the story just became mundane, and while a lot of it lended to the history of the time period Ursula lived in, I felt that the more important parts of the plot were lost in boring daily detail. It also became a little jumbled at the end, and i'm not quite sure i really understand what happened or why it happened in the end after all.  If you just want ot give something different a try, a chance to read outside the box, give it a shot. But dont expect a riveting story."
552,The Rescue,0446696129,Nicholas Sparks,Barnes and Noble,4.4,ilovechar,"WOW! This would have to be one of the best books I've read in awhile. I would definitely recommend this book to anyone who enjoys the author or is just looking for a fantastic book, which keeps you on your toes.  picked it up every free second I had. Once again Nicholas Sparks keeps on pleasing his readers.This novel includes all of his writing trademarks, secretive pasts, a new love, tragedy, and a pleasing but shocking end. One day Denise and her speaking impaired son Kyle were in a tragic accident. Then Taylor, a volunteer fireman came along Denise and rescues Kyle. After some time together, they both have to face their pasts in order to make their love for each other to work out. Taylor tries to overcome the guilt of the tragic losses of two important people in his life and learning how to love and stay committed to a woman. Denise learns to let go of her wounded pasts and fears of her mother, Kyle's dad, Kyle, and letting someone get close to him.So in my opinion, from the ones I've read, The Rescue would be one of the best books Nicholas Sparks has written. I would put on my list of my top five favorite books. I loved the book and didn't find one negative thing about it. Every time you turn the page, something more shocking and unexpected happens. More secrets are revealed.If you're looking forward to reading a wonderful romance, then you should read this book. I promise you will love it. It's a wonderful book and ties the plots and characters perfectly together to form a marvelous love story.Read it, and when you finish, you won't be disappointed."
552,The Rescue,0446696129,Nicholas Sparks,Barnes and Noble,4.4,vickytren,omg. this book was great. It was my favorite by nicholas sparks.
552,The Rescue,0446696129,Nicholas Sparks,Barnes and Noble,4.4,Guest,"This coming from a military man, who normally reads macho type books, this book was excellent.  I am thankful for the switch.  After reading The Notebook, I thought I had a new favorite book, til this one.  A good book for everyone to read!"
553,Needful Things,045057458X,Stephen King,Barnes and Noble,4.5,Anonymous,"While working at a bookstore, I decided that I needed to read one sci-fi and one romance novel just to get a feel for the genre. I selected Diana Gabaldon's ""Outlander"" for the romance novel, and was absolutely captivated by her story and style. I devoured the first three books in less than six weeks--an amazing feat for me as a slow reader with sight impairments--and have started at least 200 people on these books since then. I have had exactly two negative reactions.Voyager, as I said above, is my favorite of all the books so far. In the last 300 pages or so, Gabaldon's plot moves at breathtaking speed, tying up many ends. The conclusion is stunning. In a year when real time/distance travel is curtailed by high gasoline prices, the ""Outlander"" series--and ""Voyager"" in particular--is a mental escape of the first order. If you need some place to go on your ""staycation,"" I would strongly suggest Scotland in the mid-1700's, and a visit with Jamie and Clare Fraser. You won't be disappointed."
553,Needful Things,045057458X,Stephen King,Barnes and Noble,4.5,pagese,"At the start of this book, I was afraid it wasn't going to live up to the first two. It took me awhile to figure out why I wasn't liking it as much. While I enjoyed learning about Jamie and Claire after they were separated, it's the two of them together that make this series so special. And then I realized that story of their 20 years apart is important too. As a reader we need to understand how much of an influence they had on one another. That even after 20 years (not to mention 2 centuries), they still hold those outstanding feelings for each other. But, I have to admit, that moment in the print shop was what I was waiting for! This book takes you on a ride. It's not stop action with all that heart stopping romance in between. It's suspenseful, and at times I really wondered if Jamie and/or Claire was going to get out of whatever situation they managed to find themselves in. It had some major shocks and twists in it, things that I was down right not expecting. And, at times I wondered if 20 years of separation was just too much to overcome. At the end of the story, I was left with a book that rivals my first love of Outlander! I was amazed at the story Diana Gabaldon has managed to create."
553,Needful Things,045057458X,Stephen King,Barnes and Noble,4.5,SassaFrass2044,"Voyager was just as addictive as the first two in the Outlander series!  Not as totally indulgent as Outlander....but then again...there's nothing like the first...is there?  With that being said, I was completely satisfied with the plot and the further development of the characters.  She kept the main characters true and human.  I also liked how Gabaldon decided to write about the 20 years in past tense versus taking us through the entire 20 years. Liked all of the new characters.  There was still lots of adventure....although I noticed she lessened with the sex scenes; which I thought was appropriate.  It made the few so much more enduring! Also, even though the characters are 20 years older their passions are just as true...which is true to life.  I could honestly stop reading here (hah! fat chance) because of how Voyager ended.  Although I must say a lot will have to do with the fact that I am totally sleep deprived and on the verge of a divorce (hehehe....slightly compulsive).  My husband keeps saying ""I can't believe I have 3 more books to go!"" However, it's Christmas and if you can't read at Christmas when can you?  I've started my husband on the 2nd book in the series and he is thoroughly hooked - job done!  I will definitely be packing the light blue book for my road trip! Voyager is a great read!"
554,"Voyager (Outlander, #3)",0385335997,Diana Gabaldon,Barnes and Noble,5,Anonymous,
554,"Voyager (Outlander, #3)",0385335997,Diana Gabaldon,Barnes and Noble,5,none,none
554,"Voyager (Outlander, #3)",0385335997,Diana Gabaldon,Barnes and Noble,5,none,none
555,"Hamlet: Screenplay, Introduction And Film Diary",0393315053,"Kenneth Branagh, William Shakespeare",Barnes and Noble,3.6,Anonymous,I got the e book and i could not read it  so disappointed
555,"Hamlet: Screenplay, Introduction And Film Diary",0393315053,"Kenneth Branagh, William Shakespeare",Barnes and Noble,3.6,Anonymous,Would have been good to know it was in Spanish before wasting the money.
555,"Hamlet: Screenplay, Introduction And Film Diary",0393315053,"Kenneth Branagh, William Shakespeare",Barnes and Noble,3.6,Anonymous,
556,Cujo,0307348245,Stephen King,Barnes and Noble,4.2,Anonymous,Great book. I love the story and the sisters are beautifully written. Always read the book before watching a movie. Definitely a rule to live by.
556,Cujo,0307348245,Stephen King,Barnes and Noble,4.2,Anonymous,"wonderful book, writing well done but i dont think its for people who just want to read with out mutch thought. alot like Middlesex"
556,Cujo,0307348245,Stephen King,Barnes and Noble,4.2,Anonymous,"I say first, Eugenides is a great storyteller. Well written, draws you in, descriptive. But this  is not a great story. These boys aren't realistic, holding hands, fretting about the neighbor girls, stealing their stuff (makeup? Shoes?) to idolize it. Weird boys worshipping weirder girls for no apparent reason other than they have to to make the book go. Nothing gets resolved but luckily there wasnt a big mystery to begin with so i didnt care. I felt depressed by the end--i'm not looking for happy endings when i read, but also not looking for anticlimactic absence of caring. I'd read another book from him, but their stoylines seem like real downers too, so no thanks."
557,The Virgin Suicides,0747560595,Jeffrey Eugenides,Barnes and Noble,4.5,Guest,This is a book that I found was really great.  The best of the series.  I couldn't put it down.  And it killed me when I finished it.  It is a book where you don't want the story to ever end.
557,The Virgin Suicides,0747560595,Jeffrey Eugenides,Barnes and Noble,4.5,Anonymous,"I never thought I would enjoy this series, but right from the first chapter of book 1, I was hooked!! This is not the kind of book I would ordinarily buy, but book 1 was given to me by a friend. she had not read it & said she bought it by mistake. I happened to open it up when I had nothing else to read & ""BAM"" I was hooked!! I find Sookie an absolute delight. I love reading about each & every new & different species she manages to come across. She is serious where she should be & light hearted where it's appropriate. I'm so happy that Sookie & Eric get together in this book, since I've always been rather partial to him. I look forward to the other books in this series and I sure hope they all stay as good as the first four. I was not disappointed with this installment."
557,The Virgin Suicides,0747560595,Jeffrey Eugenides,Barnes and Noble,4.5,Heidi-Tieman,"I loved this book.  Eric is my favorite love interest of Sookie's.  Mysterious with a hint of danger.  His sense of humor is so much better than Bill's.  I can't wait to see what happens next now that he has his memory back!  Another great book to an awesome series.  Keep them coming Charlaine!  If you love this series, check out True Blood on HBO.  It strays a bit from the books but still a great show to watch!"
558,"Dead to the World (Sookie Stackhouse, #4)",0441012183,Charlaine Harris,Barnes and Noble,3.8,theokester,"Tess is one of the more depressive novels I've read lately. My wife will attest to the fact that I have a strange affinity to depressing stories. With that in mind, let me say that I really enjoyed this book. 

The writing was at times a bit too much for me for the reason that I get annoyed at many 18th and 19th century novels...namely, that Hardy focuses far too much on minute descriptions and in-depth analysis of setting and location. Don't get me wrong, I love a vivid and lush environment and I much prefer a fleshed out character to a flat one. I just sometimes feel that all of the flowery descriptions slow down the story telling element too much. There were a few paragraphs/pages that I tried to skim through in order to get to the next relevant points of plot. Still, I don't know that I'd want to edit out the descriptive text since it does comment on the narrative itself in a metafictional sort of way. 

The main characters in this book are wonderfully composed. They are absolutely and completely frustrating but they are superbly crafted nonetheless. I wanted to smack each of the main characters on many occasions. 

Tess is far too willing to simply be acted upon and then to bemoan her fate. Alec is an absolute pig (although towards the end of our experience with him, it's debatable just how awful he truly is). And Angel is far too inconsistent to be liked at all...at first he seems almost lovable...then he deserves to be hated...then he seems slightly adequate...then he becomes repulsive again...he's just far too wishy-washy in his behavior and ideals to ever be fully redeemable. 

The story itself falls into the realm of realism taken to its extreme. The plot elements felt almost like the Bible story of Job...whatever could go wrong willgo wrong. And even though Tess was generally found to be almost whining about her circumstances rather than trying to make things better for herself, the story was still rather thought provoking since it makes you wonder just how you would handle horrific circumstances and what can truly be done about them. Is it better to try and solve the problem or better to just let fate and happenstance take its toll. 

Personally, I try to make the best out of any bad situation...perhaps that's why I like ""depressing"" stories...they make me realize my life could be worse and they help inspire me to always think of the best possible outcome. 

I'm sure this book won't be for everyone. Those who want a happy fairy-tale romp through a girl's life would do better to stay away. Those who are easily frustrated by fallen characters, will find themselves hating all of the primary roles in this book. The book isn't terribly lengthy (~300-400?) but some of the longer descriptive passages do crawl by at times. 

Still, I whole-heartedly recommend this book to those who are willing to look imperfection and awful situations square in the face and come away smiling. It's not a happy book. It's not a terribly fast past book (which can also be frustrating...I wanted to shout Just do it to Tess many times). 

But it is a wonderfully rich book and definitely worth getting into."
558,"Dead to the World (Sookie Stackhouse, #4)",0441012183,Charlaine Harris,Barnes and Noble,3.8,HeeHe,"Great book but do NOT buy this eBook edition! The spacing between paragraphs is such that there are at least 4 blank lines. Thus on each page of my Nook, there are maybe 10 lines of text. Not a good way to read."
558,"Dead to the World (Sookie Stackhouse, #4)",0441012183,Charlaine Harris,Barnes and Noble,3.8,Anonymous,"It's absolutely beautiful! I'm in love with this Penguin series. I have collected twelve so far, and I haven't been disappointed."
559,Tess of the D'Urbervilles,0141439599,"Thomas Hardy, Tim Dolin, Margaret R. Higonnet",Barnes and Noble,3.2,cranmergirl on LibraryThing,"While I enjoyed the writing and was entertained by the story, I could not relate to the protagonist of this classic novel in any way.  If Flaubert was truly Emma Bovary, as he famously said, that is quite sad for him!  There was not much to like about her.  She was shallow, pretentious and totally self-absorbed.  Some reviewers have pointed out that Emma Bovary was trapped in a bad situation due to her gender and the social conventions of her time.  While that may be true, there was nothing noble or sympathetic about the character of Madame Bovary.  She continually and selfishly pursued her self-destructive quest for ""love"" while ignoring what was right in front of her the whole time, a husband and child who truly loved her."
559,Tess of the D'Urbervilles,0141439599,"Thomas Hardy, Tim Dolin, Margaret R. Higonnet",Barnes and Noble,3.2,technodiabla on LibraryThing,"This book was a surprisingly easy and quick read (the Francis Steegmuller translation).  Flaubert shows himself to be a master of finding the perfect phrase, perfect term, perfect analogy to describe, well, everything.  But in particular, the female psyche, thought processes, and emotions.  The novel is divided into three parts that more or less reflect the three phases of Madame Bovary's downfall.  After the first I loved her.  After the second you start to think she is pathetic.  By the end you're pretty much through with her-- as is everyone else, except Charles.  Despite this story being known as a tale of adultery, I felt it was more of a cautionary tale of excess and self control.  Her lack of self control-- with money at least as much as with love-- is what led to her downfall.  There are lots of interesting comparisons to Lily Bart and House of Mirth.  (I liked Lily and HoM much better than Emma.)  On the whole I liked the book, especially the writing, but it was hard to muster any sympathy for the characters (except Berthe).  Even Charles, in the end, just fell to pieces and really was the bland weakling that Emma hated him for being.  Also, the end of the book-- post Emma's death-- was odd, like it didn't quite fit.  It seemed like Homais was being demonized but it wasn't clear to me why.  Madame Bovary is a must read for the writing and the novels' influence, but I think there are better similar novels out there."
559,Tess of the D'Urbervilles,0141439599,"Thomas Hardy, Tim Dolin, Margaret R. Higonnet",Barnes and Noble,3.2,cdeuker on LibraryThing,"I read and enjoyed this years ago, but this time I was simply amazed by the quality of the writing.  Physical description, psychological description, comedy, tragedy--a master of it all.  Also a unique book in that there is not one major or minor character who is remotely likable, and yet they are all completely realistic.  What does that say about our world?  (I also wonder--if this book reads as if it has been written by God in translation, what must it be like in the original?)"
560,Madame Bovary,0192840398,"Gustave Flaubert, Margaret Mauldon, Malcolm Bowie, Mark Overstall",Barnes and Noble,4.5,Shanella,"Learning about words and numbers can sometimes be daunting, but Norton Juster makes it fun in the Phantom Tollbooth. Using characters that have something in common with digits or language, the Phantom Tollbooth takes young readers on an adventurous journey in a land akin to Wonderland.  
In my opinion, this book was imaginative, fun to read and well put together.  Overall, it was excellent. Children will be taken on a while adventure and learn a little along the way. A great read for parents and children."
560,Madame Bovary,0192840398,"Gustave Flaubert, Margaret Mauldon, Malcolm Bowie, Mark Overstall",Barnes and Noble,4.5,Anonymous,The first time I heard of this book was back in grade school. I had to do a book report and my mother recommended this book. At first I was hesitant but had no other book option in mind so I decided to give it a go. Years later I still think of this book! It is one of my all time favorites. The story line and characters really come to life. I could not put the book down! I would without a doubt recommend this book to any one of any age
560,Madame Bovary,0192840398,"Gustave Flaubert, Margaret Mauldon, Malcolm Bowie, Mark Overstall",Barnes and Noble,4.5,Anonymous,My friend has read this and she loved it i recommend to a older age like a 5th grader because of the word play
561,The Phantom Tollbooth,0394820371,"Norton Juster, Jules Feiffer",Barnes and Noble,4.7,Mavis1129,"I don't read a lot of fantasy but I loved the Mistborn series and Warbreaker.  You can tell from the start that this book is the beginning of something epic.  The story follows several characters, some so minor, you wonder why they're even mentioned.  Each chapter you get a snippet of what's happened in the past, what's currently happening, and what is going to happen.  Be prepared to get halfway through this 1000 page novel before you really start to see things fall into place and the action to really start happening.  By the time I was finished, I didn't want it to end.  I had misgivings at the start but by the end, I was sucked in.  I HAVE to see what happens next!"
