book_id,titles,isbn,author,review source,average rating,review author,review content
758,Stiff: The Curious Lives of Human Cadavers,0393324826,Mary Roach,Barnes and Noble,4.4,Guest,"My most difficult decision came in 1961   when my husband and I donated our full   term, first born, anencephalic baby, for   scientific research. The doctors said   everything was perfect except it had a   profoundly absent brain. They knew very   little because it wasn't a common   occurrence, and was even less common   to get an opportunity to studying it in   depth. They told us that anencephally   occurs very early in pregnancy, was   caused by nothing we could control, had   never happened to the same woman   twice, that the baby couldn't perform   rudimentary life supporting functions,   death was imminent, and last rites were   performed in the delivery room. Both a   nun and a doctor asked us to consider   releasing the body for scientific research.   Feeling that if I could help prevent   another, even if just one, new mother   from feeling this kind of hurt, then our   experience wouldn't be in vain. So when   the baby expired, I immediately turned it's   body over for research and I gave as   much as I could to the March of Dimes. I   did these things in hopes that another   woman would not have to face what I had.   I've cried many times because some   people either didn't understand or thought   my decision implied I didn't love or want   my baby with all my heart, but I know I   made the right decision. After   having read Mary Roach's book I am   convinced she has insight regarding the   need to help others in a way that I do, one   that is still not readily accepted nor talked   about nearly enough. I do think the last   chapter was a bit weaker than the rest of   the book and although I love humor, the   last part should have ended on a more   serious note."
758,Stiff: The Curious Lives of Human Cadavers,0393324826,Mary Roach,Barnes and Noble,4.4,Anonymous,"That's what you'll be saying the entire time you're reading the book. Yes, it is a nonfiction and it can get a little bit long at some points; but if you stick with it you'll learn so many cool facts the average joe could've never imagined. It answers all those questions you were asking yourself at the last familial funeral. It cures all the curiosities of death, its history, and its future. It is a book that everyone should read at least once! It was the book that helped me decide I wanted to become a pathologist. It was so fascinating and weird I didn't want to put the book down!!"
758,Stiff: The Curious Lives of Human Cadavers,0393324826,Mary Roach,Barnes and Noble,4.4,WY-RALP2,"This book was about the author travling to different parts of the world to understand what people do with different parts of a dead body. This book is full of information and fun, but weird, facts. I enjoyed reading this book because I learned more from it then I thought I was going to. One thing that I found interesting was how people's cells can still react to their emotions even when they are not in the body. They did an experiment where they took some siliva from a patient. They then analyze the cells and how they reacted with the emotions from the patient. Later, the patient was 50 miles away from the lab and was watching a horror movie. The cells still reacted to his emotions even from being that far apart. To me that seemed pretty amazing and is one of the reasons why I enjoyed reading this book. Overall, this was a fun and exciting book to read and I recommened it to anyone who's curious about the human body."
759,"Bloodlines (Bloodlines, #1)",1595143173,Richelle Mead,Barnes and Noble,4.6,skyla11377,"When The Vampire Academy series ended I was sad because I really LOVED those books and got really invested in Rose and Dimitri. When I found out there was a spin-off series I was so excited and couldn't wait to get to read it. Now, I am not going to lie, at first, when I found out the series was focused on the Alchemist Sydney Sage I was a bit disappointed because I was hoping for maybe a story about Lissa and Christian or maybe a book about Adrian Ivashkov and his soul mate. Disappointment soon turned to enrapture, not only did I get my wish (in a way) by having Adrian in this new series but we also got to see some familiar faces like Eddie Castile, Jill ""jailbait"" Dragomir, Abe Mazur, Rose Hathaway, Dimitri Belikov, and Sonya Karp. This book kept me glued from beginning to end. It was actually kool seeing things from Sydney's perspective and getting to know what it is like for her to be an alchemist. I loved how this book had a touch of the Moroi/Dhampir dynamic that I was used to, as well as, a new setting and new situations that kept this book new and familiar all at the same time. Sydney really comes into her own and starts to find her voice in this book. She starts to learn that not everything has to be so regimental and strict. There can be a grey area which can leave her some leeway to be the kind of person she wants to be and not the kind she is expected to be. She always feels she has to walk a fine line between the alchemist way of life and the Vampire world. We also get to see how what Rose did, affects Adrian in this book. The last series all we really saw was the devil may care side of Adrian, but in Bloodlines, we get to see his tortured soul and how he copes with losing his love Rose to another guy. We get some more time with Jill and Eddie which is great too. We get a glimpse into the life of the reluctant princess Jill a.k.a. jailbait (to Adrian). Eddie gets to show us more of his guardian side. So many things happen in this book but I am so afraid to spoil it for anyone who hasn't read this book or The Vampire Academy Series. This book has it all: redemption, danger, death(s), a mystery, first love, unrequited love, enemies, magic, Vampires, mean girls, jocks, etc.... You name it and I bet this book has it....^_^. On a scale from 1-10 I give Bloodlines a 20. Yes, it is off my scale but it is such a great start to this new spin-off series. Richelle really has another runaway hit on her hands, in my opinion. If you are a fan of The Vampire Academy Series you NEED to get this book. If you are new to Richelle Mead you NEED to get to know her Vampires. On your way to picking up Bloodlines you should also pick up Vampire Academy (book #1), Frostbite (book #2), Shadow Kiss (book #3), Blood Promise (book #4), Spirit Bound (book #5), and Last Sacrifice (book #6) in The Vampire Academy Series. Trust me that series and this book will not disappoint."
759,"Bloodlines (Bloodlines, #1)",1595143173,Richelle Mead,Barnes and Noble,4.6,Anonymous,such a good book. it didn't have the omg factor i was used to in vampire academy but it did remind me of the first vampire academy and how it set up for the rest of the books. it was interesting having the characters in a whole different setting than vampire academy and i can't wait for golden lily
759,"Bloodlines (Bloodlines, #1)",1595143173,Richelle Mead,Barnes and Noble,4.6,Anne Knops,I loved the Vampire Acadamy books and this one is a great spin off. A must read with some of the same characters. I loved every minute of if. Can't wait for the next book.
760,"Ender's Shadow (Ender's Shadow, #1)",0765342405,Orson Scott Card,Barnes and Noble,4.6,Anonymous,"Orson Scott Card has created another master piece in his novel, Ender¿s Shadow.  This parallel to Ender¿s Game is remarkably intriguing in the different perspectives and interpretations of Ender Wiggin and the development of Bean.  You are taken on a journey through a boy¿s life who acted Ender¿s right hand man in Ender¿s Game.  Bean, as he is nicknamed, is a homeless child with nothing but violence and his need for learning accompanying him.  Because of his diminutive physicality, he must overcome many situations using only his wits.  Personally I felt that this novel was a close second to Ender¿s Game, although many people may disagree.  Much more action and inner conflict took place in Ender¿s Game, and I feel that it was, personally, easier to relate to.  However, it is still very interesting to see how the much smarter, but more petite ¿shadow of Ender¿ endures his life, and how Ender is portrayed from a different perspective.  His deprived childhood makes this book easy to get into, while his perseverance and advance intellectual mind, as well as the many situations he encounters in Battle School, makes this very easy to continue.  Even if you have never heard of the book Ender¿s Game, this book is still very interesting and very easy to follow.  I would definitely recommend this book to fans of Sci-Fi, and people who just feel like reading a good book."
760,"Ender's Shadow (Ender's Shadow, #1)",0765342405,Orson Scott Card,Barnes and Noble,4.6,Anonymous,"The thinking is highly advanced and makes this book quite an interesting read. I read this after reading Ender's Game, and it is cool how everyhing fits together so perfectly. I would highly recommend this to anyone who doesn't mind thinking while they read. I have read and re-read this numerous times, and will continue to do so in the future!"
760,"Ender's Shadow (Ender's Shadow, #1)",0765342405,Orson Scott Card,Barnes and Noble,4.6,Anonymous,I liked how this book provided another point of view but follows along with the events in enders game
761,Twenties Girl,0385342020,Sophie Kinsella,Barnes and Noble,4.2,Jessi-21,"Twenties Girl: I love the Shopaholic series, and I've read all of her other novels. Twenties Girl is definitely right up there for me as far as Sohie Kinsella goes. It was fun, believable (if you believe :O)) and funny! I enjoyed Lara and Sadie both, and genuinely felt the connection between the two as friends.
On a more serious note, I thought it was wonderful how Lara had never known this person, never bothered with her, then learned so much about her when she met her ghost. It's sad because the older generation is out there, and they hold so much history, and they are so often forgotten about.
Searching for Sadie's necklace only brought her into Lara's life...everything else that came after is where the real story was.
Sophie Kinsella has never disappointed me and she is one of the few authors I will go out and buy as soon as her books are in stock. I absolutely thought this was a fantastic story, and it very much had Sophie Kinsella's touch. I highly recommend it."
761,Twenties Girl,0385342020,Sophie Kinsella,Barnes and Noble,4.2,kuhlcat,"Sophie Kinsella always entertains me with her novels. I walked with Becky Bloomwood to all the shops in the ""Shopaholic"" series, I went along on Lexi's adventures of amnesia in ""Remember Me?"", and I laughed as Samantha goes from being an office flunky to an amateur housekeeper in ""The Undomestic Goddess"". I was thrilled to see this book, ""Twenties Girl"", in the library as a quick read and snatched it right up.

And there was no false advertising. This was a quick read. I was at the library on Thursday, and closed the book after the final chapter today, Tuesday, only 5 days later. I loved it. I devoured it. It was a great way to distract me from any stress or any other issues going on in my life. I needed a quick, light, entertaining read, and Sophie indulged me.

Her characters are just so easy to relate to. I don't know what that says about my life, but it's true. And adding a ghost to the crazy mix was an adventure that I just couldn't pass up. Lara and Sadie make a great pair. Two completely different viewpoints and generations thrown together in one erratic enterprise. Something new happened with each page turn and I was so excited to find out what happened next throughout the whole novel. I love books like this.

I admit it proudly: I love chick lit. Life can be so stressful and ridiculous that it's nice to sit and relax with an easy read and a cup of coffee (or tea, depending on your preference). And if Sophie Kinsella isn't the queen of chick lit, then she should be. All of her books are great, and I recommend any of them."
761,Twenties Girl,0385342020,Sophie Kinsella,Barnes and Noble,4.2,ckelly,"I have read all of Sophie Kinsella's books and always look forward to her next.  Her books are fun - great chick lit.  This one was different though.  Still fun, but the story was deeper.  It was very original.  The main characters Lara and Sadie were well developed and there was such an emotional connection between them.  I laughed (out loud) and cried.   I did not want this story to end!!  Tally ho Sadie - I miss you already!"
762,Schindler's List,0340606517,Thomas Keneally,Barnes and Noble,4.8,Guest,"I WOULD CLEARLY RATE THIS MOVIE AS ONE OF THE BEST EVER MADE (ALONG WITH BAND OF BROTHERS).  (I CONFESS I HAVE A WEAK SPOT FOR WWII MOVIES/BOOKS/ETC.)  HOWEVER, I CAN THINK OF NO MOVIE THAT MORE ACCURATELY AND POIGNANTLY CONVEYS THE PAIN AND SUFFERING OF THOSE TIMES.  THE ONLY THING IT LACKED WAS SHOWING THE SCALE OF THE TRAGEDY---WHICH NO MOVIE COULD EVER DO.  THIS SHOULD BE REQUIRED VIEWING FOR ALL SCHOOL STUDENTS.  THERE ARE FEW MOVIES THAT SHOW THE INHERENT DIGNITY OF SOME PEOPLE AND THE UNBELIEVABLE CRUELTY OF OTHERS.  ESPECIALLY, HOW THE EVIL IN SOME PEOPLE CAN BRING OUT THE HIDDEN GREATNESS OF OTHERS."
762,Schindler's List,0340606517,Thomas Keneally,Barnes and Noble,4.8,Guest,"In the midst of mans' ultimate inhumanity to man comes a true hero in the form of Oskar Schindler. Another of note is Raol Wallenberg....little known, also did what he could to 'get papers' for Jews thus saving their lives."
762,Schindler's List,0340606517,Thomas Keneally,Barnes and Noble,4.8,Guest,This movie was fantastic. Liam Neesons did act nothing short of amazing. This is one of the best movies I have seen in my short life. This has to have been one of Steven Spielberg's best.
763,The Bluest Eye,0452287065,Toni Morrison,Barnes and Noble,4.1,Guest,"This is a great piece in American literature.  What I'm having a difficult time with is why there are so many young 'adults' complaining about the violent/graphic nature of the book. It amazes me that a fantastic, socially concious piece of literature, is considered to be offensive for being sexually graphic, especially when our culture is saturated with sex and violence.  What bothers me, even more than critically unjustifiable opinions, is that teens are completely caught off guard by sexual and violent material that doesnt contain slap-stick humor and apple pies. This book may be 'graphic', but it isnt gratuitous.  If you're focusing so much on the 'graphic' content, you've completely missed the point that Morrison was trying to make."
763,The Bluest Eye,0452287065,Toni Morrison,Barnes and Noble,4.1,lesia_trayonna2012,"Toni Morrison's spectacular, mind blowing, phenomenal classic, is an eye opening realistic adventure about people who hoped and dreamed for something huge to change their life; something to make them bigger, better, stronger, more powerful, and above everybody else. This book was splendid. It was descriptive, and suspenseful. It tells the story of a young girl's inexhaustible journey to feel beautiful, her courage to want more than anybody else like her has ever had, and the will to do it at any cost. 

Little Pecola Breedlove's one and only marvel is to have blue eyes so she will be loved, not just any common blue eyes.the bluest. She comes from a broken family, her father is an alcoholic, her mother is distant, and her brother runs away often. Cholly, her father, never knew his mother or father, and was raised by an aunt until she died. He was found having sex for the first time by two white men and was greatly embarrassed. When he goes on a search for his father, he was frightened, for the man was greatly uncouth. Paulina, her mother, had an ugly foot due to stepping on a nail when she was younger, causing her to have a permanent limp. No person has every paid attention to her. Pecola's family is the talk of the town; people find their misery an entertaining story. Pecola believes she is ugly, and every one else thinks so to, and wants to be like Shirley Temple because she believes she is beautiful; beautiful because she has blue eyes. Pecola's father tried to burn their house down, so she temporarily visits her only friends Claudia and Frieda MacTeer. That is just the beginning for young Pecola, one day Cholly returns home and finds Pecola washing dishes and he rapes her; therefore Pecola becomes pregnant. Her mother does not believe that Cholly raped her and almost beats her to death. Nobody wants and/or expects her baby to live, nobody except Claudia and Frieda. Claudia and Frieda plant Marigolds, and if they grow Pecola will have her baby. During that time Pecola goes to see a man name Soaphead Church, he is known to work miracles; her only request is the bluest eyes. His only response is ""'I am not a magician.' 'If He wants your wish is granted, He will do it.'"". 

 Toni Morrison has an interesting way of bringing out Pecola's role; she is very opinionated for instance she says ""They fight this battle all the way to the grave. The laugh that is a little too loud; the enunciation a little too round; the gesture a little too serious."" She was speaking of her neighbors, and she doesn't think they are the best looking and/or the best behaved people in the world. Which is surprisingly ironic, because neither is Pecola. Morrison is also very descriptive, even when simply describing a dog ""The dog was mangy; his exhausted eyes ran with a sea-green matter around which gnats and flies clustered."" And ""The dog gagged, his mouth chomping the air, and promptly fell down. He tried to raise himself, could not, tried again and half-fell down the steps. Choking, stumbling, he moved like a broken toy around the yard."" 

I highly recommend this book for anyone, not only does it touch basis with a lot of issues that occur to this very day, it tells a story; a story of how a young girl even yearns to be treasured, cared for, and to incorporate. A story of how anybody will passionately go after what they desire."
763,The Bluest Eye,0452287065,Toni Morrison,Barnes and Noble,4.1,Nitzan,This is a short book but is very heavy. You cannot read through it in one sitting because the content of each chapter just hits you in the gut. It is defiantly not a light read but is very touching. Great for book clubs because there is so much to talk about.
764,"The White Queen (The Plantagenet and Tudor Novels, #2)",1416563687,Philippa Gregory,Barnes and Noble,3.9,Anonymous,"I've always thoroughly enjoyed Phillipa Gregory's fabulous historical novels. Ms. Gregory's last series about the Tudors included such titles as ""The Constant Princess"", ""The Other Boleyn Girl"" (remember the great movie from this book?!), ""The Boleyn Inheritance"" &""The Other Queen"" - plus there were two other books that completed this series. Ms. Gregory claims that a chance ""taster"" history class at the University of Sussex started her on the road to penning her lush, well researched books. The only thing that my history classes in college did were to strengthen my passion for both history (history minor) & reading about history - both fiction and non-fiction. I love to read books in a series because they allow you to really develop a good feel for the subjects & the time period. One of the things I enjoy doing when I am reading historical fiction is to research the true facts - people, places, dates - you get the idea. I like to see how far a writer goes to weave a tale around the truth. Ms Gregory generally writes fiction with a strong non-fiction base to which she adds just a pinch of plausible fiction to round out the story. Highly recommended! Get this book!"
764,"The White Queen (The Plantagenet and Tudor Novels, #2)",1416563687,Philippa Gregory,Barnes and Noble,3.9,Oscar_Aguilar,"I have been anxiously awaiting the new Philippa Gregory book THE WHITE QUEEN. Like many, I enjoyed THE OTHER BOLEYN GIRL; however, I didn't exactly love the last book that I read by Ms. Gregory. I was sincerely hoping that THE WHITE QUEEN would love up to all its advance billing. 

While I definitely enjoy historical fiction, I am sadly lacking in knowledge about England and its Monarchy. As a result, I knew almost nothing about the Plantagenets except for a few small things that appeared as side stories in other novels. I can't tell you how much of this story is fact versus fiction; and frankly, I don't even care. I was fascinated by the story Ms. Gregory told about these characters' lives. THE WHITE QUEEN is better than any televised drama or movie I've ever seen. These characters are smart, determined, and ruthless; and I just loved reading about them.

I thought THE WHITE QUEEN had a little bit of everything; and I'm sure there is something in Elizabeth Woodville' s story that will capture your attention. First, THE WHITE QUEEN is just a fabulous historical story about the Cousins' War. There are so many scenes where brother is pitted against brother for control; and the characters involved have absolutely no idea who they can and can not trust. It was a great, suspenseful ride for the reader too! I also thoroughly enjoyed how Ms. Gregory used facts to tell the story while also embellishing the mysteries and holes in the characters' lives to make a very readable story. 

Another part of this story that will keep many readers entertained is the magical and sorcery elements. Elizabeth is said to be the descendant of a mythical water creature called Melusina. Ms. Gregory incorporated the myth of Melusina into the novel and actually used it as a recurring theme/symbol throughout the story. In addition, Elizabeth's mother practiced some examples witchcraft. Some people actually claimed that Elizabeth's mother put a spell on Edward to make him fall in love with her daughter. 

One of my favorite elements of the THE WHITE QUEEN was the love story angle. It seemed to me as if there was a perfect blend of romance and history in this book. Not only did THE WHITE QUEEN show the love affair between Elizabeth and Edward, but this book is also demonstrated the love between mothers and their children. More than once, I was amazed by what women did to protect their children especially in the case of Elizabeth and her sons.

THE WHITE QUEEN would make an excellent book club pick. In fact, if your group enjoys historical fiction like mine does, then you should definitely consider this book in the very near future. One added bonus is that the book is around 400 pages (shorter than many historical novels), and it is not at all overwhelming in scope. There is a great reading guide with fifteen questions that really allow you to delve into Elizabeth's life and her actions.

Another recent read that was just outstanding that you should definitely give a look was I Love Yous Are for White People."
764,"The White Queen (The Plantagenet and Tudor Novels, #2)",1416563687,Philippa Gregory,Barnes and Noble,3.9,harstan,"Everyone is shocked when twenty-seven years old widow Elizabeth Woodville Grey marries the newly crowned King Edward IV; five years younger than her.  He is the House of York while she is the House of Lancaster.  With a twist, her family becomes his greatest loyalist backers while his brother George and his advisor Warwick unite in duplicity to steal the throne.  A third family of cousins the Tudors wait in the wings while encouraging both sides in the dispute.  The War of the Roses begins with the ascension of THE WHITE ROSE as queen.

The key to this super historical fiction is not the often told tale of changing loyalties or heated trysts (a Philippa Gregory norm), but the speculation into Edward and Elizabeth's two sons, the lost princes placed in the Tower by their Uncle Richard.  Clearly researched in great depth, Ms Gregory makes her case plausible based on accepted facts.  Fans will enjoy the epic WHITE QUEEN as history comes alive, but it is the speculative history that makes this a triumph worth reading amidst a sea of novels as cousins go to war with ironically the long term victor being the third family Tudor.

Harriet Klausner"
765,The Autobiography of Malcolm X,0345350685,"Malcolm X, Alex Haley",Barnes and Noble,4.6,Anonymous,"I am a high school sophomore that had a research project for my english class. I personally chose Malcolm X because I have always
wanted to learn about him and how inspiring he is for people of color that want to stand up for themselves from racism. I thought this book 
was very helpful with the questions that I had to answer and it was very well written. It told me about his whole life and how he began to 
become the way he ended up. It talks about from him growing up from an innocent young man living in Lansing, Michigan with a 
widowed mother, to dropping out of school and hustling on the streets of Chicago and Harlem, then to jail realizing his fate with the 
Nation of Islam, and finally to a new leader for the African American race.This book helped me open my eyes on how African Americans 
feel/felt and how badly they were treated by white people but they still looked up to them. Since I am part black, this book made me have 
some thoughts that I have never had before about his beliefs. More than just a couple of times I agreed with him because I still see the 
issues he talks about when some white people are still thinking they're superior to people of color. It has made a huge impact on me 
because it changed the way I think and the way I act. I very much recommend this book to anyone who is interested in learning the true 
feelings and thoughts of Malcolm X."
