book_id,titles,isbn,author,review source,average rating,review author,review content
623,"Mr. Mercedes (Bill Hodges Trilogy, #1)",1476754454,Stephen King,Barnes and Noble,4.2,APratt0414,"I love Stephen King. That has not changed in the 20+ years I've been reading his work. What also hasn't changed is his ability to suck me into a story and bury me so deep that I have lost all sense of time and spatial awareness. I become one with the story and nothing else matters. I can't think, I can't eat, I can't sleep until I am finished living the lives of the people in the book. There is nothing like being immersed in a world that has been created by Mr. King. It is an experience that one does not ever fully return from or fully leave behind. He has perfected his craft so well that each story, each character breaks off a bit and embeds it into your soul for you to mull over, dwell on, and contemplate until your demise. I am happy to let him have those spaces to deposit his leavings as I feel a sense of completeness after each one. It's like he has found missing pieces and is putting them back where they belong. I don't believe that there are any other authors out there that have that affect on me but it doesn't stop me from searching. I almost feel like there is a subliminal message in each of his books that speaks to the innermost part of me, like a nagging voice, &quot;You will read my next story. You will because you need to. You need the drug that I supply.&quot;  It's kind of how I think of tattoos as having a chemical in them that make them addictive. No matter the pain, the time, nor the money lost, as soon as you have the first one, you want another. And every time you get another one, it happens again....the craving is there for another. That is what Stephen King is like for me."
623,"Mr. Mercedes (Bill Hodges Trilogy, #1)",1476754454,Stephen King,Barnes and Noble,4.2,Anonymous,"Very good book , but be aware , there are no supernatural elements in this one."
623,"Mr. Mercedes (Bill Hodges Trilogy, #1)",1476754454,Stephen King,Barnes and Noble,4.2,Anonymous,Stephen King is a fabulous story-teller and writer.  He nails this mystery without any of his trademark horror or supernatural touches.  I would eagerly read ANYTHING he writes.
624,"All Together Dead (Sookie Stackhouse, #7)",0441014941,Charlaine Harris,Barnes and Noble,4.5,supersookiefan,"Every book takes us a little deeper into the relationships in Sookie's life. Bill has betrayed her in every way - she herself realizes that she must move on (of course, every woman never forgets the first love of her life - so be it!). Sookie wants to be first, but that isn't possible with Quinn - hence, his quick departure. There is one man/vampire who has never betrayed her and, although always blunt and sometimes brutal in his truth, Eric has always been there for Sookie and she has proven herself to be his equal in every way. Eric knows this, too, which is why I believe he loves her. I went back and read every book over again carefully and you will see the hints of Bill's betrayal and the beginnings of Eric's support and deep feelings.I'm sure the next book will deal with Sookie's connection to her great-grandfather, and I hope Charlaine Harris will give a true relationship  a chance for Sookie and Eric. Let's see how it works out! I'm sure game!The secondary characters are fabulous and make the whole series - Sam, Amelia, PAM(!), Bubba, and a host of others. I have a feeling we are going to be introduced to some really interesting ""beings"" in the next book, so don't keep us waiting too long, Ms. Harris! Thanks for giving us a wonderful series that I never want to see end!P.S. The only reason I rate the book covers so low is that they make Sookie look like a child and I don't understand that... Sookie would hate being represented that way!"
624,"All Together Dead (Sookie Stackhouse, #7)",0441014941,Charlaine Harris,Barnes and Noble,4.5,Guest,"I love Charlaine Harris' Sookie Stackhouse series. I really liked Quinn in the last book, but in this book we learn that HE has a few secrets that he's not sharing with Sookie, too. I felt the sex scene was too short. It felt like sonething that was checked off a to-do list. However, the best part of the book for me, Eric is definately going to be around more in the future!!!"
624,"All Together Dead (Sookie Stackhouse, #7)",0441014941,Charlaine Harris,Barnes and Noble,4.5,sookielove,"This was another favorite of mine because it had plenty of Eric and Sookie, plus a small amount of jealous Bill. Definitely a must read along with the rest of the series."
625,Midwives,0375706771,Chris Bohjalian,Barnes and Noble,4.1,Morning-Star,"A courageous story of a Vermont midwife attempting to save a mother and her unborn after intensive labor showed no promise of birth, causing a risky health situation for them both.
I believe the point of view this story is told from really impacted my enjoyment and eager interest while reading. Many significant, acute details are smudged and hidden throughout the book, but the author skillfully places them in spots I never seemed to forget. This made it important for complete comprehension. 
It truly is a unique plot that adds momentum as its told and allows the reader to see both points of view, which I think is a big part of the writer's intention for the story. 
I very much enjoyed this."
625,Midwives,0375706771,Chris Bohjalian,Barnes and Noble,4.1,JHiggy23,"I was an English major when I was in college and have read at least a book a week for years.  Midwives was one of the better books I've read in the past year.  It is not a unique story in its construction, but it is unique in its topic.  Some critics have referred to it as the modern To Kill a Mockingbird.  While it certainly is not up to that level (what is?), it is a great book in its own right.

The characters were immediately involving, even if characterization is not extensive.  Bohjalian did a great job of taking me inside the mind of a 14 year old girl witnessing the trial of her mother.  There is no doubt that he has a simplistic but elegant prose style that is both involving and enjoyable to read.

The previous two reviewers really missed the point of the novel, I must say."
625,Midwives,0375706771,Chris Bohjalian,Barnes and Noble,4.1,Guest,"This novel is a must read which narrates the case of Sybil Danfoth, a midwife by heart, who attends the childbirth of Charlotte Bedford on a cold and stormy winter night at Charlotte's Vermont home. Charlotte is a fragile woman who, although tries very hard to push, cannot make the baby crown.   After hours of trying, Charlotte doesn't have any pulse nor heart bit and Sybil, aware that the former has perished, performs a cesarean section with a kitchen knife and accomplishes to save the newborn. Nevertheless, before she does so, she tries to reach both her backup doctor and an ambulance, but she couldn't get through any of them. Sybil also tries to get to her station wagon  however, the freezing climate doesn't permit her to start it. Here commences the story.   The state prosecutes Sibyl Danforth for 'involuntary manslaughter' that could send her to jail from one to fifteen years and no more midwifery, do to what the prosecution calls extraordinary negligence from the midwife.  In addition to this fact, the prosecution suspects Charlotte was not death prior to the cesarean section.   So a trial begins and both the prosecution and defense witnesses declare. The narration and prose in general throughout the novel are outstanding and specifically the recounting of the trial is superb. However, when Sibyl is cross questioned she gives out a clue that might be horrendous for her defense...and so it goes.   The narration of all the comings and goings is done by Sybil's daughter, Connie, a fourteen year old adolescent, in the first person singular. This fact definitely turns into an excellent narrative prose.   I give 5 stars for believable and credible story.  I give 5 stars for excellent narration.  I give 5 stars since I couldn't stop reading till the end.    And, above all, I give 5 stars to the author, Chris Bohjalian since he must have gone through a profound research on trials, midwifery, doctors, and obstetrics, among others."
626,The Polar Express,0395389496,Chris Van Allsburg,Barnes and Noble,4.3,Jillybean226,"I had never read The Polar Express before downloading it on my NOOKcolor. It was a little more money than I'll usually spend on a NOOKbook, but I figured since it was such a classic, I'd give it a try. I am SO glad I got it! The ""Read to Me"" is beautiful. Narrated by Liam Neeson, the audio track has voice, music, and even sound effects. My two-year-old sat through almost the whole story the first time we listened to the ""Read to Me"" together. A wonderful family experience - I highly, highly recommend this book!"
626,The Polar Express,0395389496,Chris Van Allsburg,Barnes and Noble,4.3,DOLORES VASQUEZ,"Everyone knows this is a good story, but why the high cost? Might as well buy the book which will last a life time vs this reader that will eventually be an out dated device. *gave low star rating due to price*"
626,The Polar Express,0395389496,Chris Van Allsburg,Barnes and Noble,4.3,Melissa Clinton,"I agree for an Ebook 18 to 19 dollars is way too much, I didnt buy it, I would have but not for that price. I would rather get in paper."
627,The True Story of the 3 Little Pigs,0140544518,"Jon Scieszka, Lane Smith",Barnes and Noble,4.6,GaGaTX,"This gives a definite new twist to the Three Little Pigs, and lets everyone know that there are always two sides to every story, regardless.  It is all in the perception - and of course who is telling the story.  Great for kids, and fun for adults to read to them.  I have given this book as a gift on many occasions."
627,The True Story of the 3 Little Pigs,0140544518,"Jon Scieszka, Lane Smith",Barnes and Noble,4.6,Anonymous,This is a cute story and very interesting reading the other side of the story! My children loved it!
627,The True Story of the 3 Little Pigs,0140544518,"Jon Scieszka, Lane Smith",Barnes and Noble,4.6,Anonymous,A humorous version of what the wolf was thinking when he came upon the 3 pigs.  A quick and funny read for young ones.
628,"Patriot Games (Jack Ryan Universe, #2)",0425134350,Tom Clancy,Barnes and Noble,4.4,Guest,"Tom Clancy¿s Patriot Games is an excellent example of a political thriller that maintains a necessary human factor that is elemental to the story. This is the tale of Jack Ryan, a former marine and now an American tourist in England who breaks up a terrorist attack on the Prince of Wales, heir to the throne. His intervention saved the Heir¿s life, and drew terrorist attention on him and his family.  	Clancy uses heart-stopping action to keep his readers excited and interested. The first attack and exciting climax are exceptional examples of this. The suspense he creates with Ryan and his family is incredible.  	The main character is Jack Ryan, a former Marine lieutenant who now teaches history at Annapolis. Clancy portrays Ryan as a man who will stop at nothing to keep his family safe. He is a man who stands up for what he thinks is right, and is haunted by his conscience for the actions he takes. He is not a warrior but knows how to use his mind, and his Marine training saves his life as well as the lives of others many times.  	The setting for the story is very valuable to the plot. The terrorists in the story are from Ireland, and are very professional. However, the antagonist, Sean Miller, uses a personal tragedy as an excuse to attack Ryan in America. This book was written in 1988, so terrorism was unheard of in America. If the plot had taken place anywhere else, then terrorism would be an understood threat and wouldn¿t be as exciting or foreign a threat. This is crucial to other parts of the plot.  	Clancy uses a 3rd person point of view to tell the story from all sides. Not only does it show what Ryan is thinking and doing, it also follows the terrorists throughout their training and attempts at retribution.   	Clancy also tells the stories of the inner-workings of international Counterterrorism, and the relationships between the British and American efforts. He does this with many characters that can be identified with. One example of this is FBI agent Dan Murray. He is the FBI¿s man in London and he works with the British MI-5 to apprehend international criminals. The author tells of how Murray¿s closest lead is blown when his wiretap is discovered in the suspect¿s store.  	The way Clancy portrays Ryan is one of the main reasons I enjoyed this so much. However, I would have to see the other side of the coin more. He didn¿t explore the terrorist motivations as much as I would have liked, and if he had dived in a little more into their mindset it would have added a very interesting topic.  	I think that this novel is an excellent read, and kept me interested the whole way through. I am no stranger to Tom Clancy¿s other novels, but I feel that his realism and talent really shined in this novel. I could not put it down, and would highly recommend this book to anyone looking for a good political thriller."
628,"Patriot Games (Jack Ryan Universe, #2)",0425134350,Tom Clancy,Barnes and Noble,4.4,Cymraeg_Draig,"I watched the movie before reading this book, and have to say that this book is far superior to the movie.  Jack Ryan is a well designed character that is easy to relate to and understand.  This book was engaging from beginning to end and was worth more than one read.  A fantastic addition to the series."
628,"Patriot Games (Jack Ryan Universe, #2)",0425134350,Tom Clancy,Barnes and Noble,4.4,salguod,"patriot games is a great read for young adults 14+.
it has a shocking but amazing begining and it is very good for conversations.
the charecters plot theme and everything else is great in this book as in all other tom clancy books."
629,Veronika Decides to Die,0061124265,"Paulo Coelho, Margaret Jull Costa",Barnes and Noble,4.2,hoonew,"If you have ever felt so sad that life didn't seem worth living, this may be a book for you.  Mr. Coelho pulls the reader back and forth through the character's life gradually offering answers to Veronika's mindset and behavior.  I found myself pondering several of these ideas and seeing a sunnier side as an observer.  We get so deeply entrenched into our own views, our own questioning, and society's expectations that we feel alone and overwhelmed in a way.  
Not suggesting to read this if you have suicidal thoughts!  Seek help immediately.  But for many, many of us who have had the dark thoughts cross our minds or have wondered about others who have, this is a great work of fiction that helps draw out reality."
629,Veronika Decides to Die,0061124265,"Paulo Coelho, Margaret Jull Costa",Barnes and Noble,4.2,lc_dakr810lire,"This novel is higly relatable. It's about a woman that dreads and despises her own routine-filled life. She tentatively lives her life day to day consumed with overall feelings of misery and suffers from a severe case of depression. As the title avers, Veronika decides to die, however, she fails attempting to. This novel is a deeply stimulating, eye opening novel. It depicts the life of a troubled woman and how in the end she gains an immense appreciation for her life because she realizes, after all, that life is imminent."
629,Veronika Decides to Die,0061124265,"Paulo Coelho, Margaret Jull Costa",Barnes and Noble,4.2,taty43,"It is a good book, makes you think about your life and the things you really want to do."
630,"Lean In: Women, Work, and the Will to Lead",0385349947,"Sheryl Sandberg, Nell Scovell",Barnes and Noble,4.2,Transplanted_Southerner,"I'm a man, and I picked up this book to see what successful women are doing to see if I might learn something.

Why not pick up a pointer or two from somebody who's gone much further in her career--and with many more obstacles--than I have in mine?

The list of things Sheryl Sandberg has done that I haven't is lengthy. Too many times I've not spoken up when I've had things to say. At work gathering after work gathering I've failed to sit at the table with key decision makers. Time and time again I downplay myself for fear I'll be seen as a self-promoter.

The book reminded me of something I have done, however. I've moved cross country twice on account of my wife's career. Acknowledging that my wife's profession had more upside than my own wasn't easy, and I feel fortunate that none of my family and friends criticized me for supporting her.

Sandberg's book taught me that other men are not so lucky. I knew of the challenges that women face if they choose to assert themselves in traditionally male dominated careers, but I never appreciated the gender based scrutiny and criticism men face when they choose to support them. Husbands and wives shouldn't have to consider gender related stereotypes when deciding who works outside the home and who works in it. Simply pick the best person for the jobs.

I give the book 4 stars instead of 5 because I think it spends too much time telling men and women to remove gender from their decisions and not enough telling them specifically how."
630,"Lean In: Women, Work, and the Will to Lead",0385349947,"Sheryl Sandberg, Nell Scovell",Barnes and Noble,4.2,Anonymous,"As a  young woman entering the business world, I found this book incredibly helpful and relatable. I currently have no marriage 
prospects, but I already have a fear that one day I will have to choose between family and career. Sandberg  made realize that not only 
am I not alone with this concern, but it is also possible to do both. Her insight, advice, and fun stories kept me up long into the night; 
I couldn't put the book down. I am so glad I read this book at such a young age. I highly recommend this book to driven females and
males of all ages.

I also want to comment on a few of the negative posts.  Yes, Sandberg went to Harvard and was the daughter of a doctor. I don't see
how this is relevant. She still had the grades to get into Harvard and had the drive and skills to become successful. Not many people 
will have the same opportunities as she did but every one can relate to the concrete advice she gives you on how to succeed. The fact 
that people are talking about this issue at all is a gender bias. There are plenty of men leaders who were born with a silver spoon but the 
comments on that subject are rare. Secondly, Sandberg does not make any negative comments about mothers who stay at 
home. She mentions many, many times that she respects those women and realizes an executive position isn't everyone's dream. 
This book is for women who want to succeed and want to balance work and family life. This doesn't mean we are better or worse than
the stay at home moms; it simply means we are different. If you do not have the drive to succeed in the business/work/volunteer world, 
this book is simply not for you."
630,"Lean In: Women, Work, and the Will to Lead",0385349947,"Sheryl Sandberg, Nell Scovell",Barnes and Noble,4.2,Anonymous,"I don't normally read career books so it was significant that I was excited to read this one. I enjoyed reading this book which has a lot of examples and plenty of research. By the end of the book, I was encouraged to take a serious look at my career and personal goals and how my own behaviors may be holding me back from attaining those goals. I would recommend this book to all my friends."
631,"Dead as a Doornail (Sookie Stackhouse, #5)",0441013333,Charlaine Harris,Barnes and Noble,4.4,Anonymous,"Wow, I am surprised that this series just gets better and better as you read it. This book makes a shift to focus more on werewolfes and shapeshifters and of course, most of them accept her. We also see a little more from the fairies.The book picks up on the storyline that was laid in book 4. Eric has his memory back, but doesn't remember. Jason has been bitten by a werepanther and is waiting for the first full moon.Someone is trying to kill werewolfs and shifters, the search for Debbie Pelt continues and there are attempts made on Sookie's life. While I would have liked to have seen more with the vampires in this book, we got to see enough of them and the storyline with Eric and Sookie is further developed. (love that) Lots of great and well developed plot in this book.Definetly a page turner and a worthwhile read in this series."
631,"Dead as a Doornail (Sookie Stackhouse, #5)",0441013333,Charlaine Harris,Barnes and Noble,4.4,Anonymous,"After watching 6 seasons of the HBO series based on these books, in many respects I still like the books better (that is, Books 1-10). Unlike most book in a series, I think that the books in this series would make for satisfying stand alone read because the main mystery or mysteries are solved within each book so although the saga continues the books don't end on the typical cliffhanger fashion. Nevertheless, to become truly immersed in the Sookie Stackhouse world I recommend reading the books in order. The reader is again taken on a journey with Sookie through a captivating, humorous and often perilous adventure into the secret world of the two natured and the undead, as well as, the secret thoughts of the living. This edition is filled with loads of action, mystery, danger, suspense and a bit of humor. The writing style leaves a bit to be desired but I love the originality of the plot and the characters so this book, as well as books 1 thru 10, is still primarily a winner in my opinion. Given Sookie's physical attributes, her personality, her zeal for life, her vitality and her special &quot;gift&quot; and heritage I neither find it surprising nor unrealistic or irritating that the supernatural males find her desirable. Besides, it's fantasy people and I for one enjoy Sookie's romantic encounters and almost encounters with such a diverse variety of sinfully sexy and deliciously alpha supernatural males. I always enjoy a sookie book. The characters are great (especially Eric) I love Eric! The crazy situations and things that happen are fun to read about. With mystery and suspense and great characters you can't go wrong!"
631,"Dead as a Doornail (Sookie Stackhouse, #5)",0441013333,Charlaine Harris,Barnes and Noble,4.4,ReadingQueen12-17,"I don't know if Ms. Harris was a little tired after all the effort she put into the first 4 books but book 5 in the Stackhouse series reads like a drawn out afterthought; a little nonsensical and very often dull.  In Doornail there is a sniper on the loose taking out members of the supernatural world.  Sookie endures the usual litany of sticky situations and mortal injuries but this time around the story is extremely diluted with pointless commentary and insufferable podunk metaphors (""my face burned like a pack of fire ants"").  Cue the banjo.     
Furthermore, this book is somewhat hard to follow.  Many of the pivotal characters are people/things that have never before been referenced and there are times when the dialogue is completely without context; ""I turned to Maryelizabeth and her daughter and thanked them for the glass of water.  Maryelizabeth gave me a hostile look and said to her daughter 'We should've never sent you to school'"". What?  What does that have to do with anything?  I very often read after I've had a couple (six) glasses of wine but I have a pretty good recollection of the major action items in this story and Maryelizabeth's daughter's education had nothing to do with anything and while we're at it, who the hell is Maryelizabeth?
I mean, I'm going to continue reading the series (if anything it makes the HBO series more fun to watch) but I sincerely hope later stories have a little more umph."
