book_id,titles,isbn,author,review source,average rating,review author,review content
1259,"Abhorsen (Abhorsen, #3)",0060278250,Garth Nix,Barnes and Noble,4.1,LC112648LC,"I normally race to pick up a James Patterson book.  On this particular book I only read approx 60 pages and was sooo bored that I put it down.  Characters were not enjoyable like they usually are - couldn't bear to waste my time on a book this boring.  Too many good ones to read!  

I love James Patterson and will put the blame on his co writer Peter DeJonge and will be sure not to pick up any of the books with this co author.  I would not recommend this book to anyone."
1260,The Beach House,0446612545,"James Patterson, Peter de Jonge",Barnes and Noble,4.3,Lure,"The book itself was decent, a bit predictable at times, not terribly original in concept.  Kept my interest regardless.

I would describe the story as mostly character driven.  If you're looking for a book with a lush and intricate fantasy world this is not it.  Barely a mention is made of the world at large outside the small boundaries of the castle.

I can't imagine reading it a second time but the first time was a pleasant experience aside from the massive quantity of grammatical errors.  No idea who is copying these books into ebook format but they need to move a little slower I think.  

""his eyes would 'bum' a baleful, hellish red.""  Sorry did you mean 'burn?'

""it would 'bum' off my hand when it went in.""  Sheesh, I guess whoever copied this to ebook format has a fetish for bums or something.

If that sort of thing doesn't bother you and you enjoy a simple read that doesn't make you think too much, I believe you will enjoy this book."
1260,The Beach House,0446612545,"James Patterson, Peter de Jonge",Barnes and Noble,4.3,KimRN30,"This book, while still a dark story, is a completely different type for Mr. King.  I loved it.  Stephen King takes you into a whole new world that somehow feels familiar with all of the other fantasy types stories that are written.  I recommend it, whether you enjoy his writing or not.  You will not be disappointed."
1260,The Beach House,0446612545,"James Patterson, Peter de Jonge",Barnes and Noble,4.3,nhoran,"This was a re-read for me.  Since I first read it years ago, I have recommended it a number of times...especially to those who say, ""Oh, I don't like Stephen King's books."" When the book was published, I recall reading a statement by King that he had written it for his daughter, who at the time was a middle schooler, because he regarded his other books as being too gory for her to read.

Bottom line, it is a classic tale of good vs. evil with richly drawn characters. I enjoyed the second time round as bit as much as I did the first time round."
1261,The Eyes of the Dragon,0751504572,Stephen King,Barnes and Noble,4.3,bookwormTE,Children of dune is a great addition the Dune science fiction series. I really enjoyed reading this book. Leto II is my favorite character in the series after reading this. Children of dune is set 9 years after Dune messiah. Paul and chani's children are 9 years old and have certain memories that they maybe shouldn't about their parents and the past of planet arrakis. This is one of the best in the dune series. I highly recommend it to fans of the series and fans of science fiction in general. Frank Herbert has a unique and great writing style.
1261,The Eyes of the Dragon,0751504572,Stephen King,Barnes and Noble,4.3,Anonymous,"A brilliant novel that takes the universe of Dune, shattered by the sequel, back to its place as the greatest science fiction ever written. Even if you read Dune Messiah and swore you'd never read the third book, you must read this. After many, many times reading the trilogy, it still does not disappoint."
1261,The Eyes of the Dragon,0751504572,Stephen King,Barnes and Noble,4.3,santhony on LibraryThing,"This novel continues the trend after the original Dune, toward deeper, philosophical writing that extends beyond my capacity for pleasure reading."
1262,Children of Dune (Dune Chronicles #3),0441104029,Frank Herbert,Barnes and Noble,4.4,Anonymous,"Wow, from the first to the last page. This science fiction is both detective noir, classic space horror, believable science, space cowboy, and elements building to a great space opera. Usually books only tackle one of these types and this uses them all. The chapter transitions between the main characters was brilliant as the storyline twisted together getting tighter and tighter as you read. You can tell the aurthors really wove and stitched together a great read. Read this book first, then the Butcher of Anderson Station next."
1262,Children of Dune (Dune Chronicles #3),0441104029,Frank Herbert,Barnes and Noble,4.4,deesy58,"This is the first book of the Expanse series.  It is very well written with virtually no editing errors.  The plot is spellbinding, the characters are believable, and the dialog is crisp.  I thoroughly enjoyed this book and I plan to read more of this author's work.  Book Two of the series is scheduled for release in late June of 2012."
1262,Children of Dune (Dune Chronicles #3),0441104029,Frank Herbert,Barnes and Noble,4.4,Anonymous,"Lots of zipping around the solar system. Just the right amount of shooting and destruction. Throw in a little unrequited romance, plus the mysterious aliens and you've got a great classic SF yarn. I could stories like this all day! Had a couple slow chapters here and there, but what book doesn't. I'd recommend it."
1263,"Leviathan Wakes (The Expanse, #1)",1841499889,James S.A. Corey,Barnes and Noble,4.9,Anonymous,"This may very well be my favorite book in exsistence and by far the best book in the series. All the action scenes were so intense I was squeeling and my fingers raw from turning the pages. So many things were happening in this book and the different perspectives let us see the world from everyones point of view. I was happy celeana found new friends who cared for her deeply since it has been a long time coming. My favorite part of this book would have to be all the planning that went into celeanas schemes and everything finally coming into place just as she wanted. You will definitely not regret reading this book and i might as well re read it a few more times until everythin has sunk in. This book will surely have me in a daze for the next few days just thinking about what conspired. One of my favorites, i hope everyone gets a chance to read it."
1263,"Leviathan Wakes (The Expanse, #1)",1841499889,James S.A. Corey,Barnes and Noble,4.9,Anonymous,"Every bit as amazing as the first three books in the series. Sarsh J. Maas has done it again. I had been waiting for this one for a long time, and this book does not disappoint; I highly recommend it. The characters are superb, and the world building is excellent. Can't wait for the next books!

Warning: once you start reading, you will NOT want to stop until the end... sleep or no sleep."
1263,"Leviathan Wakes (The Expanse, #1)",1841499889,James S.A. Corey,Barnes and Noble,4.9,Anonymous,"I am at aww there isn't enough words to describe how awsome these books are. I have never had so many emotion in one book I cryed ,laughed, yelled,and fell in love . I could not sleep I had to keep reading to find out who lived and who died . I was so shock and amazed at the ending. I can't wait to see what Sarah Maas has next for us. (A must read)"
1264,"Queen of Shadows (Throne of Glass, #4)",1619636042,Sarah J. Maas,Barnes and Noble,4.4,APWHSOV,"Art Spiegelman&rsquo;s Maus I and II: A Survivor's Tale
I chose Art Spiegelman&rsquo;s Maus I and II. Maus is the story of the Jews and the Nazis as it pertains to the extermination of the Jewish ghettos within Nazi Germany. The book also analyzes the establishment of a protectorate government within Poland and helped me grasp the political and economic situations of the times via telling the Holocaust as though the Nazis were cats and Jews were mice. The initial situation begins with Vladek. He begins as a well-to-do young man in Poland. Vladek&rsquo;s story is Maus&rsquo;s central theme. This relates back to Spiegelman&rsquo;s description of World War II and Spiegelman&rsquo;s point of view. Vladek begins his story with a description of his affluent lifestyle before the commencement of World War II. He has just married Anja, his father-in-law has helped him set up a factory, and Vladek and Anja have a young son, Richieu. The major conflict lies within Vladek&rsquo;s fortunes change when the Germans occupy Poland. As World War II begins, Vladek is sent to fight, and ends up a prisoner of war. When he is freed, he returns to a Poland that is now occupied by Germany, and thus subject to its laws. Conditions worsen as the Germans confiscate the Jews&rsquo; property, restrict their movements, move them into ghettoes, and deport Jews to the camps. A complication lies when Vladek and his family attempt to hide from the Germans. For a while, Vladek and Anja are able to hide from the Germans in the homes of various Poles. But when they attempt to escape into Hungary, they are betrayed to the Nazis by their handlers. Terrified, Vladek and his family are sent to Auschwitz. At Auschwitz, Vladek and Anja experience the full horror and brutality of the concentration camps. Suspenseful, Vladek tries desperately to survive in the concentration camps. The ever-resourceful Vladek figures out a way to make life a tiny bit easier for himself and Anja in the camps by bartering his skilled labor and his language skills. As the war nears its end, Vladek and Anja are transferred to Dachau, where conditions are even worse than Auschwitz. In the denouement of the book, the war ends and Vladek and Anja are free. With the end of the war, Vladek and Anja reunite in their hometown, Sosnowiec. They emigrate first to Sweden, and then to the United States. Debauched accelerative to the contemporary, anywhere Art chronicles the last confrontations of Vladek&rsquo;s story. In the last scene, we return to the present as Vladek finishes his story to Art. I chose this book as it gave me more insight into the political and economic activities rather than a list of nonsensical facts in a textbook, the easy facilitations of the text, and the 
The time period and the historical events that this book references is situated is during the German invasion of Poland and the Holocaust.  The importance of these events to our historical study is the evolution of genocide and effectiveness of point of view within the recalling and analysis of Maus I and II. This book connects to what we&rsquo;ve learned in class via pertaining to the growth of the genocides and the leading and resulting of World War II.
Art Spiegelman is an American cartoonist, editor and comics advocate based in New York City, best known for his graphic novel Maus. His awards include the Pulitzer Prize Special Citations and Awards. His point of view is majorly for the Jewish and anti-Nazi propaganda as his family and cultural is culturally bonded more to Jews. He see his topic that he&rsquo;s talking about as critical and needed for support as he sees the Nazi Germans as bad and the family connection with is Polish Jewish relatives. He has these views as he heard what his relatives went through and know now what terrible people the Nazis were.    &ldquo;It would take many books, my life, and no one wants anyway to hear such stories.&rdquo; (I.1.14). This shows that Vladek is reluctant at first to participate in Art&rsquo;s project, and as the rest of the book continues, a kind of rivalry develops between them over how to tell Vladek&rsquo;s and Anja&rsquo;s story. &ldquo;But POP &ndash; It&rsquo;s great material. It makes everything more REAL &ndash; more human. I want to tell YOUR story, the way it really happened.&rdquo; (I.1.25). This shows that he was taking down his father&rsquo;s memories and recreating them on the page may not just be a concern with artistic realism, but Art&rsquo;s own attempt to connect with his father on a deeper level. 
This book gave me a deeper insight into this era of world history.  It is from the time period and this tells us about the people during the time the author was writing about political structures and cultural cosmopolitan of Europe. Political structures such as the Polish protectorate of the German lands; economic stability of Poland; and the cultural cosmopolitan of Europe.
I you recommend this book to other students as a good way to learn about this time period of the creation of the German protectorate of Poland as it pertain to knowing the political and economic conditions of the times.  What I found interesting was the use of the Nazis as cats and Jews as mice as it pertains to personified figures reflecting human history The author&rsquo;s writing style and general pace of the book was generally slow. As a graphic novel, it pertains relative to even pace."
1264,"Queen of Shadows (Throne of Glass, #4)",1619636042,Sarah J. Maas,Barnes and Noble,4.4,malydon on LibraryThing,"Interest/Reading Level:  Grades 7 - AdultSynopsis:  This book is a sequel to MAUS.  The book picks up from where the author left off with his father¿s story.  The sub-title is ¿A Survivor¿s Tale, and Here My Troubles Began.¿  Art continues his father¿s holocaust story to find out how he survived.  The book is in a cartoon format with Jews being mice, Poles are pigs, Germans are cats, and Americans are dogs.  Art¿s father, Vladek, is in ill health and his second wife, Mala, has left him to return to their Florida home.  Art and his girlfriend, Francoise, do their best to help Vladek through his health issues and to get his story written down.  Art tapes his father¿s story and later turns it into the graphic novel.  Art learns how Vladek and his mother, Anja, survived during the time they were held in the concentration camps. Vladek and Anja try to escape from Poland to Hungary but are captured and sent to Auschwitz.  Thus begins their life in the concentration camps. Vladek tells his story to Art while moving down to Florida and then returning to New York with Mala. Vladek tells Art that after the liberation, life was still very difficult and reuniting with family was easier said than done.  Toward the end of Vladek telling his story, he gives Art a box of snapshots with picture of family members from Poland.  Art discovers a picture of his father in his prison clothes and says he has to have it for his book. Reflection:  Having read MAUS, I was anxious to read the next book that Art Spiegelman wrote about his father¿s story.  I was not disappointed.  Interestingly enough, the word holocaust is never used in the book.  Rather, Spiegelman uses the phrase ¿Hitler¿s Europe.¿ It is difficult to imagine what horrors Art¿s parents went through in the camps but also what followed after the liberation.  It was not trivial to return home if indeed home was still there.  The terror had a lingering affect on Anja even after immigrating to the United States.  In 1968, whatever her demons were, she killed herself at age 56.  The story is somewhat depressing as Vladek is always complaining except when he tells his Art his story of survival.  That being said, I very much enjoyed how Art tells the story with wonderful art and graphics.  Even his fly leaf biography picture is in a mouse (MAUS) character. This would be a good book to include on a World War II unit of literature along with The Boy in the Striped Pajamas, The Diary of Anne Frank, and The Summer of My German Soldier."
1264,"Queen of Shadows (Throne of Glass, #4)",1619636042,Sarah J. Maas,Barnes and Noble,4.4,MattRaygun on LibraryThing,"Maus II continues the story of Art Spiegelman's Jewish father as he escapes one close call after another in the concentration camps of Nazi Germany. This book begins with Spiegelman's father, Vladek, already in the heart of Auschwitz and retells his gripping story of survival.What can be said about Maus that has not already been said? Art Spiegelman is at the height of his craft in this book. The book was rejected by many publishers at first not only for the fact that it is a graphic novel, but also because the Jewish characters are depicted as mice (The Nazi's as cats, the Americans as dogs, and so on). The motif works incredibly well in this book. The characters as animals give the story a depth as well as removing the reader from the intensity of a story centered around the cruelty of humans.Art Spiegelman's mastery of the graphic novel format is evident throughout Maus II. His panels flow beautifully from scene to scene. The pauses in the action are appreciated not only for the fact that it not only gives the reader a glimpse into the difficulty of writing a book of this magnitude in this format, but also gives them a much needed break in the story of history's greatest mass-murder.This book is so well crafted that it deserves a place in every home. Recommended for ages 11 & up."
1265,"Maus II: A Survivor's Tale: And Here My Troubles Began (Maus, #2)",0679729771,Art Spiegelman,Barnes and Noble,4,Anonymous,"A delighful book that has become a classic.  I read it to my children, my preschool class, and now am sharing it with my grandchildren."
1265,"Maus II: A Survivor's Tale: And Here My Troubles Began (Maus, #2)",0679729771,Art Spiegelman,Barnes and Noble,4,Anonymous,His illustrations alone are worth looking at. This is a classic. I taught for many years and this was a standard during the winter season.
1265,"Maus II: A Survivor's Tale: And Here My Troubles Began (Maus, #2)",0679729771,Art Spiegelman,Barnes and Noble,4,Guest,"Waking up to a white blanket of freshly fallen snow is one thing that can brighten a child¿s day, and it definitely brightened Peter¿s day in the book 'The Snowy Day,' by Ezra Jack Keats. Keats was born in New York on March 11, 1916 and died May 6, 1983. Throughout his life, his mother encouraged his talent, but his father seemed only to criticize his ability. As a child, Keats was artistically gifted and became both a successful author and illustrator throughout his life. In 1943, Keats joined the United States Army, and the army trained him to design camouflage patterns. 'The Snowy Day' is a classic from 1962, and it received the Caldecott Medal for the most distinguished picture book for children in 1963. In this book, a young boy Peter wakes up one morning to discover a beautiful, white blanket of new snow that covered everything outside. Being a young child, Peter was very excited and immediately went outside to explore and play in the snow. He made fun tracks in the snow with his feet, he made a smiling snowman, and he made snow angels. He also pretended he was a mountain climber and slid all the way down it. Before going inside, Peter put some snowballs into his pocket to keep for the next day. He then went inside to his warm house, told his mother about all his adventures, and took a warm bath. Before Peter went to bed, he checked on his snowballs he had put into his pockets. When he looked, the snowballs weren¿t there anymore. They had melted! While sleeping, Peter dreamed that the sun melted all of the snow away. Did the snow really melt or was it just a dream?  This story is simple, yet delightful and the illustrations are wonderful. Keats uses gentle, engaging text which captures the essence of the child in all of us on a snowy day. In the book, Keats writes ¿He pretended to he was a mountain climber,¿ and ¿He climbed up a great big tall heaping mountain of snow ¿ and slid all the way down.¿ This quote from the book not only allows a child to imagine themselves having a great time in the snow, but it also brings out the creative side of children where they can pretend to do anything they want and be anyone that they wish to be. The reading level of this book two, and its grade level is first grade and eighth month. 'The Snowy Day' is a wonderful book for all ages, and it recaptures the excitement of how fun winter truly is. Keats, Ezra Jack. The Snowy Day. New York: Viking Press, 1962."
1266,The Snowy Day,0140501827,Ezra Jack Keats,Barnes and Noble,4.4,risuena,"I was getting disappointed with the last few books; it was starting to get boring.  Obviously, the author's got a formula for this series, and I keep reading to find out which guy Stephanie's going to end up with and for the laughs.  The difference in the books now come down to the delivery, not so much the plot, characters, nor originality.  To my surprise, this book saves the series again.  It's interesting, reminds me of CSI or Castle, very funny, and gets you worked up on Stephanie's love life.  It leaves you finding the next one in the series to read."
1266,The Snowy Day,0140501827,Ezra Jack Keats,Barnes and Noble,4.4,Christy Jenkins,I laughed out loud so many times. This book was very sexy. I cannot wait to read the next one!
1266,The Snowy Day,0140501827,Ezra Jack Keats,Barnes and Noble,4.4,Anonymous,This is one of those books that you don't want to stop reading. Highly recommended.
1267,"To the Nines (Stephanie Plum, #9)",0747267634,Janet Evanovich,Barnes and Noble,4,StuckInYAbooks,"Like any of Emily Giffin's books she makes her readers fall in love with the characters. Written in both Marian and Kirby's point of views, it gave us a better view of each character and their reaction to discovering each other and the secrets behind Kirby's adoption. I just fell in love with the entire book. I have read all of Emily's books and this one does not disappoint because it was addicting and full of emotions and love between all the characters. I read this book in one day!! Its one book that you will not be able to put down! 

The plot was great!! I loved the point of views from both Marian and Kirby because as a reader we see the past, future and what they are both up to after the adoption. Each of the characters were amazing to read about because many people can connect with Emily's writing. I even loved how she showed how Marian and Conrad met on that fateful night as well as falling in love during that great summer as well as discovering the truth of family, as well as finding pieces of yourself showing up on your doorstep. As the story went on the development of each character evolved as they got to know each other better. I really liked Conrad because he was one of those bad boys who is Marian's real true love and despite what was happening Marian did make a choice with her situation (not telling) and then meeting him in the book once Kirby sees him is the most rewarding to read about. 

Kirby is a character many can relate too because as young adults we go through the stages. Her own story is remarkable and her meeting Marian really changes her life because compared to her life at her &quot;family&quot; she never felt that she belonged and related to, but she is a smart, talented girl who would later discover who she is and where she belongs. Marian life has changed ever since meeting her daughter who she gave up for adoption and when these two women meet each other they develop a relationship and this is a different type of view compared to Emily Giffin past writing which makes this book shine!

Where We Belong is one of the best books yet!! I am a big fan of Emily Giffin, because her writing is one of the best out there for those who love romance/contemporary in fiction. I could re-read this book over and over again because its soo memorable to go back and enjoy it again! I am looking forward to many more books by this fabulous author. I also love how she incorporate updates from her past books!! If you love Sophie Kinsella, Meg Cabot this book is for you!! You are missing out on this amazing book!! DEFINITELY A MUST READ!! + the cover is adorable."
1267,"To the Nines (Stephanie Plum, #9)",0747267634,Janet Evanovich,Barnes and Noble,4,booksonmynook,I loved this book. very well written. Good story line with likeable characters. One of fav
1267,"To the Nines (Stephanie Plum, #9)",0747267634,Janet Evanovich,Barnes and Noble,4,diznee25,"I'm a huge fan of Emily Giffin, but she missed the mark on this one.  'Where We Belong' had no &quot;meat&quot; to the characters/story.  This simply could have been a fault of the way it was written; every chapter switching between Marian, and Kirby.  On top of that, it was written in the first person, (for each chapter), so I would forget who I was reading about.  This style worked nicely in the beginning of the book, however, by the middle it just got confusing when both characters were together.  Or maybe there was no &quot;meat&quot; simply because Giffin left it out.  I think it's a combination of both.

I felt as though the characters were robots.  Especially in situations where many of them interact together.  There could have been much more depth, interaction, and drama....but there was none of this!  Made for a very boring book.  As I turned each page, I expected it to get better.  Much to my  dismay, it never did.

Many diehard Emily Giffin fans will probably like this book by default,  but I didn't want to be bias.  As much as it pains me to write a disappointing review, I must give my honest thoughts.  I cringe to hear that there's a possibly of a sequel.  I don't think this story line is strong enough to continue."
1268,Where We Belong,0312554192,Emily Giffin,Barnes and Noble,4.5,lost_in_a_book,"This book was recommended to me after I had commented about non-fiction books that weren't dry and dull.  I picked the book up and read it straight through.  Parts of the book actually creeped me out thinking about what is actually out there around us and how fragile human life really is.  Unlike some books this title reels you within the first 10 pages.  I would recommend this book to anyone who needs information on the Ebola virus or just wants a, 'different read'."
