book_id,titles,isbn,author,review source,average rating,review author,review content
505,"Left Behind (Left Behind, #1)",0842342702,"Tim LaHaye, Jerry B. Jenkins",Barnes and Noble,4.4,Strides,"Absolutely surprised me with how good it was! I balked at reading it at first and put it off for a good year or so before I finally picked it up and I was blown away. It is haunting, creepy, funny, spot-on scripture, romantic, and thrilling. The authors have expertly wrapped fiction around scripture, without losing any of the credibility and viability of Biblical doctrine, rather enforcing it. For those with a spiritual interest in the Rapture and Endtimes prophesies, this book is a must!"
505,"Left Behind (Left Behind, #1)",0842342702,"Tim LaHaye, Jerry B. Jenkins",Barnes and Noble,4.4,Guest,"When I got this book as a present, I had my real doubts. I'm not a person that even likes church, and if I had my choice I wouldn't go, so you could easily see my preconceived ideas of this book, but when I read it and I just couldn't put it down. I was so wrapped up in the plot and the storylines, that at parts I felt like I was one of the characters in the book. Left behind was one of the best books I've read, and now I'm on 'Apollyon.' I can't wait to read, 'Asassans', the conclusion to the end of the earth."
505,"Left Behind (Left Behind, #1)",0842342702,"Tim LaHaye, Jerry B. Jenkins",Barnes and Noble,4.4,chillySM,"I enjoyed the author's style in which he deals with the eventual truth and turns it into fiction. Ironically, this fiction will eventually be truth. This is a well written series. The characters appear to come to life as if they are very real."
506,"The One (The Selection, #3)",0062059998,Kiera Cass,Barnes and Noble,4.6,Anonymous,"Yeah! So excited!!! MaxMerca for the win! I honestly cannot wait to see how this suspenseful romance novel will end. Cass's books keep you waiting in pure self torture of what will happen next. Will America get caught with Aspen, will America decide (finally), or will it be herself for the win. Who knows. Her books are definately a top pick for any romace lover, and also good for ones who likes some sass. Pick these books up, I dare you."
506,"The One (The Selection, #3)",0062059998,Kiera Cass,Barnes and Noble,4.6,Anonymous,"AHHHHHHHHHHHHHHHHHHHHHHHHHHHHHHHHHH. That is really All. I. Can. Say. after reading this. This series is so amazing... I started this yesterday and read for an hour or two. I finished the book at exactly 8:47 tonight. And let me just say one thing, I LOVE YOU MAXON SCHREAVE. Oh and maybe one more thing.... If you have not already, pick up the Selection and stay up all night reading if you must, read the Elite, and finally READ THE ONE!!!! 
  Read. Ok why are you still reading this review instead of reading this series? I thought I had made myself perfectly clear. 
   You. Are. Still. Here. 
                                READ.
Ok that's it I'm done writing now so that I am no longer distracting for those of you who would rather read my review on the most amazing books ever than actuay READING the most amazing books ever. 

              GO AND READ ALREADY.
                                                                         NOW."
506,"The One (The Selection, #3)",0062059998,Kiera Cass,Barnes and Noble,4.6,Anonymous,The first two were absolutly amazing i really encourage you to read them if not read all ready. I am really excited.
508,Nickel and Dimed: On (Not) Getting By in America,0805063897,Barbara Ehrenreich,Barnes and Noble,3.6,Guest,"This book was horrible.  I can't believe that I gave this person money!    The author doesn't bother to really understand what she is writing about.  She is consistently surprised that the poor folks around her aren't impressed with her PhD.... and what's sick is that she doesn't get that a PhD shouldn't impress the working poor.    Why does she feel that she is so much better than everyone else...  why doesn't she bother to find out how the people around her are actually making it work?  How in Gods green can she have problems getting by for ONE month when she has a paid for rental car, $1000 going into the experiment and an income, however meager?  Why does she feel that eating off you lap is a major plight of the working poor that she has to write about it?  Has she never been to a picnic?     The idea was fabulous... it's too bad she ruined it.  Lastly, no real suggestions to solve the problem?  Raise minimum wage?  Doesn't she realize that the cost for product will rise too... and still a worker at Wal-Mart won't be able to afford to shop there?    All I got from this book was that a spoiled child couldn't figure out how to live on less.  Bummer for her.  Fortunately most people on the planet are a little more crafty and intelligent.    Finally, we as Americans only need to look to other countries to understand what poor really is."
508,Nickel and Dimed: On (Not) Getting By in America,0805063897,Barbara Ehrenreich,Barnes and Noble,3.6,Guest,"While the author's experiment is certainly intriguing and even worthwhile, objectivity is quickly clouded by Ehrenreich's opinions on various social issues.  During the brief time she works as a maid, she's pretentious enough to criticize the people who own the homes she is cleaning. She implies that these owners, many of whom she has never met, must be mean, selfish people because they actually own something of monetary value and are paying to have it cleaned.  The possibility that they may have earned money through hard work to buy their possessions never seems to occur to her. Of course, this might have broken her moment of self-righteousness.   Likewise, on page 100, she describes how self-conscious and ostracized she feels about wearing her garish maid's uniform in a supermarket, saying that she's 'getting a tiny glimpse of what it would be like to be black.' In today's society, that is hardly an accurate comparison. If anything, maybe she got a glimpse of how a disfigured or physically handicapped person may feel, but I doubt such people go about their daily routines with the indignant paranoia she displayed.  Granted, there are injustices everywhere in America. However, it still remains the best country in the world for individuals to achieve their goals and attain economic comfort. It is up to the idividual to take the initiative for improvement; no one else can do it for them."
508,Nickel and Dimed: On (Not) Getting By in America,0805063897,Barbara Ehrenreich,Barnes and Noble,3.6,AdditionalReport,"The setting of this book begins in the place at where Ehrenreich lives, Key West, Florida as she decides to start her low-wage life. The plot of this book begins as Ehrenreich is planning her project on how people live in a low- wage life, and the problems that they may come across, like affording a place to live. After leaving her normal life for this project her first task was to find a place to live, since she figured she would probably make around $7 an hour. But once she found a job at Hearthside she found out that her salary was for $2.43 an hour and eventually decided to find another job at Jerry&rsquo;s in order to live. From there she started moving a couple of more times because she could not find to work with such a low-wage and have enough money for the necessities she may have to come across. In her evaluation she explains how housing is really expensive but, wages have not increased. The main character of this book was Ehrenreich the one who was doing the project to experience a low- wage job. There were also many other characters in which she came across when she was working at different places. The theme of this book is poverty because poverty had a great role in Ehrenreich&rsquo;s book throughout the book she demonstrates the difficulty of survival with a low-waged job. She shows that there are so many other people that are actually living their lives with so many limitations and, things they have to sacrifice like health insurance that may eventually leave them in debt if anything ever really happened. Nickel and Dimed, 235 pages."
509,Remember Me?,0593053893,Sophie Kinsella,Barnes and Noble,4,1st-Reader-of-stories,"I Recommend This Book 
    
 Strongly
Remember Me # NetGalley 
D. E. White. ⭐️⭐️⭐️⭐️⭐️

This is the first book I have read by this author, who also uses the name Daisy White. That was confusing and I had to figure it out to review the book. The author needs to use one name and stick with it consistently. There is a lot going on in this book. It all centers around a group of friends who have known each other since childhood. They have a dark secret that they have concealed since their teen age years. The main protagonist, Ava, travels back to Wales to see her ex husband, who is dying of cancer and her son whom she has not seen since he was a baby. That is a mystery right there that bears explaining. A lot of mysterious events start to happen and cryptic notes are left for Ava to figure out. This was a hard book to determine who was responsible for the going ons. I kept switching between who was guilty of each mysterious event and the next chapter I was convinced it was another character. So, it really did keep me guessing. At around 80% of the book, I finally got it right but it didn’t play out until the very end to be sure. The author could have helped out the reader by translating all the Welch phrases used throughout the book. Some she did and some she did not.  This book will keep you invested all the way through and if you like a good mystery, then you will enjoy this book. I read it in one sitting because I couldn’t put it down. ⭐️⭐️⭐️⭐️⭐️

I was provided this advanced copy read by NetGalley and the publisher in exchange for an honest review.  Thank you for this opportunity."
509,Remember Me?,0593053893,Sophie Kinsella,Barnes and Noble,4,toReadistoEscape,"I felt this was an average psychological thriller.  If I wasn't doing a review I am not sure I would have finished the book.

The plot was engaging but could have been more believable. The author didn’t provide much reason for the characters actions.  Therefore, some it was not realistic to me.

  The main character, Ava, could have been a more believable policewoman.  The way the character was developed it was not believable that she was in the police force.  I did not like the writing style of the unknown villain.  I found the parts narrated by the villain “cheesy” and boring. 

I received this galley from NetGalley."
509,Remember Me?,0593053893,Sophie Kinsella,Barnes and Noble,4,Shelley-S-Reviewer,"I have a weak spot for a good psychological thriller and I was drawn to Remember Me as soon as I saw the cover and blurb. My first impression wasn’t wrong: this story without doubt delivered. Remember Me isn’t just another well written suspense story with an intriguing plot and a mystery to unravel though. The development of the characters in general is very realistic and they feel genuine. The writing style is very engaging and makes it really easy to enjoy this story, and the many many plot twists will keep you guessing about what is really going on until the very end. You won’t see the final revelations coming.

With all the dishonesty and the strange, sometimes violent, goings on you can feel the tension slowly building. So much duplicity, so many lies. You will think that you know, but you really won’t. Remember Me is a well written psychological thriller with a healthy dose of mystery and suspense that also manages to incorporate a very important topic realistically while adding an original touch to the story at the same time. There are lots and lots of plot twists as well to keep you busy and all in all it’s a great read. If you like an intriguing and suspenseful read, full of duplicitous characters and mistrust, then you should absolutely give this a go."
510,"The Great Hunt (Wheel of Time, #2)",0812517725,Robert Jordan,Barnes and Noble,4.7,HouseOfReads,"Although I'm sure this book stands alone as a good read, I can only recommend starting from the first, The Eye of the World, and continuing onward. This is a great series; the characters are awesome and you will want to be one of them. The women rock, and are in no way to be confused with drippy, moony, boring, shrieky, ditzy dipsticks with heaving bosoms so common in much of the genre. These gals will kick your sorry bum! Though a fantasy world, the books traffic in the collision of cultures from martial to natural, fundamentalist to liberal and everything in between. It's a really neat way of considering any kind of cultural conflict, in addition to a rip-roaring good story. Pick these books up and dig in to this world!"
510,"The Great Hunt (Wheel of Time, #2)",0812517725,Robert Jordan,Barnes and Noble,4.7,Guest,"Loved this book, but like The Eye of The World, I thought that Jordan gets so verbose in the first couple of chapters, that its hard to get too deeply into his world soon enough to continue on.  The sequence in which Rand is seeking to escape Dal Fara goes on forever and I thought at times that the entire book would be just that.  If he entered one more room and described it down to cracks in the floor, I was going to put the book down forever.  Comparitively, the final battle at Falme, what I thought was some great suspense writing, takes 3 pages at best.  I'm certainly going to continue with the series, but hope that it doesn't bog down again."
510,"The Great Hunt (Wheel of Time, #2)",0812517725,Robert Jordan,Barnes and Noble,4.7,Guest,"Robert Jordan is pure genious!  He is the most amazing author to come into this world.  I have read through his 4th book (The Shadow Rising) and I am never dissapointed with anything that Robert has dished out towards us, the readers.  Among all of his books that I have read so far, I think that The Great Hunt would have to be the most enchanting one yet.  With non-stop action around every corner.  It is truly amazing.  The Great Hunt shows the struggle of a young man chosen to live a life that could mean the end of the whole world if he becomes mad.  He was chosen to be the dragon reborn, followed by some other Ta'veren, who also happen to be close friends of his.  The story  brings new heroes and more amazing events than the first, in this massive story of magical sedai and warriors in this gigantic world of fantasy.  Robert Jordan...Bravo!!!!!!!!"
511,"Postmortem (Kay Scarpetta, #1)",0743477154,Patricia Cornwell,Barnes and Noble,4.1,SusanMA,I have thoroughly enjoyed reading this series.  I started reading in the fall of 2008 and am now re-reading #15 while I wait for #16 to arrive.  I recommend it.  Start with #1.
511,"Postmortem (Kay Scarpetta, #1)",0743477154,Patricia Cornwell,Barnes and Noble,4.1,JessLucy,"This book was so scary that I kept getting up to check the locks on the doors and windows as I was reading it. I love all the novels in the Kay Scarpetta series but this one just sticks with you. The psychological aspect of the plot; the fact that the killer is attacking women not within the same ethnic race; was very fascinating. I could not figure out who the culprit might be and was shocked and disturbed when it was finally revealed. I read this book twelve years ago and the sense of fear still stays with me. If you like this book, you may also enjoy: the novels of Tess Gerittsen, Tami Hoag (A Thin Dark Line, Ashes to Ashes, Dust to Dust), James Patterson's Kiss the Girls, and the true-crime books of Ann Rule."
511,"Postmortem (Kay Scarpetta, #1)",0743477154,Patricia Cornwell,Barnes and Noble,4.1,Anonymous,"I read this book for the first time many years ago, but it is still the best murder mystery I have ever read.  I pull it out at least once a year to read it over and over again.  It is so captivating that I read it straight through everytime."
512,The Complete Stories and Poems,0385074077,Edgar Allan Poe,Barnes and Noble,4.4,Anonymous,Great book and deffinitly worth the money. Poe was a genius.
512,The Complete Stories and Poems,0385074077,Edgar Allan Poe,Barnes and Noble,4.4,mldavis2 on LibraryThing,"Much of Poe rates a 5-star.  I read the complete works which included many early poems, a genre that Poe professed to love, and some secondary early works that lack the polish and sophistication of his masterpieces, hence the overall 4-star rating.  I find Poe somewhat of a humorist with his occasional use of absurd character names and his tongue-in-cheek sophisticated language in many of his tales, including those usually associated with horror.I don't know if I would expect readers to plow through the entire 5-book set of complete works as I did, but as a truly American writer, poet and analyst, Poe has set some benchmarks that led to later writers such as Sir Arthur Conan Doyle's Sherlock Holmes stories and other forensic efforts.  This set is well worth exploring for Poe's influence on later writers."
512,The Complete Stories and Poems,0385074077,Edgar Allan Poe,Barnes and Noble,4.4,Terpsichoreus on LibraryThing,"Not many people outside of literary study or detective fiction fandom realize that the character of Sherlock Holmes was inspired by Poe's Dupin. Dupin was the brilliant and insightful idle noble who occasionally aided the authorities in particularly difficult cases. However, unlike Holmes, Dupin took it up merely as a hobby, mimicking Holmes' brother Mycroft.I'm not fond of Poe's poetry. Emerson's leveling of 'Jingle Man' is appropriate. Poe puts sounds together, but usually says very little with them. It is unusual that his prose was so varied while his poetry tended to obsessive repetition. Poe presents an example of the turning point when poetry ceased to represent the most complex and dense literary form (as in Milton and Eliot) and became the most frivolous and unrefined (the beat poets), while prose moved contrarily from the light-hearted to the serious.When divorced from his single-minded prosody, Poe's mastery of the language elegantly serves the needs of mood, characterization, and action. This is not always the case: his Ligeia retains his poetic narrowness, but his detective stories have a gentleness and wit found nowhere else in his oeuvre.The three Dupin stories helped to inspire detective fiction, using suspense and convoluted mystery to tantalize and challenge the reader. He may not have been as influential or innovative as Wilkie Collins, but his contribution still stands.Any book of Poe's is worth purchasing simply for these three stories. They are studies in the careful use of language to develop mood, character, and drive--even in a sparse plot. They are not quite the equals of Ambrose Bierce's short fiction, but they are solid enough."
513,The Hiding Place: The Triumphant True Story of Corrie Ten Boom,0553256696,"Corrie ten Boom, John Sherrill, Elizabeth Sherrill",Barnes and Noble,4.6,purtle,This book was very good! like awesomely good! It's about a woman hiding Jews in her house during the holocaust and they get caught. She and her family is taken to prison and later put in a concentration camp. It is a very touching and inspirational story. If you want something to read in a cozy chair one rainy afternoon this is the book.
513,The Hiding Place: The Triumphant True Story of Corrie Ten Boom,0553256696,"Corrie ten Boom, John Sherrill, Elizabeth Sherrill",Barnes and Noble,4.6,Anonymous,"We have all heard the story of the holocaust. It was a tragic experience for many and to this day, this black mark on human history haunts the lives of numerous souls. While there are an abundant amount of books about the holocaust, The Hiding Place has a quality in which none of the rest have, or so I have found. It is a story of a dedicated Christian girl living in Holland during the reign of Hitler. While she is initially safe because of her religion and background, her family and her quickly learn how serious it is, to even befriend an undesirable (Jew). The consequences may be worse than death itself. 
	Since it is non fiction, The Hiding Place is incredibly accurate and descriptive of the true happenings of Corrie Ten Boom's life. I absolutely loved the book. It was filled with every emotion imaginable. I found myself laughing one moment and crying the next. There is truly not much to dislike. If anything, I found myself wanting a more detailed account of what happened in parts. Corrie Ten Boom has done an amazing job at recounting her tale. Being in first person, she captures you and you seem to become a part of the Ten Boom family; sharing with all their joy and pain. 
	The Hiding Place is a great book for just about any age. Whether just starting high school, or you have children of your own, it is a book that will engage any audience member. The lesson of forgiveness and courage to stand up for your own beliefs is one any person of any age can learn and gain from. To think of how many people suffered though this tragic experience and lived full productive lives is encouraging. I feel I can now face anything life throws at me with just a little faith and determination. 
	If you enjoy this book or books about or involving the Holocaust, you may also enjoy I Stand at the Door and Knock by Corrie Ten Boom,? A Prisoner and Yet... by Corrie Ten Boom,? and The Diary of Anne Frank by Anne Frank.?"
513,The Hiding Place: The Triumphant True Story of Corrie Ten Boom,0553256696,"Corrie ten Boom, John Sherrill, Elizabeth Sherrill",Barnes and Noble,4.6,Goose315,"This book is about Faith and God's love. Despite all of the horror and evil around them, the ten Boom family never gave up hope and continued to help others to cope with the unjust treatment of people during World War II by sharing the word of a loving God. The Hiding Place is a book about a Christian family who risked their own lives to save as many Jewish people as they could from being hunted down by the Nazis during World War II. They knew that hiding the Jews in their home and later moving them through the secret underground network was against the laws of the land however, it was absolutely the right thing to do as Christians. Their faith drove them to care more about the people who were being persecuted than their selves. When the secret room was discovered and the ten Boom's were sent to concentration camps as punishment, the reader questions God's hand. We later learn that their faith was far more useful in the camps. I could not stand to read how awful the Nazis were. I do not understand why the German public didn't rebel and stop the madness. I was riveted by the graphic tales of the concentration camp life for the prisoners. I also could not stand that the Germans would disguise themselves to catch people going against the law. I think that was a little too far. I liked how the ten Boom's continued to risk their own safety and how they came up with clever codes to protect their Jews and themselves. When they built the secret room, it was amazing how small the room was, and how many people they could squeeze into it. You just knew that only God could have protected them for so long. It was moving to see how God worked through Corrie ten Boom as she became a prisoner and yet, she continued to help others in the camp by referring them to God. I also like how the history of World War II comes to life through this book. You should definitely read this book if you want a real personal view of what life was like for a Christian family during the Nazi era. This is a true story and it is written by Miss ten Boom herself. The Hiding Place is an encouraging book about unending Faith and love during unbelievable times. I haven't read any other of the ten Boom books but, I would like to. My overall rating of this book would be a 4.5."
514,The Adventures of Sherlock Holmes,0192835084,Arthur Conan Doyle,Barnes and Noble,3.7,AZ_ReaderLR,This book was obviously scanned from a book and then posted here.  Many characters were not translated correctly and thus it is very difficult to read.  I guess you get what you pay for!  I would not recommend downloading this book even though it is free unless you e6j0y rea6ing teXt in th15 fo4ma+.
514,The Adventures of Sherlock Holmes,0192835084,Arthur Conan Doyle,Barnes and Noble,3.7,Justin McKinney,"This book is simply unreadable. There is no attempt at typographical consistency or formatting. I am tempted to ask Customer Service how to delete this piece of garbage, and I regret that I cannot give this ebook zero stars. It is a download only diehard Holmes fans without any money to spare should even consider purchasing."
514,The Adventures of Sherlock Holmes,0192835084,Arthur Conan Doyle,Barnes and Noble,3.7,DandelionWine27,"Great book, but the copy quality was so poor it wasn't possible to read."
515,The Prince of Tides,0553381547,Pat Conroy,Barnes and Noble,4.3,PHMMD,"I've read a lot of books, and this one has always topped my list of favorites.  There's something about the way that Pat Conroy writes that just draws me in (I even enjoyed ""My Losing Season"", and I have absolutely no interest in basketball) -- his descriptions can conjure up a place or a person in a way that makes you not just see what he's describing, but really KNOW it.  I have South Carolina in my blood, and this book makes me feel that in a way that really shocked me the first time I read it.  As other readers have said, this book is FAR better than the movie it inspired; it is an absolutely spellbinding piece of literature and one that you can't possibly forget.  I am thrilled that it's now an eBook -- I plan to read it many more times on my nook!  Pat Conroy is my all-time favorite author, and I truly feel that ""The Prince of Tides"" is his best."
