book_id,titles,isbn,author,review source,average rating,review author,review content
785,"Clear and Present Danger (Jack Ryan Universe, #6)",0425144372,Tom Clancy,Barnes and Noble,4.5,IamBrandon,"In Tom Clancy&rsquo;s novel, &ldquo;Clear and Present Danger,&rdquo; a clever and effective series of connected events all play out simultaneously which ultimately lead to a final and spectacular story. The novel begins by introducing several characters. The first is the secret service admiral whose name is Cutter, also known as &ldquo;Lumberjack.&rdquo; Next, it introduces Ramon and Jesus, two foreign men who are at work on the yacht called Empire Builder. Then Sergeant Chavez and his team are introduced as being on a covert mission and riding in a Black Hawk helicopter. 
As the story progresses, you are introduced to many more characters. There is Red Wagner, &ldquo;The king of search and rescue,&rdquo; who is the captain of the ship known as Panache. You learn about the life and military history of Staff Sergeant Domingo Chavez, &ldquo;Ding.&rdquo; Lieutenant Jackson is Chavez&rsquo;s commander and has a brother who works at the Pentagon. Mr. Clark is introduced; he is the CIA&rsquo;s Operations Directorate and a very mysterious man. Clark is not even his real name. You will later meet Ernesto Escobedo, the leader of the Columbian drug cartel, and Felix Cortez, an intellectual and highly trained (KGB) Marxist who works for him. More characters include Daniel Murray, Deputy Assistant Director of the FBI; Jack Ryan, the Deputy Director (Investigation)&rsquo;s special assistant; Moira Wolfe, Executive Secretary of the FBI, who works for Emil Jacobs, the Director of the FBI.It all starts with Ramon and Jesus, who work for the Columbian drug cartel. They have been discovered on the Empire Builder by Captain Wagner. There is hard evidence that points toward brutal and ruthless crime, including rape, murder, and drug smuggling. The crew of Wagner&rsquo;s ship harasses and scares the men. Around this time, United States law enforcement has been harassing the cartel immensely. As a result, the cartel assassinates three important US political officials to send a message. The president, who was friends with one of the men who was assassinated, regards their message as an act of war.
	From that point on, Chavez and his team along with several other branches of the military began to attack the cartel. The attacks result in a large amount of casualties and include a volume of collateral damage. The delightful complexity and authentic devotion to detail is what creates the story&rsquo;s captivation and realistic feeling. Tom Clancy uses several elements of realism in the novel. The characters are depicted realistically, and the larger than life hero is therefore avoided. The details are very unemotional and firm as well. 
	When and after reading &ldquo;Clear and Present Danger,&rdquo; you might contemplate your own political or ethical views. It will have you asking questions that you may not have thought of before. How far must criminal activity go before it is considered a threat to national security? How far can you go with an enemy before it is too far? When is it right for one side to accept that they&rsquo;ve had enough? You may ask all of these or more. All in all, I regard the book to be a pronounced illustration of detailed and suspenseful modern warfare that should be enjoyed by anyone with a taste in outsized; gripping plots that are shaped by layers of weaved contingencies."
785,"Clear and Present Danger (Jack Ryan Universe, #6)",0425144372,Tom Clancy,Barnes and Noble,4.5,Guest,The best book i have ever read. I highly recommend this book to someone who is looking for something action-packed.
785,"Clear and Present Danger (Jack Ryan Universe, #6)",0425144372,Tom Clancy,Barnes and Noble,4.5,Guest,"This was a great book, a thrilling and on the edge of your seat thriller. I was very pleased with how the books accuracy, military wise, was outstanding."
786,Falling Up,0060513098,Shel Silverstein,Barnes and Noble,4.6,Twins13,"I really enjoyed reading Falling Up by Shel Silverstein. My favorite poem was Snow Ball (pg. 11) which is about a child that makes a snowball and puts it to sleep with him. The next day he's all upset thinking the snowball went away and wet his bed. The book has funny poems just like this one. - Javier, 9"
786,Falling Up,0060513098,Shel Silverstein,Barnes and Noble,4.6,ItsTheBookworm,"Shel Silverstein never disapoints me. He is my favorite poet.
I love it because all of the poems are dorky and don't have to be for kids. Must read his poems.(:"
786,Falling Up,0060513098,Shel Silverstein,Barnes and Noble,4.6,Anonymous,"Falling up is a terrific book by Shel Silverstein.  I liked falling up because of the pictures. Shel does not put a lot of work into his pictures. I like the pictures because they go along with the poems and the pictures are funny. Shel makes up a lot of cool characters and words. Some times his poems are hard to under stand. But they are still funny.
I can connect to the poem ""The Runners"" because my parents coach track so I like every thing about track. The poem ""The Runners"" is a funny poem because the coach is a lion. The players say they have a great practice field but they don't because they run on dirt, jump over ditches with spears popping out and have a lion coming behind them.
I do not like the poem ""Long Scarf"" because the boy slipped and tripped and his head got cut off. That just grosses me out. Then he put it back on. To keep his head on he wrapped the scarf around his neck. Then he took it off and his head came off with the scarf. EWWWW.
I like the poem ""Yuck"". I liked this poem because the yuck is like tar. Ont time I got tar on the bottom of my shoe it took FOREVER to get off. I tried to get it off with a stick but the stick got stuck on the bottom of my shoe.so I had to throw them away. This poem is so funny."
787,Sh*t My Dad Says,0061992704,Justin Halpern,Barnes and Noble,4.2,Dawn_Briscoe,Absolutely hilarious ~ I couldn't read it without spontaniously laughing out loud thru-out the whole book.  Also an interesting look at parent/child relationships and a reminder that love can be shown in many different ways.
787,Sh*t My Dad Says,0061992704,Justin Halpern,Barnes and Noble,4.2,TroyP,"I just bought this book and am only about 4 chapters into it and already I have laughed so hard my sides hurt.  I have read some sections to my wife and she too has laughed a lot.  This book isn't for anyone who does not like bad language but if you don't mind it this book will crack you up.  My mother was a lot like the writers dad.  What ever hit her brain often came out her mouth spiced with curse words.  I loved my mom for her honesty and that you always knew where you stood with her.  This guys dad is like that and I think I would love hanging around this out spoken and hard working man. It would remind me of home.

The writing is done in a very friendly way. That is to say you can almost hear the writer's voice in your  head telling you these stories and picture him rolling his eyes and blushing at the antics of his outspoken dad.

It is a very fun read that is just for laughs.  But if you read closely you can also tell that this outspoken man loves and supports his family 100% and no one is more on their sides than he is.  Reminds me of my folks again.  But if you don't want to get too  deep into the meaning of the stories but just need a laugh then this book is great too.

I can see myself rereading this book for a good laugh when I feel like I need one and telling friends about sections of it.

By the way this is my first book review ever. I love books and reading and figure I often like reading what others have to say about a book and thought I would finally put my two cents worth in on something I liked."
787,Sh*t My Dad Says,0061992704,Justin Halpern,Barnes and Noble,4.2,bobertpope,This book has inspired me to reconnect with my father after three years of pointless feuding. Humor has been the only thing to connect us and this book reminds me og our relationship. After I finished the book I gave my dad a call and suggested that he giive it a look. A week passed and my dad called to tell me how much he was enjoying the book. We met up for the first time in three years just to talk about the book. Thanks Justin!!
788,Trainspotting,2020336464,"Irvine Welsh, Eric Lindor Fall",Barnes and Noble,4.6,Guest,"The only book to compare this one to is 'A Clockwork Orange.'  Even Burgess' masterful novel can't compare to this strange, horrifying, visceral, funny, and entertaining knock out.  The characters are lowlifes and, at the same time, sympathetic.  The stories, at first glance, don't look like they flow together, but when Welsh drags you deeper into his depressing, bleak, gallows humour infested world, you feel its correllation.  It seems as if Irvine is a fly on the wall, able to analyze (and sometimes divulge) into the darkness of living.  At times, this book has the same feel of Celine's 'Journey to the End of the Night' with its raging, maniacal prose, in sections, anyways.  Other times it felt like a gothic novel set amidst an industrial wasteland full of sociopaths, heroin addicts, and all around scum bags. Think Wuthering Heights if it were written by Hubert Selby Jr, set in modern day Edinburgh.  Violence is always up in the air, ready to explode at any minute.  It's impossible to set this three hundred page wallop down, despite the fact that you really want to - the uncomfortable truths this aesthetically driven masterpiece exposes is unbelievably disgusting to dissect, but the author pulls you in and doesn't let go.  This assemblage is a nightmare, content wise  there are so many sequences that make you cringe, and if you don't cringe, you're just a sick person, period.  Sure, many people have pointed out how funny the novel is.  Granted, while it is laugh out loud hilarious, it's still terrifying.  This is an admirable feat. Welsh has managed to dig so incredibly deep into the foggy netherworld of the Scottish proleteriat, tearing down a verdigris moss covered wall to discover the restlessly vicious honesty on the other side and, at the same time, still gaze at it through a comedian's lens.  This makes aspiring authors (such as me) hate him with an envy. Each story he manages to end with a sting.  He zaps the reader with rhythem.  The famed phonetic scottish dialect is admirable.  Welsh knows how difficult it is to read, and through the consistent challenge of understanding this prose, the writer makes sure he pummels you with discomforting altruisms on nearly every page.  In a transgressional novel written in plain english, it's easy to skip whatever line you want.  If you don't want to read something, you don't have to.  With this book, you have to.  The honesty is what impressed me most about 'Trainspotting.' Having read thousands of novels, I've never ran across a text that was so originally inventive with getting across incompassionate personalities.  The (second) funeral scene for Tommy was my favorite.  There's an interior monologue for each character attending, and it's simply astounding  it reminds you of how low the human race can go in terms of being unsympathetic and inhumane.  While many would argue that Welsh is by no means a moralist (and I'm not inclined to intensely disagree with this supposition) I think that there is a speck of allegory dotting this map of anarchic nihilism.  It only exists tonally, however.  It's not spoonfed to you in the last couple of pages, a technique that famed author Palahniuk executes in most of his novels.  Upon finishing Trainspotting, I felt like three years had been taken off of my life.  It was a draining, satisfying experience.  You can't really describe the reading of this novel to anyone who hasn't done it  the entire thing is a rollar coaster ride."
788,Trainspotting,2020336464,"Irvine Welsh, Eric Lindor Fall",Barnes and Noble,4.6,Guest,"Trainspotting is probably the best book I have ever read.I love the movie and have watched it about 100 times.After watching the movie I wouldn't expect the book to be like it is.Unlike the movie the book isn't just about heroin.While reading the book I found it hard to believe that the movie was based on the same story.The movie leaves TONS of parts out of the story,but is still a great movie.The thing I enjoyed most about the book was that it let the reader see things from more than one character's point of view.Trainspotting is everything a book should be-it's funny,shocking,and beautifully written.Reading it has changed the way I look at life,I HIGHLY recommend this book to anyone,especially people who love the movie."
788,Trainspotting,2020336464,"Irvine Welsh, Eric Lindor Fall",Barnes and Noble,4.6,Guest,"Steakhorny and dope and behind them the life! Rents was the only one who tried and somewhat went away with a bit of success. Lest, it was junk and rusting for those unsporting and heroin savvy guys. Doping over the death of babies, death of their trust, death of feelings. But only missing the death! I wish things were fiction and screenshow. But what Sick By, Spud and gang went through is a bitter pill to swallow."
789,Foundation and Empire (Foundation #2),0553803727,Isaac Asimov,Barnes and Noble,4.3,Anonymous,I enjoyed the complex fibric of this tale.  I was even suprised by the ending even though I had thought it might be the case half way through.
789,Foundation and Empire (Foundation #2),0553803727,Isaac Asimov,Barnes and Noble,4.3,Anonymous,"Love any book in this series ¿ ¿ ¿ ¿ ¿  ¿ ¿ ¿ ¿ ¿ ¿ ¿ ¿
¿ ¿ &euro; ¿"
789,Foundation and Empire (Foundation #2),0553803727,Isaac Asimov,Barnes and Noble,4.3,RoughEdit,This is the second Foundation Novel I have read in the whole series and it just gets me more excited for the rest. This book really brings into light the tone of the series and where it can go. Honestly Asimov is a genius. :)
790,The Four Agreements: A Practical Guide to Personal Freedom,1878424505,Miguel Ruiz,Barnes and Noble,4.3,Guest,"I am not a 'how to' reader, but I love this book and frequently give it as a gift.  I am also a Christian, while at the same time being open-minded and willing to hear other people's points of view.  The basic 'agreements' do not infringe on my beliefs.  Those that are offended should try not to 'take it personally' (one of the 4 agreements).  If all religions could apply these principles we would be much better off."
790,The Four Agreements: A Practical Guide to Personal Freedom,1878424505,Miguel Ruiz,Barnes and Noble,4.3,Anonymous,"I'm in recovery for Bulimia and my therapist actually recommended this book and I'm so glad she did! I thought it was amazing and everything seemed to hit so close to home. It all seems so simple but he elaborates on all the agreements and really makes you want to follow them.

One person wrote that he says if someone else is angry w/ you or whatever it's their problem, etc. And the reviewer said maybe sometimes it is your fault. I interpreted it differently. He definitely makes it clear that you are in control and if you judge someone or are angry w/ someone, it has to do with you and your beliefs. So he was saying if someone is angry with you it has to do w/ their beliefs, so it works both way. 

I like how he really makes you feel like you are in control. Other reviewers have said it's self centered, but the only thing you can truly control is indeed yourself! So if you life isn't going right, etc then it's most likely you and not any of the things you're blaming."
790,The Four Agreements: A Practical Guide to Personal Freedom,1878424505,Miguel Ruiz,Barnes and Noble,4.3,Guest,"Many people seem to like this book, but I am not quite sure why.  This book is full of very common platitudes and dangerously self-centered ideas.  The main premise of this book seems to be that each person should treat themselves like the center of the universe.  He states that if someone criticizes you or is angry with you, it is because of their own issues, and not you, and therefore you have no responsibility to address it (he terms their feelings and words 'black magic' and 'poison').  Well, sometimes you ARE the problem, and pretending that you are not will not lead you to any sort of 'heaven on earth,' especially for the people around you.  He also contradicts himself (i.e., we are all God but there is also a Creator who is separate - how does that work?), misquotes the Bible to support his statements, and has a tough time staying on topic.   Do not waste your time reading this - find something substantial that will move you to exhibit real love to those around you and to yourself."
791,House Rules,0743296435,Jodi Picoult,Barnes and Noble,4.1,Nancy-Dash,"Jodi Picoult's latest novel is a sensitive and moving insight into the lives of one family affected by Asperger's Syndrome. Jacob is an eighteen year old young man struggling to appear ""normal"" in a world that is NOT yet prepared to welcome him as he is. While unwittingly involving himself in a serious crime, Picoult manages to share with the reader the deepest feelings of his mother Emma, his younger brother Theo, and Jacob himself as he is forced to do the one thing that children with Asperger's find most impossible to do...to make contact with world; and in Jacob's case have his voice heard in our judicial system. Through Jacob we learn what it is truly like to live daily with the painful social isolation, eccentric behavior,and circumscribed passions of someone who struggles to just ""fit in"" and connect to others. From the moment you enter Jacob, Emma and Theo's life, Picoult skillfully teaches us about the pain and pleasure of having an Asperer's child in the family in vivid detail and with powerful imagery. Ironically,with this well written and absorbing novel, Picoult achieves the very contact with the reader that you will wish Jacob and others who struggle with this variant of Autism could do on their own."
791,House Rules,0743296435,Jodi Picoult,Barnes and Noble,4.1,Anonymous,"Jodi Picoult's latest book is redundant of her previous works, with the substitution of Jacob, a young man with Asperger's syndrome, for the character in previous disease (or social ill)-of-the-week plots. It's obvious Picoult's done a lot of research, and she appears to ""nail"" the character of Jacob. It's worth reading the chapters in his voice to learn about the thought process and behavior of a person with Asperger's. The other characters, however, are hardly more than cardboard cutouts. The mother is especially disappointing. How did this woman of strong educational background, great heart, and earnest endeavor, who has worked tirelessly and successfully to champion her son in the bureaucracy of education, do so without finding allies along the way to aid her when facing the challenge of a new bureaucracy in the court system? And how is it that the skills learned in a school setting were so difficult to transfer to the bureaucracy of a court setting? That just didn't ring true. Also, parents who work so hard through the system on behalf of their special-needs children are generally not taken by surprise when the child turns 18 and is considered an adult by the outside world; they work ahead of time to prepare for that eventuality, especially in this day and age when medical personnel can't even discuss care matters of an 18+-y.o. child without a signed release.

My advice: ignore the substandard plot and flat characters of most chapters, and just go for the gold: Jacob's voice. There's much to be learned there from a character worth getting to know."
791,House Rules,0743296435,Jodi Picoult,Barnes and Noble,4.1,harstan,"Emma Hunt has dedicated her life to her son Jacob who suffers with Asperger's syndrome.  Her sacrifice has come with personal lost and cost as her career was pushed aside; her ex-husband Henry the computer programmer left as he worked at home and could not concentrate with the tantrums; and her other son Theo three years younger than Jacob is expected to watch over him when mom cannot, but ignored otherwise by her as he cannot even get his permit.  She lives to protect Jacob and Theo understands that the prime house rule is take care of your brother.

However, her efforts to give her soon a life fall apart when the police charge eighteen years old Jacob with the murder of Jess Ogilvy.  His inability to understand non verbal signs and comprehend social nuances puts Jacob at risk.  Desperate, she hires Oliver O. Bond as Jacob's lawyer.

This is a super look at Asperger's Syndrome, but not just the person suffering from it, but also the impact on family members especially Theo.   The murder mystery tales a back seat even in the courtroom to how Henry thinks and reacts to senses overload, which can be simply crinkling of paper.  Rotating perspective between family members, the lawyer and others, fans obtain a deep look at the total impact of Asperger's Syndrome.

Harriet Klausner"
792,The Complete Grimm's Fairy Tales,0394709306,"Jacob Grimm, Wilhelm Grimm, Josef Scharl, Padraic Colum, Joseph Campbell, Margaret Raine Hunt, James Stern",Barnes and Noble,4.2,Anonymous,"This edition seems consistent in language and style with the old edition I grew up with and is as good to read as ever.  It is translated in the archaic and poetic style of English that relates very closely to the German idiom.  I do wish that the publishers of this ebook had included a frontispiece with information on edition, translation and whatnot to give me more confidence that it is the real thing."
792,The Complete Grimm's Fairy Tales,0394709306,"Jacob Grimm, Wilhelm Grimm, Josef Scharl, Padraic Colum, Joseph Campbell, Margaret Raine Hunt, James Stern",Barnes and Noble,4.2,mbrittain on LibraryThing,"This is a reread for me, as I read a volume of these when I was nine or ten. What always resonates for me is the violence that was in these stories and how lessons were always to be learned for the reader/listener. Stories of comeuppance and knowing ones¿ place in society are in many of the tales, but so are stories of ¿happily ever after.¿ For me, it¿s the sheer volume of stories that is intriguing. It¿s easy to pick a favorite story for however one might be feeling at the time and get a lift or feeling of vengeful satisfaction in the misfortunes of the bad characters that remind us of terrible bosses or the guy who cut us off in traffic."
792,The Complete Grimm's Fairy Tales,0394709306,"Jacob Grimm, Wilhelm Grimm, Josef Scharl, Padraic Colum, Joseph Campbell, Margaret Raine Hunt, James Stern",Barnes and Noble,4.2,chelsiking on LibraryThing,"Although very long, worthwhile for readers for all ages!  These are fun twists on classic fairy tales most of us have heard, & the ones we haven't the reader will fall in love with!"
793,From the Mixed-Up Files of Mrs. Basil E. Frankweiler,0744583276,E.L. Konigsburg,Barnes and Noble,4.4,Guest,"I love the book From the Mixed up Files of Mrs. Basil E Frankweiler by E.L. Konigsburg. It¿s about Claudia and Jamie, the main characters who run away from home because they think they are having too many injustices. They run away to the Metropolitan Museum of Art. They run away with only $24 to live on. They sleep in dusty old beds and hide in the restrooms for many hours a day. They always have excuses why they were caught by the guard. But one time while Jamie was hiding in the men¿s room and he heard the water running. He thought that it was just another visitor but it was a janitor who was wondering why Jamie was there. Jamie, the second youngest can take on any challenge like hiding his things in historical figures. Claudia the oldest of four kids is very intelligent. She is the one who comes up with the plans for everyday, like how many hours to hide in the bathrooms and how many hours they get to sleep so they won¿t get caught by the night guard and how much they should spend on the two meals they get a day. I love this book because it is an exciting adventure about Claudia and Jamie. I haven¿t finished the book yet but I can¿t wait to read the adventure that awaits. It also makes me want to really go and visit the Metropolitan Museum of art in New York. And like I said I highly suggest it."
793,From the Mixed-Up Files of Mrs. Basil E. Frankweiler,0744583276,E.L. Konigsburg,Barnes and Noble,4.4,Snickerdoodle,"The book From the Mixed up Files of Mrs. Bail E. Frankweiler, by E. L. Konigsburg, is a great book because it is funny and gives good detail about the adventures of Claudia and James Kincaid. Claudia loves secrets and Jamie loves challenges. Claudia felt injustice at her home, so she decided to run away. She chose her brother, ""Jamie"", to run away with her because he had a lot of money. They decided to stay at the Metropolitan Museum of Art in New York City. They learned something everyday. When they saw a sculpture called Angel, they were so interested in it because its sculptor was unknown. The two children actually found a clue to whom really made Angel. They sent an anonymous letter to the museum owners to tell them about the clue, but, sadly, the Metropolitan Museum of Art already knew. Claudia and Jamie were so interested in the clue that they actually went to the house of the person who auctioned Angel to the museum. They found out everything at the house: (1) if the work was designed by Michelangelo, (2) if the work was designed, but not done by Michelangelo, or (3) if Michelangelo did not have anything to do with the sculpture at all. In the end, Claudia and Jamie came back home with a story to tell and secrets NOT to be told."
